created_at,author,cleaned_tweet
2022-11-18 18:40:29+00:00,abcdiloveyouf,nomin college au d dingin mau diangetin saat j en o dan j ae m in ngecamp di gunung dingin menerjang buat yang sedi
2022-11-18 18:40:17+00:00,lutfimove,pemagaran dan gapura tpu astana gunung kp nyalindung rt 02 rw 04 kel cicurug kec cicurug lt span cla 19 nov trend whatsapp tender lelang
2022-11-18 18:39:48+00:00,imamtoyib1,promo diskon khans sandal gunung pria wanita lebron black diskon 22 checkout sekarang
2022-11-18 18:38:10+00:00,imjusthumann_,kangen naik gunung
2022-11-18 18:37:25+00:00,UNSfess_,halo mas mbak karanganyar kota atau sekitar bejen nek malem e hujan nanti pagi gunung lawu keliatan ga ya 11fess
2022-11-18 18:36:10+00:00,Noramisah,tmbah lagi jln nk klau gunung tu pon berlubang habis
2022-11-18 18:36:00+00:00,imamtoyib1,promo diskon arsy sport sandal gunung pria jepit abu diskon 33 checkout sekarang ht
2022-11-18 18:35:57+00:00,FacktaWaw,tempat dengan gravitasi terendah ada di gunung nevado huascaran peru sementara yang tertinggi ada di arktika
2022-11-18 18:33:31+00:00,lutfan_mohamad,foto2 yg diambil minggu lalu mengingatkan syair ini tanah tandus kerontang banjir datang itu pasti dr lagunya iwan f
2022-11-18 18:33:19+00:00,SeputarInfoo,pada tahun 1980 reinhold messner mendaki puncak gunung everest tanpa bantuan tabung oksigen
2022-11-18 18:30:30+00:00,joviesantoso,tiba tiba kepikiran gunung lawu apakah akan jadi liburan akhir tahun
2022-11-18 18:28:05+00:00,rpbmk15,kumpulan peralatan pendaki gunung a thread
2022-11-18 18:27:18+00:00,tkngvnyo,foto2 yg diambil minggu lalu mengingatkan syair ini tanah tandus kerontang banjir datang itu pasti dr lagunya iwan f
2022-11-18 18:26:46+00:00,sklorzxootcy,naik gunung camping bareng makan di kaki lima hujan2
2022-11-18 18:23:59+00:00,Martabak_LEGIT,bandung pasteur gunung batu cimahi kebon kopi cihanjuang dago dipati ukur sarijadi tubagus ismail gado bangkong kopo katamso
2022-11-18 18:17:33+00:00,AmirDemokrat,gunung padang
2022-11-18 18:15:55+00:00,thisismnd,bagus bgt meng iri kelas 2 sd cm bisa gambar gunung matahari rumah kotak sama sawah 3 garis
2022-11-18 18:10:16+00:00,Jimmysbastian,kata anak motor calon suami yg ideal itu pembalap kata anak gunung calon suami yg baik itu pendaki ideal amp baikmah nuloba duit blog ah
2022-11-18 18:10:03+00:00,Pimpim694,jarene wus menang keturutan seng di gadang mbiyen nate janji neng saiki opo lali neng nggunung tak suguhi sego jagung yen m
2022-11-18 18:08:57+00:00,vyyaarraa,bismillah demi aksa sayang ku cinta ku kekasih ku jangankan rt dan like menyelami hutan gunung sawah lautan akan ku arungi demi kamu beb bismillah yu sebelum dapet aksa versi rl gedebak gedebuk bucin si paling soto panjang umur tentunya dapet aksa versi buku utk ku peluk
2022-11-18 18:08:29+00:00,pwettymoonlxtte,lucu banget adikmu berbakat akhirnya ibu guru tidak hanya melihat gambar dua gunung sawah dan jalan saja lucu b
2022-11-18 18:08:09+00:00,oyeelia,nomin college au d dingin mau diangetin saat j en o dan j ae m in ngecamp di gunung dingin menerjang buat yang sedi
2022-11-18 18:07:51+00:00,jalanjalandotin,apa kalian percaya mitos tentang hal hal yang berada di alam liar mungkin salah satunya gunung
2022-11-18 18:05:38+00:00,hartantiwuri_,foto2 yg diambil minggu lalu mengingatkan syair ini tanah tandus kerontang banjir datang itu pasti dr lagunya iwan f
2022-11-18 18:04:59+00:00,apankkkk,sampe detik ini masih pgn tinggal di desa deket pantai gunung sambil menggembala sapi kemana2 naik kuda tp orngnya suka jajan
2022-11-18 18:03:38+00:00,KewelL05327995,terwakili usutsampaituntas usuttuntas aremania prayforkanjuruhan yogyakarta gunung semeru dadang sepakat
2022-11-18 18:01:02+00:00,KupasGundah,ku takkan dpat meraih puncak gunung jika ku tak mampu taklukkan dinding terjal dibawahnya kupasgundah semangat
2022-11-18 17:59:58+00:00,isnotdetected,nomin college au d dingin mau diangetin saat j en o dan j ae m in ngecamp di gunung dingin menerjang buat yang sedi
2022-11-18 17:59:09+00:00,17syoonjh,ada di gunung yang
2022-11-18 17:57:40+00:00,lockeyboy2504,lockey sudah saat nya turun gunung dan menguasai vote tap show champion the show
2022-11-18 17:55:59+00:00,GhombunShmily,gunung ciremai dari sisi majalengka jawa barat
2022-11-18 17:52:09+00:00,FajarMoenir,gunung merapi
2022-11-18 17:52:03+00:00,Risthaqueen,menuruni gunung memang lebih mudah daripada mendaki tetapi keindahan bukan terlihat di bawah melainkan pada puncaknya
2022-11-18 17:49:19+00:00,kepikberteriak,apakah aku pensiun dini saja dari dunia persilatan lalu ngilmu kultivasi di pucuk gunung
2022-11-18 17:49:04+00:00,PENJUALBARANG3,kumpulan peralatan pendaki gunung a thread
2022-11-18 17:48:26+00:00,HutanTropisss,kumpulan peralatan pendaki gunung a thread
2022-11-18 17:45:58+00:00,brandproduk,10 sepatu sendal gunung link
2022-11-18 17:43:52+00:00,SpillRacunOOTD,footprint sandal wanita gunung camani01 4 7
2022-11-18 17:43:08+00:00,Tlaksas,jarene wus menang keturutan seng di gadang mbiyen nate janji neng saiki opo lali neng nggunung tak suguhi sego jagung yen mendung tak silihi caping gunung
2022-11-18 17:42:19+00:00,brandproduk,kumpulan peralatan pendaki gunung a thread
2022-11-18 17:38:58+00:00,JustJulyo,first momen ngebolang ke situ gunung suspension bridge melewati jembatan gantung lalu menyanbangi curug fenomenal yang ada disana andai saat itu udah pake 50mp triple camera galaxy a04s pasti hasil fotonya lebih awesome ceritaawesomepertama pastiawesomeduluan galaxya04s
2022-11-18 17:37:52+00:00,jalanjalandotin,sudah berapa gunung yang kalian daki yang merupakan bagian dari seven summit
2022-11-18 17:36:37+00:00,M_MisbahulUlum,foto2 yg diambil minggu lalu mengingatkan syair ini tanah tandus kerontang banjir datang itu pasti dr lagunya iwan f
2022-11-18 17:35:46+00:00,relltarded,tips tau bobroknya pasangan sebelum nikah ajak naik gunung
2022-11-18 17:35:27+00:00,elangraditya,kwowkwowk perbaikan jalan gunung kidul kah
2022-11-18 17:34:51+00:00,a7ibayu,motor diciptakan untuk dua tujuan 1 berjalan sejauh mungkin melewati hutan laut dan gunung gunung 2 menemukan saudara saudara baru di perjalananmu berjalanlah menjadi lelakilah
2022-11-18 17:34:11+00:00,SutanParabo,di tangah malam nan langang terdengar laungan gunung mencetus sanubari sehingga hasrat duduk menjongkok membuat ku ingin sekali cirik ciek lu
2022-11-18 17:32:46+00:00,si_gembira,andakasa sepi ndeso munggah gunung ming ono bakul minuman le ku jajal arak wingi ng parkiran takon2 trus ditawani kon jajal
2022-11-18 17:30:27+00:00,black_abu2,sejak ada android minat baca saya terjun payung sudah lupa kapan terakhir ke gramedia atau gunung agung padahal dulu bisa dari mall buka sampe mall nutup pegawai sampe apal muka gw langganan penyewaan buku di deket rumah tapi klo langganan komik klo buku atau novel beli
2022-11-18 17:29:10+00:00,ChocciH,mungkin bapaknya pedanda yang tinggalnya deket gunung makanya tinggi mungkin gitu maksudnya
2022-11-18 17:28:00+00:00,TiketPesawat_1D,dan jika gunung ini tak di jaga maka marahlah gunung itu
2022-11-18 17:27:14+00:00,kodim1009Tla,dandim 1009 tanah laut hadir di desa gunung melati
2022-11-18 17:26:03+00:00,RumasaHendi,pandangan yg sempurna samping danau ada gunung kembar
2022-11-18 17:25:15+00:00,feaudacity,jakarta gue syei kudu nyebrang gunung
2022-11-18 17:24:46+00:00,Kandar85939000,ohhh gunung kembar sama gua terlarang mu dingin
2022-11-18 17:24:17+00:00,juntasipil,foto2 yg diambil minggu lalu mengingatkan syair ini tanah tandus kerontang banjir datang itu pasti dr lagunya iwan f
2022-11-18 17:21:16+00:00,psiUI23,sebesar gunung
2022-11-18 17:20:33+00:00,nikotogi,walaupun eijun dh sembuh tapi jalan nya eijun kek mendaki gunung jalannya ada lumpur terjal terus gunungnya meletus ada ada aja soalnya mangakanya pakdhe
2022-11-18 17:20:26+00:00,leadrkive,kalau gunung harus siap siap bawa sweater sama kontak mamang villa
2022-11-18 17:17:45+00:00,Bojonejihyooo,gunungkidul sik manggone gunung wae banjir soyo meneh sing ngisor stay safe everyone
2022-11-18 17:15:50+00:00,SaryantoBudiman,good luck mau tidur dulu besok mau ke gunung salak kangen pura gunung salak
2022-11-18 17:15:17+00:00,tobeerrrrrrr,foto2 yg diambil minggu lalu mengingatkan syair ini tanah tandus kerontang banjir datang itu pasti dr lagunya iwan f
2022-11-18 17:15:16+00:00,sitiwae11,promo diskon arsy sport sandal gunung pria jepit abu diskon 33 checkout sekarang ht
2022-11-18 17:12:53+00:00,capekracers,aduh cuacanya jadi pengen naik gunung
2022-11-18 17:12:45+00:00,dindaajeng_,naik gunung camping bareng makan di kaki lima hujan2
2022-11-18 17:12:30+00:00,LVCIFERRRR,lagu top tidur saya slow k pop mandarin pop atau raw black metal atau akustik nax gunung bon iver novo amor dkk atau nggk dangdut koplo new pallapa siapa tau ada rekomen lagu favorit tidur kalian ges dishare
2022-11-18 17:11:07+00:00,unstablethink,pengennnnnnnn bgt naik gunung tp gw takut jadi beban wkwk
2022-11-18 17:11:04+00:00,astaralatte,35 jujur emang enak kopinya ngga bikin giung harganya 11 12 sama cafe di daerah cibubur terus kalau mau malem jangan naik motor jalannya sepi banget padahal baru jam set 7 asli aku dulu disasarin sama gmaps ke jalan perkampungan naik gunung gitu mana gelap banget
2022-11-18 17:10:57+00:00,emfik10,spill video pas kena badai di gunung dong
2022-11-18 17:08:05+00:00,Sheikhuzaifah,kami mohon sampaikan pada para pengundi dun n11 gunung semanggol beri satu peluang pada utk dia berkhidmat ka
2022-11-18 17:07:51+00:00,jalanjalandotin,pendakian gunung mana di indonesia yang menurut kalian paling berkesan mendakigunung di indonesia
2022-11-18 17:07:11+00:00,tavendr,tinggal di gunung punya kebun sayur buah dan hidup dengan damai
2022-11-18 17:05:01+00:00,SamsulH62511221,naikin gunung aja bayar massak km gratis si
2022-11-18 17:02:43+00:00,christianbosar,gunung batu kapan ga macet bajingan
2022-11-18 17:02:35+00:00,IklanBalikpapan,beberapa rumah warga di kawasan klandasan kampung timur gunung sari dan sekitarnya mengalami kerusakan akibat diterjang angin kencang
2022-11-18 17:02:34+00:00,IklanBalikpapan,atap rumah warga jalan wijaya kusuma rt 33 kelurahan gunung sari ilir ambruk kena angin kencang jumat 18 11 malam sekira pukul 21 25 wita piket pammat dan bpbd serta relawan di tkp membantu penanganan sebelumnya angin kencang melanda wilayah kota balikpapan dan sekitarnya
2022-11-18 17:01:03+00:00,bangtancin,jungkir balik ngalor ngidul naik gunung turun lembah and still made 0 point ckckck
2022-11-18 17:00:59+00:00,kyungpyoo,foto 1 2 gunung manaaa
2022-11-18 17:00:54+00:00,nisakhrniii,persis banget nder tapi kalau aku di daerah gunung sindur bogor perumahan subsidi juga kalau aku direcokin dan dibikin ngga nyaman gitu buat tinggal di sana karena ngga pakai jasa mereka jahat banget deh pokoknya
2022-11-18 17:00:37+00:00,lovedive69,anjay vibesnya kea anak gunung bromo kl ga mt prau
2022-11-18 16:58:45+00:00,Sabrina_Kiki_R,lucu banget adikmu berbakat akhirnya ibu guru tidak hanya melihat gambar dua gunung sawah dan jalan saja lucu b
2022-11-18 16:57:57+00:00,gusta_ahmad,kak gusta aktivis jl kartika no 2 rt 002 rw 02 komp kemhan mabes tni kelapa dua pasir gunung selatan cimanggis depok 16451
2022-11-18 16:57:41+00:00,nisakhrniii,sumpah ini relate bgt aku harus speak up karena kita senasib di daerah gunung sindur kab bogor ada juga kasus serupa dan jujur kasus ini meresahkan banget premanisme berkedok tukang
2022-11-18 16:57:13+00:00,fcxlv,kangen naik gunung hehe
2022-11-18 16:55:53+00:00,Joe_denywijaya,salam dari lereng gunung sumbing pak prabowo semoga senantiasa diberkati tuhan
2022-11-18 16:55:40+00:00,wonnuwo,gunung seru ga siee hyung trims rendangnya
2022-11-18 16:54:54+00:00,AbanggSayur,gunung kidul banjir
2022-11-18 16:53:09+00:00,harakim510_,lockey sudah saat nya turun gunung dan menguasai vote tap show champion the show
2022-11-18 16:53:02+00:00,zodiak_HarianID,libra mencintai kota desa gunung ataupun pantai kalau ada dana pasti akan anda gunakan jalan jalan ke tempat yang diinginkan
2022-11-18 16:52:39+00:00,BubuSayabubu1,lockey sudah saat nya turun gunung dan menguasai vote tap show champion the show
2022-11-18 16:52:18+00:00,bctrflie,pantai ke gunung yang ada muntah
2022-11-18 16:50:55+00:00,blue____ry,lockey sudah saat nya turun gunung dan menguasai vote tap show champion the show
2022-11-18 16:48:54+00:00,sassymara7,at toko arloji gunung mas
2022-11-18 16:47:40+00:00,janahnuyy,lockey sudah saat nya turun gunung dan menguasai vote tap show champion the show
2022-11-18 16:47:13+00:00,nisiinoya,bawain aku gunung bromo
2022-11-18 16:46:14+00:00,Baebbyz,ada yg tanya apa bener lokasi food estate gunung mas ini dulunya hutan jangan2 emang udah terbuka nah dilaporan terbaru
2022-11-18 16:45:39+00:00,yusuf_nsk,kumpulan pelancong menyelamatkan diri di sebuah dewan terbuka di tempat lebih tinggi sementara menunggu ketibaan bomba awan
2022-11-18 16:45:26+00:00,ichwndtya,lucu banget adikmu berbakat akhirnya ibu guru tidak hanya melihat gambar dua gunung sawah dan jalan saja lucu b
2022-11-18 16:43:41+00:00,lukasss6661,cek gunung apanihh
2022-11-18 16:40:06+00:00,javanuabali,foto2 yg diambil minggu lalu mengingatkan syair ini tanah tandus kerontang banjir datang itu pasti dr lagunya iwan f
2022-11-18 16:39:52+00:00,giftmever,yesaya 26 4 percayalah kepada tuhan selama lamanya sebab tuhan allah adalah gunung batu yang kekal
2022-11-18 16:39:25+00:00,LockeynyaSN,lockey sudah saat nya turun gunung dan menguasai vote tap show champion the show
2022-11-18 16:39:23+00:00,mackillah,2018 jangan kata saya tak sokong pas siap bawa bendera pas panjat gunung ok dulu lah sekarang tak dah sebab tengo
2022-11-18 16:39:15+00:00,nekofvr,jadi keinget sandal gunung aku hilang di masjid padahal masi 3 bulanan
2022-11-18 16:39:12+00:00,hazelnxtlatte,yess tadi lewat di jam gunung agung lagi semerawut wkwkw
2022-11-18 16:39:11+00:00,diankurniaa7,gunung merapi
2022-11-18 16:39:02+00:00,babananashh,ajak jerome naik gunung bung biar jerome berotot dulu
2022-11-18 16:36:57+00:00,Tuheq,sperti mendaki gunung everest terlalu curam untuk dimasuki kehidupannya ya allah tapi tetap pengen
2022-11-18 16:35:03+00:00,firdaffatu,gunung nggk tau ya dari kecil suka banget sama gunung
2022-11-18 16:34:53+00:00,amaraadinda__,jerome naik gunung
2022-11-18 16:34:49+00:00,NisrinaQkh,lockey sudah saat nya turun gunung dan menguasai vote tap show champion the show
2022-11-18 16:34:25+00:00,ichitanthaiti,seru uga nih episode pertamanya di gunung padang
2022-11-18 16:34:18+00:00,apthreea,bung ntar ajakin jerome naik gunung
2022-11-18 16:33:50+00:00,cigasaftrsexx,abis mendaki gunung lewati lembah kah inii
2022-11-18 16:33:16+00:00,alansuparlan,dari parakan salak ke gunung salak deket banget sabi nih
2022-11-18 16:32:39+00:00,bungsusyp,baguuuuuus bgttttt aku kelas 2 sd gambar gunung kembar sama jalan raya ditengahnya
2022-11-18 16:32:29+00:00,sugaahoon_,181122 weibo update konser tur grandline 2 angkat layar melintasi gunung dan lautan sampai jumpa di atas
2022-11-18 16:30:22+00:00,leo_edw,naik gunung camping bareng makan di kaki lima hujan2
2022-11-18 16:30:21+00:00,yunankingstar1,tinggi juga ilmu nya sampai bisa kuras rp 4 7 miliar berguru dimana dan bersemedi di gunung mana sampai bisa dapatkan ilmu setinggi ini kelabui masyarakat awam sampai rp 4 7 miliar
2022-11-18 16:30:17+00:00,uneq_id,aturan 95 jangan menjadi lautan untuk orang yang lebih suka mendaki gunung tapi ini bukan tentang sebuah tempat
2022-11-18 16:30:04+00:00,E507ER,anjink itu klo gunung mletus keluar asep yg ngebul bgt
2022-11-18 16:28:20+00:00,sithiaisyah93,maka betapa pentingnya para santri yang selama ini identik dengan kitab kuning dan kajian2 keislaman agar lebih aktif turun gunung untuk berdakwah di media sosial sebab paham radikalisme akhir akhir ini sudah sangat subur menyebar melalui jalur media sosial
2022-11-18 16:26:59+00:00,amumuxii,itu miw baru aja aku co buat abang aku hihihi temukan sendal pria wanita original 100 hipzo ct 30 sandal pria gunung casual slide slop kasual dengan potongan 63 hanya rp73 630 dapatkan sekarang juga di shopee
2022-11-18 16:26:20+00:00,si_gembira,ohh awalnya keseret abang itu ya paling beruntungnya smp dah kenal gunung mbakk gimana pas pertama kali naik gunung itu masih inget gak
2022-11-18 16:24:50+00:00,ikilybeomi,pantai soalnya ga perlu ngedaki dulu wlopun aku juga suka gunung si tpi mostly lebi suka ke pantai lah
2022-11-18 16:24:26+00:00,waone_kusma313,di indonesia ada tujuh puncak gunung tertinggi yang disebut dengan seven summit indonesia salah satu puncak tertingg
2022-11-18 16:23:58+00:00,HMulyaT2,di atas gunung
2022-11-18 16:20:57+00:00,reziatikaa,baru ini mau naik gunung rada drama
2022-11-18 16:19:56+00:00,TorajaTours,gunung sulawesi belum yah kak kalau mau ke rantemario latimojong bisa kontak kami via dm dan wa di bio kak ada paket wisata toraja juga
2022-11-18 16:19:20+00:00,clumsyboiii,gunung anyar
2022-11-18 16:18:24+00:00,yabbadabbadumb,mimpiin gunung gede
2022-11-18 16:15:45+00:00,OizXRose,lockey sudah saat nya turun gunung dan menguasai vote tap show champion the show
2022-11-18 16:15:26+00:00,adidwijayadi,gunung harta bus favorit tiap mudik ke sragen
2022-11-18 16:15:25+00:00,comrade_chum,tu la tu rezeki dpn mata nampak benda pelik masa tu otw nak pg gunung sanggul tak silap
2022-11-18 16:14:26+00:00,imnaecyeon,hal pertama yang gua lakuin kalo jadi anoman adalah jelajah ke gunung gunung pake kekuatan sepiangin trus gua mau ngenalin twice ke para prabu dan bathara dan bakal gua ceritain kalo di suatu masa manusia dengan semua latar belakang sosial bisa lewatin laut
2022-11-18 16:14:03+00:00,yan52645044,naik naik ke puncak gunung tinggi tinggi sekalii
2022-11-18 16:12:07+00:00,FanRahasia,lockey sudah saat nya turun gunung dan menguasai vote tap show champion the show
2022-11-18 16:11:03+00:00,GatotRiyoko,betul mantap gunung kembarnya
2022-11-18 16:11:00+00:00,kyuhanjoong,lucu banget adikmu berbakat akhirnya ibu guru tidak hanya melihat gambar dua gunung sawah dan jalan saja lucu b
2022-11-18 16:09:59+00:00,zuhrisanifahmi,petirnya nyamber di gunung kidul
2022-11-18 16:09:08+00:00,bagasindraperm3,spill video pas kena badai di gunung dong
2022-11-18 16:08:42+00:00,nexgenonani,balikpapan ada yang mau cek gunung gaak
2022-11-18 16:08:33+00:00,jichuyel,aduhh mengayomi asik positip vibes gt lt adem cem ada di bawah gunung yah hye kalau gitu ayo seringin interaksi biar lebi banyak moment ngobrolnya aku happy terus ko suka sedi dikit aja dikit kamu juga harus bahagia selalu canci
2022-11-18 16:08:10+00:00,_ReTNoPra_,ahaye itu anaknya aki yg katanya turun gunung ya
2022-11-18 16:06:37+00:00,Yoonob,udah dapet poto gunung kembar belom bang
2022-11-18 16:05:16+00:00,moonlightgbl,hidup ennih naik turun seperti sedang mendaki gunung rinjani
2022-11-18 16:03:50+00:00,hygemiiniii,seumur umur beli kondom cuma buat naik gunung
2022-11-18 16:01:35+00:00,flufcottoncandy,ngumpul di bni jam 9 atau 10 malem terus motoran naik gunung atau randomly ke puncak atau bahkan ke pantai
2022-11-18 16:01:12+00:00,bigwinsimonad,mau nyoba naik gunung tidar di magelang hehe
2022-11-18 15:58:41+00:00,Mars_Sahsa,innalillahi wainna ilaihi rajiun gunung sekelilingnya udah gundul semua
2022-11-18 15:58:20+00:00,mt_eferest,gunung eferest
2022-11-18 15:53:15+00:00,__noong6ooy,lockey sudah saat nya turun gunung dan menguasai vote tap show champion the show
2022-11-18 15:53:02+00:00,nirankra,26 naik gunung
2022-11-18 15:52:48+00:00,jaengelswan,sbnerny enak gunung sih soalny dingin tp ak takut jalannya
2022-11-18 15:52:31+00:00,SenatorRasAdiba,pulau pandan jauh ke tengah gunung daik bercabang tiga hancur badan dikandung tanah budi yang baik dikenang jua moga yang baik baik sahaja hendaknya kita agar bumi malaysia serta kedaulatannya rapi terjaga amp amanah serta harmoni terpelihara bismillahhirahmanirahim
2022-11-18 15:51:54+00:00,MSyariPP,rekomendasi sepatu gunung pria a thread
2022-11-18 15:51:26+00:00,Nrdn112,gmana kalo bapaknya lyn dan katrina turun gunung wkwk
2022-11-18 15:50:55+00:00,HhsamR_,kampung adat yang ga banyak orang tau banyak ke ekspos setelah kejadian longsor gunung sampah tapi kicimpring cirendeu enak loh
2022-11-18 15:50:38+00:00,afianaprmt21,gunung
2022-11-18 15:50:13+00:00,adepedia,gunung puncak jaya terletak di papua tengah
2022-11-18 15:49:42+00:00,jokesparkle3,aturan 95 jangan menjadi lautan untuk orang yang lebih suka mendaki gunung tapi ini bukan tentang sebuah tempat
2022-11-18 15:47:57+00:00,noctaery,pantai gunung cape di jalan
2022-11-18 15:47:37+00:00,heksanandono,disini gunung disana gunung ditengah tengah pulau jawa kakak cantik kok karmareinkarnasi misteris
2022-11-18 15:46:30+00:00,lightfury__,yg gunung kidul ya itu
2022-11-18 15:45:51+00:00,diahahah_,habis ngepoiin ig atap negeri ahh pengen bgt naik gunung tapi liat cuaca sekarang2 gak memungkinkan
2022-11-18 15:45:20+00:00,lutfimove,pembersihan dan pemerataan gunung lokasi pembangunan pesantren darul musthafa desa bukit harapan kec 16 nov trend mama daesang is for bts tender lelang
2022-11-18 15:45:13+00:00,obbscurre,disana gunung disini gunung soalnya ovt
2022-11-18 15:45:10+00:00,Intannurlitas,lucu banget adikmu berbakat akhirnya ibu guru tidak hanya melihat gambar dua gunung sawah dan jalan saja lucu b
2022-11-18 15:44:19+00:00,jimroberto,kalo pemimpinnya cuma jadi cawapres mah mending diem aja gak usah turun gunung
2022-11-18 15:43:32+00:00,berkahtembaga21,nama asli dari gunung cartenz dalam bahasa amungme kamoro ertsberg areal pt freeport mcmoran sumber i troppem museum a
2022-11-18 15:43:20+00:00,ucokbarlen,lockey sudah saat nya turun gunung dan menguasai vote tap show champion the show
2022-11-18 15:42:45+00:00,Asulanang16,ke gunung gambar
2022-11-18 15:42:41+00:00,KejuMozzarellaa,minimal harus mendaki gunung dan melewati lembah
2022-11-18 15:42:10+00:00,kmilsyuti,balak dah ni nak korek gunung plk tapi alasannya kata masih tak cukup duit untuk wujudkan sistem pengairan yg baik satu negeri
2022-11-18 15:41:31+00:00,RanggaWijayaka,ini tipsnya min mendaki gunung biar gak terlalu lelah info aja sih kalo miminnya masih jomblo ya maap
2022-11-18 15:41:23+00:00,siIksonik,naik gunung
2022-11-18 15:41:12+00:00,dheadarman,udh brsa tggl di gunung ujan mulu jd ga bisa minum es
2022-11-18 15:40:26+00:00,Cauhght,laut kayanya kalo naik gunung gua udah k o duluan
2022-11-18 15:40:02+00:00,SobakhulK,foto2 yg diambil minggu lalu mengingatkan syair ini tanah tandus kerontang banjir datang itu pasti dr lagunya iwan f
2022-11-18 15:40:00+00:00,axcelsahu,ya begitulah naro ekspektasinya setinggi gunung pas giliran dikasih realita malah nyalahin jot karena gk sesuai ekspektasinya gw sih enjoy sama performancenya apalagi aransemennya cukup gokil
2022-11-18 15:39:44+00:00,NTX24,banyak objek wisata menarik di natuna selain tentu saja wisata bahari ternyata memiliki gunung ranai yang mempesona dan unik natuna
2022-11-18 15:38:39+00:00,GatotRiyoko,gunung yg tinggi
2022-11-18 15:38:30+00:00,Adolf2004,foto2 yg diambil minggu lalu mengingatkan syair ini tanah tandus kerontang banjir datang itu pasti dr lagunya iwan f
2022-11-18 15:38:25+00:00,andybukanandie,serbu fren rilisan terbaru podcast tanah jawa mengenai sejarah dan tentunya misteri pernah dengar gunung kawi ada a
2022-11-18 15:38:02+00:00,mynameis_marwan,bakal aku tonton kelak saat sudah pensiun naik gunung
2022-11-18 15:37:38+00:00,oucxaxxzz,ya allah gua yg gambar gunung aja masi menyon2
2022-11-18 15:37:23+00:00,rskyans,lockey sudah saat nya turun gunung dan menguasai vote tap show champion the show
2022-11-18 15:36:38+00:00,peboll,kirain gunung
2022-11-18 15:33:56+00:00,syifa_mikho27,gak mau ngomong mau manyun aja sebel story nya cewe pamer gunung
2022-11-18 15:32:52+00:00,syalalaauliaa,gabisa bang tugas udah setinggi gunung
2022-11-18 15:32:34+00:00,Inginrasahati,gunung
2022-11-18 15:31:47+00:00,kazeauha,adaaa coba aja carii permen segede gunung gituu kak
2022-11-18 15:31:25+00:00,_brigadeSN,lockey sudah saat nya turun gunung dan menguasai vote tap show champion the show
2022-11-18 15:29:28+00:00,inikardem,wi mau naik gunung
2022-11-18 15:28:16+00:00,Ipung63,kakek kakek dari gunung lawu temannya mak lampir
2022-11-18 15:28:12+00:00,fr_kr,pie nak nonton konser sangu caping gunung
2022-11-18 15:27:35+00:00,Newbie65441577,lockey sudah saat nya turun gunung dan menguasai vote tap show champion the show
2022-11-18 15:27:33+00:00,ardilinidsty,mari kita mendaki gunung dan melewati lembah wkwkwk
2022-11-18 15:27:32+00:00,Iliko24503492,lockey sudah saat nya turun gunung dan menguasai vote tap show champion the show
2022-11-18 15:27:28+00:00,Ipung63,kakak kakek dari gunung lawu temannya mak lampir
2022-11-18 15:27:02+00:00,vausspppo,ranu ranuan anak gunung pasti tau kan tapi ngga cocok sama tempat dingin
2022-11-18 15:25:16+00:00,txtpekalongan,ya allah turunkan hujan ini di sekitar kami jangan di atas kami ya allah curahkanlah hujan ini di atas bukit bukit di hutan hutan lebat di gunung gunung kecil di lembah lembah dan tempat tempat tumbuhnya pepohonan
2022-11-18 15:25:11+00:00,TeguhPe01971066,gunung nya mantap
2022-11-18 15:24:55+00:00,TeguhPe01971066,naik naik ke puncak gunung tinggi tinggi sekalii
2022-11-18 15:24:42+00:00,metaee4ff,pantai gunung capek mendakinya
2022-11-18 15:24:39+00:00,bacotanRP,maksud hati memeluk gunung apalah daya gunungnya lari lari
2022-11-18 15:24:25+00:00,kuecanti,laut walaupun pengen bgt ke gunung
2022-11-18 15:24:18+00:00,Cutiespei,nomin college au d dingin mau diangetin saat j en o dan j ae m in ngecamp di gunung dingin menerjang buat yang sedi
2022-11-18 15:24:17+00:00,Shxxcii,lucu banget adikmu berbakat akhirnya ibu guru tidak hanya melihat gambar dua gunung sawah dan jalan saja lucu b
2022-11-18 15:24:02+00:00,ZulhafeezA,kenderaan kempen tersadai tepi jalan ni minyak habis baru balik dari berjumpa penyokong dan ahli di teluk gunung tunggu
2022-11-18 15:23:47+00:00,edelweisjvnca,pantai krna kalau gunung ya gkpp
2022-11-18 15:23:23+00:00,secretnxxxx,lockey sudah saat nya turun gunung dan menguasai vote tap show champion the show
