created_at,author,cleaned_tweet
2022-11-18 07:33:39+00:00,moonloversuju,yg bunuh pacarnya di dorong dr tebing si gunung kidul
2022-11-18 07:32:32+00:00,rosesinmyroom,riptwitter beneran ini padahal twitter ini tempat paling update ig ga bisa loading nanyanya di twitter wa error larinya ke twitter gempa bumi gunung meletus hujan badai nyari info lewat twitter mati listrik amp internet down aja liat info di twitter
2022-11-18 07:29:52+00:00,Infotabananbali,just posted a photo desa gunung salak selemadeg timur tabanan bali
2022-11-18 07:27:41+00:00,atheallnaa,nomin college au d dingin mau diangetin saat j en o dan j ae m in ngecamp di gunung dingin menerjang buat yang sedi
2022-11-18 07:25:16+00:00,Agus67110761,kgn suasana di gunung hmmmmmm
2022-11-18 07:24:53+00:00,Doneh,nggeh betul wahihihi itungannya beli service e kemarin antara kalo nggak sinjay suit class ya gunung harta eh kok inceran utama 27 trans dikabari ada 1 tiket kosong rejeki nek sleepers j99 aku sik porek karo sing nduwe hahahaha
2022-11-18 07:24:19+00:00,Adinugrohokw3,aturan 95 jangan menjadi lautan untuk orang yang lebih suka mendaki gunung tapi ini bukan tentang sebuah tempat
2022-11-18 07:23:43+00:00,Punyamark02,nomin college au d dingin mau diangetin saat j en o dan j ae m in ngecamp di gunung dingin menerjang buat yang sedi
2022-11-18 07:23:11+00:00,kominfodiy,halo wargamerapi berikut kami sampaikan infografis laporan aktivitas gunung merapi periode pengamatan 17 november 2022 puk
2022-11-18 07:23:07+00:00,IexelaG,gunung gede jawabarat
2022-11-18 07:21:34+00:00,Kembara082022,gunung batur kaldera yg ada terbentuk oleh runtuhnya ruang magma gunung runtuhan besar terjadi pertama kali sekitar 2
2022-11-18 07:21:21+00:00,keplak_n,yo fokoke asline wong ngapak si ngayubi topone ning gunung srandil adipala fokoke yo ngunu mosok kono tok sing iso asal ngeklaim
2022-11-18 07:20:26+00:00,sulemarbun,pepo udah turun gunung cheerleaders dah sorak sorai sebagai pemimpin perubahan ehh ternyata nasdem ini kelewatan banget dah
2022-11-18 07:20:05+00:00,ArifAntariksa,kalo membangun negara dengan mengelola pajak bumn untungnya buat membangun tak acungin jempol kabih ngebangun pake hutang yg bonyok rakyat koruptor paling top di era jokowi semua di poles pk buzzerp jd mulus seperti gunung es tinggal ttg mencair
2022-11-18 07:20:04+00:00,lndonesi4,berikut update terowongan kcic di gunung bohong cimahi bandung barat pada jumat lalu 11 11 terowongan ini memiliki panjan
2022-11-18 07:19:26+00:00,NAWACITAPOST1,warga binaan lapas kelas iii gunung tua kanwil kemenkumham sumut belajar membaca al quran
2022-11-18 07:19:15+00:00,Martabakmatcha,ngepet ke gunung kawi
2022-11-18 07:18:31+00:00,AlamGunners17,hanya dengan penuh keyakinan kita mampu memindahkan gunung namun tanpa persiapan kita bisa tersandung oleh batu kecil
2022-11-18 07:16:48+00:00,pendakilawas,spill video pas kena badai di gunung dong
2022-11-18 07:16:40+00:00,anaknyaayahhh,seru uga nih episode pertamanya di gunung padang
2022-11-18 07:15:11+00:00,provjateng,halo wargamerapi berikut kami sampaikan infografis laporan aktivitas gunung merapi periode pengamatan 17 november 2022 puk
2022-11-18 07:14:56+00:00,erisa_santika,salam kenal mas ini view merapi dari gunung merbabu september 2022 kota asal tasikmalaya
2022-11-18 07:13:43+00:00,ohxhoun,gunung dong
2022-11-18 07:13:10+00:00,kopi_nggarangan,di ajak ke gunung gitu bang terus sambil lihat pemandangan di dekat tebing terus lo dorong sambil triak mision sukses
2022-11-18 07:11:15+00:00,BlueNeo81,kena gk di bawa ke gunung ya kan bro fb
2022-11-18 07:11:04+00:00,Ohmybirss,1 menikmati sunrise dan sunset di puncak gunung rinjani 2 dengerin lagu banda neira langsung di banda neira 3 menikmati kopi di pinggir ranu kumbolo dengan hangatnya dekapanmu 4 masuk sorga
2022-11-18 07:10:59+00:00,cudlicious,iyhh bahasa orang gunung yhh
2022-11-18 07:10:50+00:00,mwsubhan,jangan meremehkan hal apapun bahkan debu bisa menjadi gunung bila mereka berkumpul
2022-11-18 07:09:40+00:00,imnnrrzki,bila merdeka malaysia hidup harmoni serata alam cuba buktikan naratif kita hidup harmoni sekali datang pru cina komunis india gangster melayu pemalas sarawak itu sabah ini dia sama macam kempen hari bumi la konon sayang bumi tapi gunung ganang hutan kau jarah jugak
2022-11-18 07:09:23+00:00,rusdtle,ngecamp di gunung salak hahaha
2022-11-18 07:08:22+00:00,akramaaf_,pgn naik gunung dah
2022-11-18 07:08:18+00:00,anganrasa,sangat serius jika berurusan dengan makanan gak ada deh kayaknya lu bilang cuma beli ini aja kan tanyanya ragu dan hanya mengikuti saja kalau soal bahan makanan masih banyak di rumahnya dan mungkin ada beberapa yang akan dibeli di kaki gunung saja
2022-11-18 07:07:22+00:00,BournAgainShell,muhun pami nonggongan gunung tangkuban perahu mah ka palih kanan rupina abdi aslina ti cisarua mung nuju teu diditu
2022-11-18 07:07:13+00:00,acbnrff,gunung ganang dia buat tempat letak kaki je hahaha ko rasa
2022-11-18 07:06:53+00:00,Albapparel354,berkualitas wa 0822 1036 9354 vendor kaos futsal printing custom di tegalsari surabaya klik baju futsal lucu di gayungan surabaya baju futsal merah di genteng surabaya baju futsal merah hitam di gubeng surabaya baju futsal merah maroon di gunung
2022-11-18 07:05:26+00:00,tukkura91,viral di fb keadaan terkini gunung ganang di perak jujurnya aku sedih dengan apa yang berlaku tetapi seorang temanku berkata
2022-11-18 07:04:29+00:00,sibeel_2011,gfj udah mulai turun gunung lagi gais
2022-11-18 07:04:06+00:00,Albapparel354,desain bebas wa 0822 1036 9354 buat kaos futsal printing custom di semampir surabaya klik baju futsal hitam emas di genteng surabaya baju futsal hitam gold di gubeng surabaya baju futsal hitam merah di gunung anyar surabaya baju futsal hitam pink
2022-11-18 07:03:22+00:00,panda_gunung,format 3gp ke ni
2022-11-18 07:01:21+00:00,DagDigDugDeerr,kopinang aku dengan seperangkat alat hiking ini mo nikah apa mendaki gunung eh
2022-11-18 07:00:39+00:00,anggadaIndo,ingin berwisata ke gunung bromo dengan biaya yang murah sewa saja jeep di
2022-11-18 07:00:28+00:00,chun_li01,demi koe laut bakal tak sebrangi gunung bakal tak daki tapi engko sek ijek udan iki
2022-11-18 06:59:27+00:00,climax_ao,yuuk yg mau xplore pantai wisata bromo ijen pendakian ke gunung semeru lngsung aja hub kami climaxadventure malang
2022-11-18 06:58:44+00:00,Rharrys,itu yg bikin pembenaran atau pembelaan thdp akun penghina ibu negara usianya berapa 13 18 kok naif2 ke puncak gunung kimak gitu ya dark joke jiwa loe yg dark
2022-11-18 06:58:00+00:00,lilynistfrln,aturan 95 jangan menjadi lautan untuk orang yang lebih suka mendaki gunung tapi ini bukan tentang sebuah tempat
2022-11-18 06:56:36+00:00,llovngjaem,nomin college au d dingin mau diangetin saat j en o dan j ae m in ngecamp di gunung dingin menerjang buat yang sedi
2022-11-18 06:55:30+00:00,dlsappearoneday,asik ya misal punya dapur viewnya gunung taman trs ada timing masak mie kuah soto pas hujan
2022-11-18 06:55:26+00:00,Regita_Nofianti,kata orang kalo tiba tiba kepengen naik gunung sendiri berarti sedih nya gak main main
2022-11-18 06:55:26+00:00,polsekwonosobo1,ipda arief janto s ip melaksanakan giat program quick wins presisi jumat curhat di masjid pekon gunung doh kec bandar negeri semuong kab tanggamus polripresisi quickwinspresisi
2022-11-18 06:54:25+00:00,sunj_v,abiz la hutan gunung dah abiz dibogelkan skrg yg nie pula
2022-11-18 06:53:49+00:00,renjuwni,gunung
2022-11-18 06:51:52+00:00,LeonardEricLie,berikut update terowongan kcic di gunung bohong cimahi bandung barat pada jumat lalu 11 11 terowongan ini memiliki panjan
2022-11-18 06:51:41+00:00,critaharian,jaket puffer tebal pria jaket winter jaket parasut tebal pria jaket gunung pria hijau army 4 8
2022-11-18 06:51:00+00:00,RuliantoRuly,hidup ini adalah perjuanagn saat kamu sudah mencapai di puncak sebuah gunung maka akan ada gunung yang lebih tinggi untuk kamu taklukkan
2022-11-18 06:49:49+00:00,THDARKROSE,buat dibangun sama nahan beban kalo ditambahin desain itu area ada di lereng gunung aktif mau radius 20 kilo kalo sewaktu waktu gempa
2022-11-18 06:49:08+00:00,Brunowicaksono,jalur sampai hapal nglotok tikungan dan tanjakannya sekarang enak semua informasi mudah didapatkan apalagi peralatannya beda saat tahun 90 an kebawah bener2 serba terbatas dan lagi naik gunung dianggap nganeh nganehi
2022-11-18 06:48:19+00:00,amrzuhairi,viral di fb keadaan terkini gunung ganang di perak jujurnya aku sedih dengan apa yang berlaku tetapi seorang temanku berkata
2022-11-18 06:47:34+00:00,atitutet,masa labschool study tour naik gunung seru bgt
2022-11-18 06:46:37+00:00,Brunowicaksono,jalur merbabu via thekelan merupakan jalur tertua yg ada di gunung merbabu jalur tersebut mulai di buka sekitar tahun 19
2022-11-18 06:45:44+00:00,vtymhd,keadaan gunung ganang di perak sekarang
2022-11-18 06:43:37+00:00,huddkhalessi,viral di fb keadaan terkini gunung ganang di perak jujurnya aku sedih dengan apa yang berlaku tetapi seorang temanku berkata
2022-11-18 06:43:18+00:00,ordchv,nomin college au d dingin mau diangetin saat j en o dan j ae m in ngecamp di gunung dingin menerjang buat yang sedi
2022-11-18 06:42:02+00:00,NoorHavid,satu komando perintah atas dawuh mandat wasiat dari pangeran diponegoro ontowiryo mustahar mbah gendong saudara kandung diponegoro dan ibu kanjeng ratu roro dewi kusuma wardani dan eyang ratu apa perlu seluruh gunung di muntahkan lahar krakatau kelud bromo merbabu merapi kelud
2022-11-18 06:42:00+00:00,elang_mobile,halo wargamerapi berikut kami sampaikan infografis laporan aktivitas gunung merapi periode pengamatan 17 november 2022 puk
2022-11-18 06:41:56+00:00,AKU_dgn3putra,pemandangan jakarta rasa istanbul turki alhamdulillah di hari jumatberkah udara jakarta bersih dan langit cerah gunung salak menyapa jakarta masjid jami al fajri pasar minggu jakarta selatan via ari
2022-11-18 06:41:30+00:00,_Kenshine_,trus kapan nyampenya kalo dipendem terus pepatah tak lari gunung dikejar apa masih berlaku brader
2022-11-18 06:41:28+00:00,NoorHavid,satu komando perintah atas dawuh mandat wasiat dari pangeran diponegoro ontowiryo mustahar mbah gendong saudara kandung diponegoro dan ibu kanjeng ratu roro dewi kusuma wardani dan eyang ratu apa perlu seluruh gunung di muntahkan lahar krakatau kelud bromo merbabu merapi kelud
2022-11-18 06:41:16+00:00,iantrucker,tividi arah barat malam ini dari kiri ke kanan t 009 cileungsi gunung putri silver class t 005 cibinong bubulak gold clas
2022-11-18 06:40:03+00:00,infonaikgunung,kepo alat gunung
2022-11-18 06:39:38+00:00,infonaikgunung,buat bosku yang kepo alat gunung bisa cek comment mimin ya liburanku liburangratis liburanlokal liburanhongkong liburanbogor liburanbandung liburanbromo liburanbersama liburanlombok liburanjakarta liburanbalimurah liburanindonesia liburanakhirtahun liburandulu
2022-11-18 06:38:34+00:00,llopallcopall,dikasih rejeki sehat dan menua bersamanya melihat anak2 tumbuh sehat sholeh sholehah trus punya sawah kebon gunung laut hihi
2022-11-18 06:38:09+00:00,nominlova,nomin college au d dingin mau diangetin saat j en o dan j ae m in ngecamp di gunung dingin menerjang buat yang sedi
2022-11-18 06:36:34+00:00,bloombreez3,nomin college au d dingin mau diangetin saat j en o dan j ae m in ngecamp di gunung dingin menerjang buat yang sedi
2022-11-18 06:36:27+00:00,nyaeonyny,aturan 95 jangan menjadi lautan untuk orang yang lebih suka mendaki gunung tapi ini bukan tentang sebuah tempat
2022-11-18 06:36:21+00:00,polsek_sw_besar,bhabinkamtibmas kelurahan gunung sahari utara bripka adnan munandar melaksanakan sambang ke pemukiman warga
2022-11-18 06:34:22+00:00,day6hanbin,lagu gunung enak bgt wkwkkwkwkwkw
2022-11-18 06:34:21+00:00,langitketujuhhh,1 naik gunung 99 patah hati
2022-11-18 06:34:15+00:00,iamLyeaaa,viral di fb keadaan terkini gunung ganang di perak jujurnya aku sedih dengan apa yang berlaku tetapi seorang temanku berkata
2022-11-18 06:33:53+00:00,thebangtanism,deket gunung ahaha kamu malang juga aku dm ya
2022-11-18 06:33:47+00:00,izzarosli_,aku tak naik lagi tau dua gunung tu
2022-11-18 06:31:42+00:00,akungabutkubre,halo aku mau preloved sandal gunung wanita wedges tinggi belum pernah dipakai sama sekali dijual karena kebesaran ukuran 38 ya kalo minat dm aja
2022-11-18 06:30:45+00:00,dongsichengasli,gunung
2022-11-18 06:30:34+00:00,poskopmidiy,halo wargamerapi berikut kami sampaikan infografis laporan aktivitas gunung merapi periode pengamatan 17 november 2022 puk
2022-11-18 06:30:32+00:00,akungabutkubre,halo aku mau oreloved sandal gunung wanita wedges tinggi belum pernah dipakai sama sekali dijual karena kebesaran ukuran 38 ya kalo minat dm aja
2022-11-18 06:30:05+00:00,FeraVrenika,nantikan festival wong gunung 2018 segera di bulan agustus 2018 fwg2018
2022-11-18 06:29:52+00:00,WarungSejarahRI,untaian mutiara iman dari kaki gunung lawu oleh romo rafael tri wijayanto tahun 2011 256 halaman harga 55 000 minat order dm or klik link wa
2022-11-18 06:29:31+00:00,ellenmine1,gw nyari kali2 ada oyen nemplok di pohon ataunemplok di gunung
2022-11-18 06:28:15+00:00,sapxkcomeback,mana dtg gunung kat batu gajah ni ni mcm area gopeng
2022-11-18 06:26:29+00:00,hwansohee,aaaaabang anak mamih sayanggg emangnya mamih galak yh mari mendaki gunung bang
2022-11-18 06:25:31+00:00,khidhirnoh,viral di fb keadaan terkini gunung ganang di perak jujurnya aku sedih dengan apa yang berlaku tetapi seorang temanku berkata
2022-11-18 06:25:17+00:00,hwansohee,happy birthday mamih si cantik kesayangan abang sehat terus ya tetep jadi mamih yg baik walau galak dikit makasih mau jadi
2022-11-18 06:25:17+00:00,Agus67110761,gunung merapi jogjakarta
2022-11-18 06:24:23+00:00,darlingbabys,salah satu alasan diet pengen bgt naik ke salah satu gunung pengen bgt ke gunung itu jadi biar kuat mari kita dieeet
2022-11-18 06:24:20+00:00,_pernahgondrong,itu apa vit apa gunung
2022-11-18 06:23:21+00:00,Prastketel4,halo wargamerapi berikut kami sampaikan infografis laporan aktivitas gunung merapi periode pengamatan 17 november 2022 puk
2022-11-18 06:22:33+00:00,haimahasa,wkwk asli apalagi yang orang gunung kl naik motor diatas 80 konstan
2022-11-18 06:22:12+00:00,BASEBCT,pantai gunung
2022-11-18 06:21:54+00:00,PutuSambernyawa,jalur merbabu via thekelan merupakan jalur tertua yg ada di gunung merbabu jalur tersebut mulai di buka sekitar tahun 19
2022-11-18 06:21:21+00:00,indozonemedia,new selo tempat terbaik untuk menikmati keindahan gunung merbabu dan merapi di boyolali zcreators
2022-11-18 06:21:04+00:00,IfunkH,halo wargamerapi berikut kami sampaikan infografis laporan aktivitas gunung merapi periode pengamatan 17 november 2022 puk
2022-11-18 06:21:01+00:00,keylangit_,mau nyari hiburan di twitter tp kerjaan masih kaya gunung fujiyama
2022-11-18 06:19:37+00:00,SukoharJOS,top story santri pondok pesantren al mukmin ngruki sukoharjo yang sebelumnya dikabarkan hilang karena terseret ombak di pantai seruni kelurahan tepus gunung kidul ditemukan dalam kondisi tak bernyawa see more
2022-11-18 06:18:47+00:00,BuzzerEdan,jalur merbabu via thekelan merupakan jalur tertua yg ada di gunung merbabu jalur tersebut mulai di buka sekitar tahun 19
2022-11-18 06:18:29+00:00,Sekdemangpmj,ipda mansur kapolsubsektor pad barat melaksanakan giat sambang dan patroli dialogis di sentra ekonomi perbankan ruko amp kantor gunung sahari raya tetap koordinasi dengan security areal ruko bertemu bpk dedi amp sukri himbauan kamtibmas lingkungan kawasan serta tingkatkan kewaspadaan
2022-11-18 06:17:46+00:00,Nxzeem,area kg sawah kaki gunung pulai
2022-11-18 06:17:36+00:00,AkhmadDimyati13,tak coba kok mirip pisang gepeng gunung yah
2022-11-18 06:15:49+00:00,itsokaywil,ke gunung tepi pantai enak tu rul
2022-11-18 06:14:07+00:00,alureesinss,nomin college au d dingin mau diangetin saat j en o dan j ae m in ngecamp di gunung dingin menerjang buat yang sedi
2022-11-18 06:13:45+00:00,wjzlina,viral di fb keadaan terkini gunung ganang di perak jujurnya aku sedih dengan apa yang berlaku tetapi seorang temanku berkata
2022-11-18 06:12:01+00:00,ekobigcity,baru ajar nyopir dah brani naik gunung blm paham mobil dah brani maen jalur extrem jadinya kegoblokan unfawdah tinggal buka kap nya kasih daun basah disekitar
2022-11-18 06:11:13+00:00,komodotmnbaikkk,kl tbtb pgn naik gunung berarti stressnya ga mainmain
2022-11-18 06:11:00+00:00,iyonouu,aturan 95 jangan menjadi lautan untuk orang yang lebih suka mendaki gunung tapi ini bukan tentang sebuah tempat
2022-11-18 06:10:31+00:00,dany_lank,yg dr darrah gunung wae
2022-11-18 06:10:14+00:00,ceciliacsyi,mcd gunung rapat
2022-11-18 06:10:14+00:00,PengadaanNet,pembangunan kantor bpp lokasi desa gunung jaya kec dangia
2022-11-18 06:09:57+00:00,jikajauh,orang2 idealis memang ditakdirkan untuk dikhianati nggak ada tempat untuk mereka dimanapun mereka menjadi orang2 minoritas yg terkucilkan satu2nya tempat mereka adalah di puncak gunung
2022-11-18 06:09:17+00:00,tabungandomba,di antara penghidupan manusia yang terbaik a laki laki yg menggembala domba dipuncak gunung dr atas gunung ini atau lembah dari beberapa lembah
2022-11-18 06:07:36+00:00,yunda_saga,dengan keyakinan kita dpt memindahkan gunung tapi tanpa persiapan kita dpt tersandung oleh kerikil
2022-11-18 06:06:22+00:00,milikmumedyana,dulu tiap pagi bisa liat gunung dari lantai 20
2022-11-18 06:06:12+00:00,PetikanFakta,fks gunung ossa yang memiliki tinggi 1617 meter merupakan puncak tertinggi di pulau tasmania
2022-11-18 06:05:55+00:00,anvie,1 apa yg dipaparkan pada utas sebelumnya hanyalah puncak dari gunung es bagian dalamnya masih menyimpan banyak fakta mencengangkan dan teka teki yg belum terpecahkan
2022-11-18 06:05:35+00:00,Aditiasama,sebenarnya kita berdiri di tumpukan gunung emas cman kita selalu berpikir bahwa itu tumpukan harang join
2022-11-18 06:05:26+00:00,jgwbs,karena ia aku pergi mendaki gunung mencoba memalingkan perhatianku bahwa yang indah bukan cuma dia
2022-11-18 06:03:37+00:00,sep_tia4,weeehh jangan salah sini belajar pernah di bela belain ngikut ke gunung padahal ga diajak ujan jg tetep dateng ke rumah ternyata tetep aja selingkuh
2022-11-18 06:02:24+00:00,geknana,phk 1300 karyawan goto adalah fenomena gunung es via platformcooperatives techlayoffs
2022-11-18 06:02:17+00:00,Mudennn,viral di fb keadaan terkini gunung ganang di perak jujurnya aku sedih dengan apa yang berlaku tetapi seorang temanku berkata
2022-11-18 06:01:59+00:00,thehcsun,nomin college au d dingin mau diangetin saat j en o dan j ae m in ngecamp di gunung dingin menerjang buat yang sedi
2022-11-18 06:00:55+00:00,naiklagidotcom,menaklukan gunung menaklukan egomu
2022-11-18 06:00:41+00:00,dnysstyd,selamat pagi di jumatberkah sobat hijau siapa nih yang akhir pekannya main ke gunung yuk simak tips bagaimana mence
2022-11-18 06:00:37+00:00,BPPTKG,halo wargamerapi berikut kami sampaikan infografis laporan aktivitas gunung merapi periode pengamatan 17 november 2022 pukul 00 00 24 00 wib merapisiaga sejak 5 november 2020 bpptkg
2022-11-18 06:00:23+00:00,bravelynm,nomin college au d dingin mau diangetin saat j en o dan j ae m in ngecamp di gunung dingin menerjang buat yang sedikit lebih muda menggigil hebat
2022-11-18 05:59:27+00:00,climax_ao,bisa kami bantu buat yg butuh guide porter ke gunung atopun transport jeep ke bromo ranupani ranukumbolo semeru mahameru
2022-11-18 05:57:43+00:00,yenlowchoi,berikut update terowongan kcic di gunung bohong cimahi bandung barat pada jumat lalu 11 11 terowongan ini memiliki panjan
2022-11-18 05:57:31+00:00,gobeer_ahmad,gregesi diatas gunung gringgingen sak awak
2022-11-18 05:57:15+00:00,JatIkhwan,rindu nak naik gunung tapi masa tak mengizinkan
2022-11-18 05:57:15+00:00,aretiredd,udh seminggu bolak balik ngukur jkt dr depok ke blok m ke jatinegara ke salemba cawang gunung sahari bolak balik dlm sehari
2022-11-18 05:55:50+00:00,Acu_Izham,viral di fb keadaan terkini gunung ganang di perak jujurnya aku sedih dengan apa yang berlaku tetapi seorang temanku berkata
2022-11-18 05:53:41+00:00,kelsycamelia,waktu kelsy chan masih kecil dia pernah menggambar matahari di antara dua gunung bot
2022-11-18 05:52:43+00:00,boisudahdewasa,kan kan geser ah mau mencoba meluluhkan gunung es nih
2022-11-18 05:51:05+00:00,sulaimanXII,viral di fb keadaan terkini gunung ganang di perak jujurnya aku sedih dengan apa yang berlaku tetapi seorang temanku berkata
2022-11-18 05:50:22+00:00,Humasresttinggi,kasidokkes nurhappi s kep dan pengda i agus toni bangun telah membagikan masker kepada masyarakat pengendara sepeda motor di jln gunung lauser simp beo tebing tinggi
2022-11-18 05:49:39+00:00,suhanylea,aturan 95 jangan menjadi lautan untuk orang yang lebih suka mendaki gunung tapi ini bukan tentang sebuah tempat
2022-11-18 05:47:43+00:00,haitanees,gunung fuji kh tadi juga aku ngode iya pak saya juga main genshin bapak nya cuma jawab oooh iya hehe
2022-11-18 05:47:27+00:00,Jayaak_,setu wi nek wani wul bensin budal kopi digunung gunung
2022-11-18 05:47:14+00:00,Doels99,nyaopo gunung barang
2022-11-18 05:46:38+00:00,bp_oko,gunung batur kaldera yg ada terbentuk oleh runtuhnya ruang magma gunung runtuhan besar terjadi pertama kali sekitar 2
2022-11-18 05:46:19+00:00,nnurulamalia,adem liat ijo ijo gunung sungai pakehape
2022-11-18 05:45:59+00:00,ZNuniu_alexa,eh misi twitter ngapa dah mo kemane twitter mo ngilang mo nge ghosting aku yang baru turun gunung ini woe nanti kalau aku galau trus aku harus kemana woy friendster jangan rusak kebahagiaanku trus tar liat znn ngejahe dimanaaaaaaaaaaaaa
2022-11-18 05:45:18+00:00,sesesey,hati hati guys dalam memilih open trip porter maupun guide pendakian gunung
2022-11-18 05:45:16+00:00,ekonommi,help rt wts want to sale 2 tiket nct dream the mobvie date 3 desember sabtu 12 30 di cgv malang dieng dijual karna ter
2022-11-18 05:44:56+00:00,parajamaludin,finallyyyyy vlog naik gunung terbaru fiersa besari
2022-11-18 05:44:56+00:00,Tukangbon,aturan 95 jangan menjadi lautan untuk orang yang lebih suka mendaki gunung tapi ini bukan tentang sebuah tempat
2022-11-18 05:43:39+00:00,Petunjukcahayaa,seru uga nih episode pertamanya di gunung padang
2022-11-18 05:43:07+00:00,17AF1,dabo lingga pemandangan gunung daik
2022-11-18 05:43:06+00:00,DriverSyopipud,joging mlayu ngubengi gunung pati
2022-11-18 05:42:25+00:00,noval_kang,angin gunung news amp analyses bukti kompas islamophobia 4 china kafir mati di rumah mewah di komplek perumahan china katanya kelaparan padahal kaya lalu kompas bikin judul berita bantu tetangga lebih utama dari pada berhaji yang mati
2022-11-18 05:42:23+00:00,FransAbi6,bhabinkamtimas desa gunung rintih aipda frances a sihombing menghimbau kepada muda mudi desa gunung rintih agar tdk salah gunakan narkoba media sosial
2022-11-18 05:41:23+00:00,BambangNoeryan4,misteri gunung api hai kawan mitigasi karena indonesia mempunyai banyak gunung api menjadikan banyak pos pengamatan gunung a
2022-11-18 05:40:46+00:00,pondra_50,wingi mari ono sing ketiban uwit poleh ngeri nek jln nang gunung
2022-11-18 05:39:22+00:00,slamet_boediono,mb sendalku sik anyar ki merek erigo sendal gunung coro gae napuk janji manise yo opo cocok rak
2022-11-18 05:39:17+00:00,pii91379991,b0ch1l gunung g3d3 smp s4ng3k 0m3k 0knum d0kt3r pr1ks4 ch1
2022-11-18 05:38:50+00:00,dksyhrh,viral di fb keadaan terkini gunung ganang di perak jujurnya aku sedih dengan apa yang berlaku tetapi seorang temanku berkata
2022-11-18 05:38:47+00:00,depres0t,perumahan sentra point gunung anyar rungkut
2022-11-18 05:37:53+00:00,jalanjalandotin,bukan gunung yang harus kita taklukan melainkan diri kita sendiri jalanjalanin
2022-11-18 05:37:50+00:00,titapertiwi2,aturan 95 jangan menjadi lautan untuk orang yang lebih suka mendaki gunung tapi ini bukan tentang sebuah tempat
2022-11-18 05:37:44+00:00,Randhy_nusa,gunung lompobattang full senyum
2022-11-18 05:36:45+00:00,charlesmpg88_,di indonesia ada tujuh puncak gunung tertinggi yang disebut dengan seven summit indonesia salah satu puncak tertingg
2022-11-18 05:35:37+00:00,Sekdemangpmj,anggota polsubsektor pademangan barat aipda dede melaksanakan sambang dan patroli dialogis di bank bca ruko gunung sahari pademangan barat menyampaikan pesan kamtibmas dengan keamanan situasi kondusif
2022-11-18 05:35:12+00:00,Chsteenna,pantai gunung senja langit bintang bulan air terjun laut is my fav
2022-11-18 05:33:35+00:00,tugumalang_id,gunung semeru lontarkan abu dan hanyutkan truk
2022-11-18 05:33:08+00:00,diovandi,tiba tiba kepengen ngerasain solat di puncak gunung random abis
2022-11-18 05:32:29+00:00,yuari_sarah,biasakan nulis nama tempat yg spesifik pakai huruf kapital gunung ijen gunung lawu
2022-11-18 05:32:26+00:00,polsek_kebbaru,polsekmetrokebayoranbaruberbuat anggota bhabinkamtibmas mahmud sambang wilayah menyapa warga lakukan interaksi dialogis dengan warga rt 07 jl lauser kel gunung kebayoran baru pmj pmj polripresisi polisijaksel jakselpresisi beagoodcop
2022-11-18 05:30:26+00:00,ADDMERIAN,viral di fb keadaan terkini gunung ganang di perak jujurnya aku sedih dengan apa yang berlaku tetapi seorang temanku berkata
2022-11-18 05:30:11+00:00,theloopss,betul bli misalnya semoga nitizen 62 heboh krn 700ha hutan alam di kab gunung mas kalteng dibabat habis utk
2022-11-18 05:29:26+00:00,climax_ao,hiking ke gunung trekking ke kawah citytour malang batu snorkelling menjangan amp gili labak anda butuh kami siap climax adventure
2022-11-18 05:29:11+00:00,detik_jabar,lorong waktu kesaksian walkot bandung yana mulyana yang masih ingat betul momen ketika gunung galunggung meletus hingga membuat bandung gelap
2022-11-18 05:27:38+00:00,Mimisantehbotol,gunung sahari kali kwitang kesono
2022-11-18 05:27:28+00:00,djedjeandrea,kata para penganut klenik itu biasanya ada badai di sana seperti hujan angin gt lah tp cm diatas gunung saja
2022-11-18 05:27:05+00:00,t0kohijau,sendal gunung tali korea pria wanita best seller
2022-11-18 05:26:52+00:00,tntambora,baru saja mengirim foto gunung tambora
2022-11-18 05:25:31+00:00,1424Kodim,babinsa desa gunung perak koramil 1424 02 sinjai barat serda mungkar mengikuti rapat musyawara desa pembahasan rencana kerja dan anggaran 2023 desa gunung perak jumat 18 11 2022
