created_at,author,cleaned_tweet
2022-11-18 03:23:27+00:00,501Awani,tumpuan utamanya adalah untuk menyelesaikan isu pengairan yang membelenggu tanaman sawah padi sejak sekian lama awaninews awanipagi pru15 malaysiamemilih
2022-11-18 03:22:48+00:00,NazShadow,viral di fb keadaan terkini gunung ganang di perak jujurnya aku sedih dengan apa yang berlaku tetapi seorang temanku berkata
2022-11-18 03:22:23+00:00,Humaspolsekbi11,pada hari jumat tanggal 18 nopember 2022 personil polsek binjai selatan melaksanakan patroli sekaligus sepanjang jalan gunung singgalang kelurahan bhakti karya kec binjai selatan pada hari kamis tanggal 17 november 2022 kegiatan merupakan antisipasi terjadinya
2022-11-18 03:21:33+00:00,Kentarockers,selandai landainya gunung
2022-11-18 03:20:38+00:00,vimax6969,mmg tak senang nak mansuhkan tp dh ada perjuangan ini gunung kalau di tarah guna tukul besi lama lama ada rata jugak
2022-11-18 03:20:04+00:00,junhanul,gunung salak dari balkon sklh ak bagus bgt
2022-11-18 03:19:55+00:00,Ramdani_L,gunung padang nih
2022-11-18 03:18:13+00:00,NadyAliiii,melaka ni sejak zaman purba lagi asyik tak jadi je buat contohnya nak bina jambatan emas ke gunung ledang mana mau nya
2022-11-18 03:18:01+00:00,o3nNHboQbkXZQnn,iyo iyo yo yo yo faham tenan aku ngene iki aku suka 1 yg kanan aja yg membntu bpk nya merakak gunung demi rakyatnya 2 aku gk suka yg mendorong bpk nya turun gunung demi anaknya
2022-11-18 03:17:48+00:00,SinggihPutranto,bangunan kantor milik perusahaan kopi di besowo kediri tahun 1915 besowo berada di kaki gunung gajah mungkur dan berad
2022-11-18 03:17:02+00:00,satanircg,bangunan kantor milik perusahaan kopi di besowo kediri tahun 1915 besowo berada di kaki gunung gajah mungkur dan berad
2022-11-18 03:16:30+00:00,Gitasa725,yukk lebih semangat lagi yaa guys nonton ikatancinta di tv biar burempun banyak semut on ajah sambil nonton di app rcti makasih cemuaaa semangat teruz buat kita pecinta aladin ijoungu jaya teroz meski di gunung teroz
2022-11-18 03:16:18+00:00,cahyoaro,gulungan benang warna pink di gunung krakatau
2022-11-18 03:14:07+00:00,sobat_buyar,gunung andong
2022-11-18 03:14:03+00:00,ArmelRizwan_,mau menang gimana atuuh nyaiiii yo nda mampu aku ng rt sm ng rep nya tp yo wis lahh ari sudah rezeku mah gak kan lari gunung di kejaaar moga aja rezeki di hari ultah anakku
2022-11-18 03:13:57+00:00,ridzuandzulkif1,pru tahun ni macam kurang hype sikit kalau macam tahun sebelum ni dia punya kempen gila gila dari rakyat sendiri contoh macam pengundi yg stay oversea kempen dengan bendera parti ada yang dalam air atas puncak gunung gila gila rasa
2022-11-18 03:13:41+00:00,aomsuvshar,maunya gunung
2022-11-18 03:12:32+00:00,ady_ico,ning segoro gunung kan
2022-11-18 03:12:20+00:00,_mizseung_,viral di fb keadaan terkini gunung ganang di perak jujurnya aku sedih dengan apa yang berlaku tetapi seorang temanku berkata
2022-11-18 03:12:14+00:00,sampunlilo,naik gunung
2022-11-18 03:11:44+00:00,my_syifauddin,sate klatak pak jede di depok sleman atau pak bari di bantul manglung caf di daerah gunung kidul angkringan kr oseng mercon bu narti gudeg pawon terus ada juga ayam goreng tepung terenak yg murah meriah rasa gak kalah sama mekdi dan kaefci olive chicken
2022-11-18 03:10:09+00:00,Otnupid,yo yo yo gunung apalagi yang akan datang kali ini
2022-11-18 03:09:10+00:00,nonandraaa,aku juga kaya kmu mba suka bgt sama mtk klo udah ngerjain apa lagi tau rumus nya tapi benci juga sama mtk ngerti ga si kaya aku males ngerjain mtk tapi kadang cinta dan males nya krna jawabanya se gunung akhirnya g ngerjain wkwk
2022-11-18 03:09:09+00:00,matchddct,minggu kemarin ke pangandaran kemarin ke jogjakarta skrg otw gunung pls gpp november full healing
2022-11-18 03:08:10+00:00,hayatisajaa,tips menarik buat newbie yg mau nanjak gunung
2022-11-18 03:08:08+00:00,k1k1taufik,foto2 yg diambil minggu lalu mengingatkan syair ini tanah tandus kerontang banjir datang itu pasti dr lagunya iwan fals yg judulnya isi rimba tak ada tempat berpijak lagi dan memang bener itu terjadi di kab gunung mas tepatnya di area food estate pemerintah pak
2022-11-18 03:07:41+00:00,AwjNurul,bisa2x pada make item2 pas hunting di gunung
2022-11-18 03:07:36+00:00,infontbcom,ingatpepatah ntb gt rendah gunung tinggi harapan sedemikian tingginya harapan sehingga gunungpun terlihat lebih rendah dibanding harapan tersebut
2022-11-18 03:07:23+00:00,detik_jabar,cerita warga ketika kelabakan mengamankan hewan ternak saat hujan abu dari letusan gunung galunggung menyebar di langit bandung
2022-11-18 03:06:37+00:00,sigit_pam,aduh keren pisan euy eta gunung mana mang
2022-11-18 03:06:14+00:00,Paluuugada,gunung isuk2 liat sunrise karo sarapan mie amp kopi teh panasss
2022-11-18 03:05:39+00:00,Hamdani48800861,naik gunung dan mnjelajah alam bu
2022-11-18 03:03:09+00:00,Krupukkuliit,aturan 95 jangan menjadi lautan untuk orang yang lebih suka mendaki gunung tapi ini bukan tentang sebuah tempat
2022-11-18 03:03:07+00:00,soma_cemeng,candi jawi yang di bangun sekitar abad ke 13 peninggalan bersejarah hindu buddha kerajaan singhasari terletak di kaki gunu
2022-11-18 03:02:47+00:00,Shocrid2017,semangat adalah sebuah gunung berapi dimana diatas puncaknya rumput keraguan tidak pernah tumbuh eaw
2022-11-18 03:02:39+00:00,Distiancok,mbiyen pas cilik takon make gunung kae opo mak jenenge gunung botak lee panggah wis gede tak parani kok ra ono purele
2022-11-18 03:01:48+00:00,RoberT94319427,ada yang tau apa nama gunung yg menjadi background dari kota jakarta ini
2022-11-18 03:01:41+00:00,SendangSedayu,candi jawi yang di bangun sekitar abad ke 13 peninggalan bersejarah hindu buddha kerajaan singhasari terletak di kaki gunu
2022-11-18 03:01:31+00:00,meteosphere,bencana geologi gempabumi tsunami letusan gunung berapi dan tanah longsor
2022-11-18 03:01:12+00:00,Arta_Heathent,kamu itu kayak suasana pantai dan gunung yang bikin sejuk dan lupa tentang apa itu kesedihan dan juga bikin kangen kalo udah sampe rumah
2022-11-18 03:01:05+00:00,AlanMaria3127,sby turun gunung ahypolitikusgagal ahyasalbicara sbymangkrakahyasbun ahygagalditnigagaldipolitik ahygagalnyapres hambalangmangkrak sbyturungunung demokratkoruptor ahybaukencur
2022-11-18 03:01:03+00:00,shirohyde,mungkin karena hutan laut gunung hanya menjadi identitas budaya sebagian kecil orang saja
2022-11-18 03:00:31+00:00,elvalativia_,cianjur puncak sukabumi ini yg saya sebutin bukan daerah kota rata rata daerah deket gunung yg sinyal analog susah nyampenya kebanyakan pake parabola terus baca ini juga deh
2022-11-18 03:00:16+00:00,TomasSalast,ahy si cipika cipiki dengan bapak bikin sby turun gunung karena kegagalannya ahypolitikusgagal ahyasalbicara sbymangkrakahyasbun ahygagalditnigagaldipolitik ahygagalnyapres hambalangmangkrak sbyturungunung demokratkoruptor ahybaukencur
2022-11-18 03:00:06+00:00,dewantiputri,tapi dari jaman sebelum nikah juga gitu sih kalo naik gunung yang packingin keril pasti dia rapih aja gitu dan muat banyak jadi ku terima beres aja
2022-11-18 02:59:36+00:00,luvpiess,view kelas tumben bgt ni gunung keliatan bgt anjir
2022-11-18 02:59:09+00:00,Zippo82594786,keren salam dr jateng lereng gunung slamet
2022-11-18 02:57:17+00:00,AbuM024,sesungguhnya sedekah seseorang walau hanya sesuap akan dikembang biakkan olehnya seperti gunung maka bersedekahlah hr bukhari muslim pegangteguhsyariah e2nfg
2022-11-18 02:56:18+00:00,PMerawan,bhabinkamtibmas polsek dolok meraean melaksanakan pengaturan lalin di depan sdn 102126 desa gunung para ii kec dolok merawan kab sergai guna antisipasi kemacetan dan kecelakaan lalu lintas serta memberikan rasa aman kepada siswa i serta warga masyarakat pengguna jalan
2022-11-18 02:55:44+00:00,fjrmuharram,semoga ya kak nanti kita ketemu di yogya ngopi bareng anak anak lain sambil liatin gunung merapi
2022-11-18 02:55:17+00:00,bondanunu,legasi bn kot cuba tgk kt ipoh tu bukit digondol kerajaan negeri mn tu bn gunung pulai joho
2022-11-18 02:54:34+00:00,kimimaki,wah isine akeh kuwi mas ono sing penguasa gunung juga ketoke tak tunggu kabare
2022-11-18 02:54:34+00:00,petabencana,halo saya bencana bot untuk melaporkan letusan gunung api di sekitarmu silakan balas dengan gunungmeletus
2022-11-18 02:54:02+00:00,mhmmdstr__,eigertips mendaki gunung menjadi salah satu aktivitas yang menguras banyak tenaga maka itu kita perlu tahu tips mend
2022-11-18 02:53:56+00:00,BprMas,mau tau sahabatgm mereka mudah gampang dan cepat banget dapet modal buat usaha pt bpr gunung mas solusi cerdas bunga mulai dari 1 per bulan
2022-11-18 02:51:42+00:00,HandikaNovi1inh,prongos gunung wilis apik viewne
2022-11-18 02:51:13+00:00,Reyza19914,tinggalkan dosa kecil maupun besar itulah takwa bersikaplah seperti orang yang berjalan di atas tanah berduri dia selalu waspada dengan apa yang dilihatnya jangan remehkan dosa kecil sesungguhnya gunung itu dari kumpulan kerikil ibnu mu taz rahimahullah
2022-11-18 02:50:50+00:00,CuciReklame,waduhhh sekolah adik saya di sman 1 gunung sindur bogor juga sperti ini pak diwajibkan setiap bulannya 100 250
2022-11-18 02:50:49+00:00,aduhjangar,terus harus nya gimana kak apa harus naik gunung juga
2022-11-18 02:46:28+00:00,dingerous_man,viral di fb keadaan terkini gunung ganang di perak jujurnya aku sedih dengan apa yang berlaku tetapi seorang temanku berkata
2022-11-18 02:46:18+00:00,Dewioppo3,sby turun gunung untuk membela ahy yang tidak ada mengusung tolak keras ahy bodoh ahypolitikusgagal ahyasalbicara sbymangkrakahyasbun ahygagalditnigagaldipolitik ahygagalnyapres hambalangmangkrak sbyturungunung demokratkoruptor ahybaukencur pro
2022-11-18 02:45:41+00:00,nshrffi,viral di fb keadaan terkini gunung ganang di perak jujurnya aku sedih dengan apa yang berlaku tetapi seorang temanku berkata
2022-11-18 02:45:22+00:00,kabarlhk,jika ke situ sangiang sekalian kunjungi puncak sawiyah untuk menikmati keindahan lekukan gunung ciremai
2022-11-18 02:45:19+00:00,dpphapi,pagi ini hapi on air di siarannya popfm jogja kita diskusi tentang peristiwa atap roboh di sd gunung kidul jogja juga bahas keresahan penggunaan baja ringan buat warga jogja kita gass dengerin siaran di sekarang yuk
2022-11-18 02:45:08+00:00,sptr09096872,aturan 95 jangan menjadi lautan untuk orang yang lebih suka mendaki gunung tapi ini bukan tentang sebuah tempat
2022-11-18 02:45:00+00:00,ngalamfess,oyi musim udan gais ojo lali tumbas mantel aku nyoba nyoba tuku iki penak warna e apik wkwkwk bahan e koyo jaket gunung 60 ewu pisan
2022-11-18 02:44:44+00:00,Tlaksas,gunung kidul bkn si
2022-11-18 02:44:42+00:00,t0thespace_,ndakik2 ke puncak gunung
2022-11-18 02:44:17+00:00,Albapparel354,terbaru wa 0822 1036 9354 tempat bikin jersey futsal printing custom di mulyorejo surabaya klik baju futsal cowok di gubeng surabaya baju futsal cream di gunung anyar surabaya baju futsal curva di jambangan surabaya baju futsal custom di karang
2022-11-18 02:44:14+00:00,azri_akmal98,viral di fb keadaan terkini gunung ganang di perak jujurnya aku sedih dengan apa yang berlaku tetapi seorang temanku berkata
2022-11-18 02:43:28+00:00,OtherMinjeong,mendaki gunung melewati lembaahh
2022-11-18 02:43:27+00:00,BIGdedyREDS,dulur sadayana aku akan kedatangan tamu dari jepang landing jam 18 di soetta semua proses imigrasi amp makan udon dulu
2022-11-18 02:43:19+00:00,emerson_yuntho,waduhhh sekolah adik saya di sman 1 gunung sindur bogor juga sperti ini pak diwajibkan setiap bulannya 100 250
2022-11-18 02:42:04+00:00,arrrva,ada bang di daerah gunung batu mamangnya friendly abissss lu bisa diajak ngobrol sm dia sampe jam 2 pagi
2022-11-18 02:41:52+00:00,BakarSmith,tanggal 3 des 2022 di lereng gunung merapi
2022-11-18 02:40:49+00:00,zarrar____,ngeri anak gunung
2022-11-18 02:39:43+00:00,amrlhaikal,viral di fb keadaan terkini gunung ganang di perak jujurnya aku sedih dengan apa yang berlaku tetapi seorang temanku berkata
2022-11-18 02:38:53+00:00,dini_nurul10,dimensi lain gunung merapi pendakian yang tak terlupakan true story a thread bacahorror
2022-11-18 02:37:55+00:00,jalanjalandotin,apa kalian percaya mitos tentang hal hal yang berada di alam liar mungkin salah satunya gunung
2022-11-18 02:37:38+00:00,mapagama_ugm,kamis 3 11 menjadi hari bersejarah di pulau banda naira maluku tengah provinsi maluku dengan keberhasilan penerbangan
2022-11-18 02:37:16+00:00,CaraBellaDonna,pastik gunung sahari
2022-11-18 02:36:16+00:00,stoberihoney,pagi pagi dah naik gunung
2022-11-18 02:35:10+00:00,ihsan2214,alamak boleh jadi
2022-11-18 02:35:08+00:00,elia_peekaloosh,viral di fb keadaan terkini gunung ganang di perak jujurnya aku sedih dengan apa yang berlaku tetapi seorang temanku berkata
2022-11-18 02:34:01+00:00,SaberPungliRI,polres gunung mas tim sapu bersih pungutan liar saber pungli terus melaksanakan sosialisasi tentang saber pungli khususnya di wilayah hukum polsek manuhing jajaran polres gunung mas gumas polda kalteng baca selengkapnya di saberpungli
2022-11-18 02:33:37+00:00,budhihermanto,tanggal 3 des 2022 di lereng gunung merapi
2022-11-18 02:32:55+00:00,Cardi29Thereal,tonton kisah mistis pendakian gunung butak 3 pendaki itu pendakian horrormu 17 di youtube
2022-11-18 02:32:30+00:00,Jacksen41512678,ini nama game setan gunung merapi banjak iblis nya
2022-11-18 02:30:38+00:00,riskimamonto52,sby turun gunung bela ahy politikus gagal politikus tolol ahy politikus dungu ahypolitikusgagal ahyasalbicara sbymangkrakahyasbun ahygagalditnigagaldipolitik ahygagalnyapres hambalangmangkrak sbyturungunung demokratkoruptor ahybaukencur
2022-11-18 02:30:19+00:00,dilatm80,dulur sadayana aku akan kedatangan tamu dari jepang landing jam 18 di soetta semua proses imigrasi amp makan udon dulu
2022-11-18 02:30:04+00:00,dgrayi13,bangunan kantor milik perusahaan kopi di besowo kediri tahun 1915 besowo berada di kaki gunung gajah mungkur dan berad
2022-11-18 02:29:59+00:00,09_serli,hebat pada gak takut ketingian itu kalau hujan licin gimana kayanya rumah di daratan bawah lebih mahal dari pada di atas gunung
2022-11-18 02:29:35+00:00,rmsalomo,misteri gunung api hai kawan mitigasi karena indonesia mempunyai banyak gunung api menjadikan banyak pos pengamatan gunung a
2022-11-18 02:28:49+00:00,rasjawa,dulur sadayana aku akan kedatangan tamu dari jepang landing jam 18 di soetta semua proses imigrasi amp makan udon dulu
2022-11-18 02:27:35+00:00,mjoInirrr,pgn bisa gambar kek gni biar gk gambar pemandangan gunung trs
2022-11-18 02:27:23+00:00,sbyfess,rek haloo ada yg domisili di gunung anyar dan pernah pake ssw alfa kalo ada boleh tolong rep minta tolong buat isi gform buat riset mata kuliah terimakasih banyak
2022-11-18 02:27:18+00:00,lhina696,keindahan alam takengon seolah tersembunyi di balik gunung gunung
2022-11-18 02:27:17+00:00,SugihPolsek,baru saja mengirim foto polsek gunung sugih
2022-11-18 02:26:52+00:00,userthvlokal,mau beliii tapi takut karna review org org bilang kalau ni softex kyk kita berasa di gunung es
2022-11-18 02:26:29+00:00,Mentaz_id,orang sombong itu seperti orang yang berdiri di atas gunung dari atas dia memandang semua orang dibawah itu kecil dia tidak sadar orang memandang dia juga kecil
2022-11-18 02:26:15+00:00,lalu_lula77,pemasukan dari tiket masuk tngr klo bisa dimanfaatkan utk program reboisasi jaga keindahan pesona alam gunung rinjani
2022-11-18 02:26:12+00:00,actdinn,namannya kembang krasa meski itu hanya semacam gelar namun sri tahu arti nama itu yg berarti bunga krasa bunga y
2022-11-18 02:25:42+00:00,Apriartha_mulia,menuruni gunung memang lebih mudah daripada mendaki tetapi keindahan bukan terlihat di bawah melainkan pada puncaknya arnold bennett
2022-11-18 02:25:30+00:00,syanylaa,aturan 95 jangan menjadi lautan untuk orang yang lebih suka mendaki gunung tapi ini bukan tentang sebuah tempat
2022-11-18 02:25:25+00:00,ArjunAbdillah,iki gunung ganok a
2022-11-18 02:25:11+00:00,adri7537,keq ngomong di depan anak sd di mna naik gunung ya mendaki lah emg mau nyelam
2022-11-18 02:25:09+00:00,joyokus97513975,ke gunung
2022-11-18 02:24:05+00:00,yessy_young,turun gunung
2022-11-18 02:22:06+00:00,Douglasmicronci,candi jawi yang di bangun sekitar abad ke 13 peninggalan bersejarah hindu buddha kerajaan singhasari terletak di kaki gunu
2022-11-18 02:21:37+00:00,anggunggg,kalo ini jatuh cinta di lapangan voli eh gunung juga
2022-11-18 02:21:18+00:00,ekahariwidodo,naik2 kepuncak gunung tinggi2 sekali
2022-11-18 02:20:58+00:00,sulijunsu,lur udah pernah denger batik lo belum ini motif batik khas logandeng playen gunung kidul ada sejarah besar di bal
2022-11-18 02:20:55+00:00,Bogordaily_net,buka tutup jalan merdeka contra flow jalan veteran kapten muslihat jumat pagi 18 november 2022 untuk mengurai kepadatan arus lalin dari gunung batu yang menuju pusat kota dilakukan buka tutup jalan dan contra flow temporer di jam sibuk pagi hari viral trending
2022-11-18 02:20:13+00:00,iqballlssss,seru uga nih episode pertamanya di gunung padang
2022-11-18 02:19:45+00:00,Arta_Heathent,kamu itu kayak suasana pantai dan gunung yang bikin sejuk dan lupa tentang apa itu kesedihan dan juga bikin kangen kalo udah sampe rumah
2022-11-18 02:19:24+00:00,catboyunki,semedi di gunung kali ya
2022-11-18 02:19:07+00:00,ylxnk,viral di fb keadaan terkini gunung ganang di perak jujurnya aku sedih dengan apa yang berlaku tetapi seorang temanku berkata
2022-11-18 02:18:41+00:00,Kukuch13,disana lamaran disitu manjat pelaminan dan entah mengapa disini saya masih sibuk mikirin lusa gunung apa yang jadi target pendakian
2022-11-18 02:16:50+00:00,amirulhaziqqq,viral di fb keadaan terkini gunung ganang di perak jujurnya aku sedih dengan apa yang berlaku tetapi seorang temanku berkata
2022-11-18 02:16:03+00:00,HssWonderful,bukit langara itulah nama bukit berbatu tersebut dari atas puncak bukit kamu pun dapat melihat kokohnya gunung kentawan tempat wisata ini dulunya tidak banyak dilirik oleh wisatawan repost ig syarifahrisqa kandanganbungas wonderfulkalsel
2022-11-18 02:15:30+00:00,Gaemhadid,alias klo blm move on mah bisa semedi dulu gih di gunung drpda nyakitin perempuan baik hadehhhh
2022-11-18 02:14:40+00:00,icemozsi,disana gunung disini gunung aku juga pengen win ij
2022-11-18 02:14:37+00:00,bobolohoan,budak leutik mapay gunung kutu tatarucingan
2022-11-18 02:14:04+00:00,abishamoon,seru nih drama elon wk cuma emg drama tech startup seru di ikutin life cycle mereka tuh naik turun cepat bagaikan gunung dan lembah wkwk
2022-11-18 02:13:56+00:00,Revonnator,wkwkwkwkwkwk gunung doanggg buketos
2022-11-18 02:13:41+00:00,nirmalsalsabila,promo diskon arsy sport sandal gunung pria jepit abu diskon 33 checkout sekarang
2022-11-18 02:13:37+00:00,SalonFacialSby,wa 0821 4076 1119 bb glow meso white kedung baruk surabaya reservasi hubungi bb glow skin whitening di beauty corner surabaya gunung anyar tambak surabaya bb glow skin whitening di beauty corner surabaya rungkut menanggal surabaya
2022-11-18 02:13:15+00:00,fajardwikur13,aturan 95 jangan menjadi lautan untuk orang yang lebih suka mendaki gunung tapi ini bukan tentang sebuah tempat
2022-11-18 02:12:42+00:00,sukmabambang3,sleman gunung merapi
2022-11-18 02:09:41+00:00,Riayaaa_,ingin hati memegang gunung tapi apa daya milik tetangga
2022-11-18 02:09:32+00:00,Teladan2Rasul,rasulullah saw bersabda aku menjadikan kota madinah sebagai tanah suci antara dua gunung teladanrasul
2022-11-18 02:09:23+00:00,ctynur23,sampe gue nanjk gunung juga dibolehin akhirnya keinginam gue nanjk gunung tercapai juga
2022-11-18 02:08:33+00:00,piscsy,jalan kaki di unchdeep tu sama aja kayak simulasi tektok gunung prau
2022-11-18 02:08:12+00:00,yappyy002,viral di fb keadaan terkini gunung ganang di perak jujurnya aku sedih dengan apa yang berlaku tetapi seorang temanku berkata
2022-11-18 02:07:53+00:00,Itsmehenely,bersyukurlah ada yg nyari dan chinese wkwkw langka mereka mau turun gunung kwkw jd pen ke sby jg deh cek ombak
2022-11-18 02:07:52+00:00,jalanjalandotin,sudah berapa gunung yang kalian daki yang merupakan bagian dari seven summit
2022-11-18 02:07:09+00:00,hu_dzai_,viral di fb keadaan terkini gunung ganang di perak jujurnya aku sedih dengan apa yang berlaku tetapi seorang temanku berkata
2022-11-18 02:06:56+00:00,TalkToPhillip,berita emiten pt gunung raja paksi tbk ggrp mencatatkan peningkatan laba bersih sebesar 22 3 menjadi usd 49 21 juta hingga kuartal iii 2022 disclaimer on
2022-11-18 02:06:44+00:00,bangsad123,cinta itu indah bagaikan gunung kalau dipandang dri sisi jauh betapa indahan gunung itu tapi bila dilihat dari sisi dekat penuh dengan liku2
2022-11-18 02:04:40+00:00,GatotRiyoko,lumayan besar gunung kembarnya
2022-11-18 02:04:12+00:00,tvOneNews,gunung merapi luncurkan dua kali guguran lava pijar sejauh 1 8 kilometer
2022-11-18 02:03:56+00:00,Indraja47947124,aipda indra jaya bhabinkamtibmas kelurahan ujung gunung polsek menggala polres tulang bawang memberikan himbauan kamtibmas kepada warga agar sadar kamtibmas kel ugu kec menggala kab tuba polripresisi divisihumaspolri humas poldalampung humaspolrestuba polsekmenggala
2022-11-18 02:03:36+00:00,Indraja47947124,aipda indra jaya bhabinkamtibmas kelurahan ujung gunung polsek menggala polres tulang bawang memberikan himbauan kamtibmas kepada warga agar sadar kamtibmas polripresisi divisihumaspolri humas poldalampung humaspolrestuba polsekmenggala
2022-11-18 02:01:56+00:00,DConanFans_,torigabuto juga bisa dijadikan jamu jika racunnya diambil banyak tumbuh di gunung dan bentuk bunganya sangat manis ilmudc
2022-11-18 02:01:49+00:00,shitaafl,ndemek pupu munggah gunung semeru hahaha
2022-11-18 02:01:26+00:00,snsh_catlady,melaka ni sejak zaman purba lagi asyik tak jadi je buat contohnya nak bina jambatan emas ke gunung ledang mana mau nya
2022-11-18 02:01:11+00:00,raion_ss,viral di fb keadaan terkini gunung ganang di perak jujurnya aku sedih dengan apa yang berlaku tetapi seorang temanku berkata
2022-11-18 02:00:08+00:00,AlbaaReza,oh bu bidan gunung nya
2022-11-18 01:58:50+00:00,bubble9497,jauh ya kak aku harus melewati lautan gunung lembah bukit
2022-11-18 01:57:42+00:00,hikariimuu,gunung yang tinggi besar luas dan gagah perkasapun tidak pernah bangga lalu kenapa engkau yang hanya sejentiknya berani sombong malulah sama gunung
2022-11-18 01:56:55+00:00,ziggyziggytom,seru uga nih episode pertamanya di gunung padang
2022-11-18 01:56:49+00:00,RYUJINNIEc143,mau mendaki gunung lewati lembah join
2022-11-18 01:55:47+00:00,JogjaRavers,gunung andong gaess udah pernah kesini permalink gambar yang terpasang
2022-11-18 01:55:44+00:00,topworldcoach,bukan gunung yang harus kita taklukkan tapi diri kita sendiri edmund hillary
2022-11-18 01:55:33+00:00,BangunPolsek,bhabinkamtibmas polsek bangun aiptu suyut melaksanakan pengaturan lalulintas di jalan asahan km 17 depan smp dan sma teladan bangun nagori bangun kec gunung malela kab simalungun polripresisi
2022-11-18 01:55:05+00:00,HistoriDunia2,bangunan kantor milik perusahaan kopi di besowo kediri tahun 1915 besowo berada di kaki gunung gajah mungkur dan beradius kurang lebih 10 km dari kawah gunung kelud
2022-11-18 01:55:04+00:00,puthrie_gita,yang mau ke gunung sindoro yuk cuss kepoin dulu jalurnya
2022-11-18 01:54:53+00:00,Kriswah25138252,bhabin gunung simping sosialisasi akun medsos polresta cilacap dan polsek cilacap tengah polripresisi
2022-11-18 01:54:33+00:00,Sall2909_,la kg mano uwan atok akak pun org sana abah oghang merua omak oghang moghotang dokek ngan klinik gunung paser
2022-11-18 01:53:12+00:00,0x_jendaLjenduL,nyuci piring sak gunung berapa hari mumbruk
2022-11-18 01:52:52+00:00,Hartoyo78401221,indonesia surga aparat keji bagaimana kekejaman ditanamkan pada aparat kasus ferdi sambo hanyalah fenomena gunung es
2022-11-18 01:52:28+00:00,puteriieja,viral di fb keadaan terkini gunung ganang di perak jujurnya aku sedih dengan apa yang berlaku tetapi seorang temanku berkata
2022-11-18 01:52:07+00:00,JuandaPNL,disini gunung disana gunung di tengah tengahnya ada kembang kamboja kamu bingung saya pun bingung kenapa ada kembang kamb juju motivation
2022-11-18 01:50:56+00:00,ZizaAreiz,viral di fb keadaan terkini gunung ganang di perak jujurnya aku sedih dengan apa yang berlaku tetapi seorang temanku berkata
2022-11-18 01:50:50+00:00,pisangorens,hyunsik kesabarannya setinggi gunung everest
2022-11-18 01:48:18+00:00,puppydaddyyeol,no traffic jam nice weather no polution sampe2 gunung yg biasanya tertutup polusi skrg keliatan
2022-11-18 01:48:12+00:00,Jackgyeombeom,viral di fb keadaan terkini gunung ganang di perak jujurnya aku sedih dengan apa yang berlaku tetapi seorang temanku berkata
2022-11-18 01:48:08+00:00,bluuuberry_,gunung anyar
2022-11-18 01:47:41+00:00,SofwanRzl,nek gunung nak sby eroku yo gunungsari
2022-11-18 01:46:58+00:00,detik_jabar,kala abu letusan gunung galunggung membuat langit jabar mendadak gelap gulita selama lima hari berturut turut pada tahun 1982
2022-11-18 01:44:22+00:00,bitjiamdojcat,bikin wangi mint terus kalo lu kek cebok gtu langsung berasa kek di gunung dingin bgt wkwkwk jd agak kaget
2022-11-18 01:43:28+00:00,satyakti,gunung tambora salah satu penyebab dominan tahun 536 adalah tahun terburuk sepanjang sejarah
2022-11-18 01:42:17+00:00,ErvanLeo5,wisata gunung di sumatera utara memang asik apalagi cuacanya benar benar adem
2022-11-18 01:39:02+00:00,aQuaRiius_s,aturan 95 jangan menjadi lautan untuk orang yang lebih suka mendaki gunung tapi ini bukan tentang sebuah tempat
2022-11-18 01:38:55+00:00,guna1243,lumayan buat mancing gerombolan monyet buzer turun gunung keluarin skill dungu belain junjungannya
2022-11-18 01:38:38+00:00,DisPanganBerau,2 disampaikan camat gunung tabur event ini merupakan even nasional tahunan yang dilakukan dan merupakan event yang kedua selain festival kuliner juga diadakan berbagai tarian dari berbagai suku
2022-11-18 01:38:25+00:00,Sapto993,sambang pkl diwilayah kel gunung telihan serta memberikan himbauan kamtibmas
2022-11-18 01:38:01+00:00,bogel_byl,halo wargamerapi berikut kami sampaikan infografis laporan aktivitas gunung merapi periode 16 november 2022 pukul 00 00 24 0
2022-11-18 01:37:54+00:00,jalanjalandotin,pendakian gunung mana di indonesia yang menurut kalian paling berkesan mendakigunung di indonesia
