created_at,author,cleaned_tweet
2022-11-18 13:02:47+00:00,PDI_Perjuangan,anggota komisi iv dpr ri vita ervina mengajak para pemangku kepentingan lintas sektoral untuk melindungi dan menyelamatkan kawasan konservasi dan lingkungan hidup taman nasional gunung merapi tngm upaya pencegahan kerusakan kawasan tngm dengan melaksanakan dialog interaktif
2022-11-18 13:02:46+00:00,PDI_Perjuangan,vita ervina ajak pemangku kepentingan selamatkan taman nasional gunung merapi vita ervina ajak pemangku kepentingan melindungi dan menyelamatkan tngm
2022-11-18 13:02:24+00:00,hisewlgi,ih apaaan asepnya kena juga sengaja eluh yhaaaaa aaaaa mau aku tebalikin tuh gunung
2022-11-18 13:02:14+00:00,AlifFiansah1,gunung kembar
2022-11-18 13:01:57+00:00,exactly_edir,viral di fb keadaan terkini gunung ganang di perak jujurnya aku sedih dengan apa yang berlaku tetapi seorang temanku berkata
2022-11-18 13:01:48+00:00,huffIepuffgirl,maap aing br turun gunung
2022-11-18 13:01:03+00:00,IU_Yuliani,o gitu bukan hanya fb nanti hanimun daffa ada lumba2 gunung melutus ma ombak ga ya
2022-11-18 13:00:54+00:00,g_muchajalin,rekomendasi jaket gunung a thread
2022-11-18 13:00:45+00:00,SAUNGBERMAIN,dah stop ngumpet di ronde satu yang ngumpet di gunung merapi asep nya dadah dulu kurangin nyawa nya
2022-11-18 13:00:25+00:00,JayantiIndah3,pengen nonton tapi tak punya netflix wkwkwk yg udah pernah ke gunung padang pasti bisa lebih relate sih
2022-11-18 13:00:14+00:00,khairycordoba,viral di fb keadaan terkini gunung ganang di perak jujurnya aku sedih dengan apa yang berlaku tetapi seorang temanku berkata
2022-11-18 13:00:11+00:00,najaemside,lucu banget adikmu berbakat akhirnya ibu guru tidak hanya melihat gambar dua gunung sawah dan jalan saja lucu b
2022-11-18 12:59:42+00:00,alifilyas88,tadi sepupu darjah 1 tanya kenapa air panas tu dia berasap aku jawab sebab dia panas la salah sebab kita dikelilingi gunung berapi jemm
2022-11-18 12:59:33+00:00,rasyel555,naik naik ke puncak gunung tinggi tinggi sekalii
2022-11-18 12:59:08+00:00,mirul_acap1117,kumpulan pelancong menyelamatkan diri di sebuah dewan terbuka di tempat lebih tinggi sementara menunggu ketibaan bomba awan
2022-11-18 12:57:49+00:00,KlutzyKucing,viral di fb keadaan terkini gunung ganang di perak jujurnya aku sedih dengan apa yang berlaku tetapi seorang temanku berkata
2022-11-18 12:56:32+00:00,Sujiwulandari_,pernah nemenin orang mendaki gunung sampai puncak tapi aku lupa kalo di puncak itu rame akhirnya milih untuk turun sendirian tapi ini bukan soal puncak
2022-11-18 12:56:10+00:00,pegipegi,selanjutnya ada the olive gunung salak terletak di kaki gunung salak kamu bisa menyaksikan view gunung pangrango langsung dari balkon kamar fasilitasnya juga super lengkap pokoknya pas banget deh buat tempat menginap seru bareng keluarga
2022-11-18 12:56:04+00:00,pegipegi,suasana pegunungan yang asri dan udara yang sejuk di the jayakarta cisarua inns amp villas bikin kamu betah menginap kamarnya menghadap ke gunung pangrango ada juga kolam renang lapangan futsal serta meja billiard dan tenis meja buat kamu yang suka olahraga
2022-11-18 12:55:27+00:00,manisdiawal11,aturan 95 jangan menjadi lautan untuk orang yang lebih suka mendaki gunung tapi ini bukan tentang sebuah tempat
2022-11-18 12:52:36+00:00,NURULZUBAIDAH21,turun gunung
2022-11-18 12:52:26+00:00,sugusdailytwt,kalo inget emosiku sampe puncak gunung merapi
2022-11-18 12:52:24+00:00,xeenyawa,kak effort mu sungguh sebesar gunung berapi terima ksih lohhh kalo kena prenk ambil hikmahnya aja
2022-11-18 12:52:15+00:00,yeolsbeloved,viral di fb keadaan terkini gunung ganang di perak jujurnya aku sedih dengan apa yang berlaku tetapi seorang temanku berkata
2022-11-18 12:52:00+00:00,inisialhanz,gunung apa tu
2022-11-18 12:50:41+00:00,AgenMerah,gunung madu 081333499844 gula merah tebu
2022-11-18 12:47:06+00:00,karanganbungas5,toko bunga surabaya tegalsarisimokertogentengbubutansurabaya timurgubenggunung anyarsukolilotambaksarimulyorejorungkuttenggilis mejoyosurabayabaratbenowopakalassemrowosukomanunggaltandesambikereplakarsantrisurabayautarabulakkenjera
2022-11-18 12:46:13+00:00,detikTravel,bule amrik jatuh saat trekking di gunung agung alami patah kaki
2022-11-18 12:45:42+00:00,fIoricomus,jangan ada air mata malam ini mari kita rayakan besok hari terakhir minum obat terharu sudah melewati lembah gunung samudera sampai ke sini pencapaian 2022 minum obat tidak muntah kawan patut dapet reward es krim mcflurry
2022-11-18 12:45:05+00:00,Micka0619,titik awal pendakian kami dari cibodas dan rencananya turun dari gunung putri kami merencanakan pula berapa lama kami mendaki dikarenakan kami semua kuliah dan saat itu sedang masa liburan maka ditetapkan pendakian itu akan berlangsung selama 3 hari 2 malam
2022-11-18 12:45:04+00:00,Micka0619,baiklah kembali ke kisah pendakianku aku mendaki gunung gede bersama teman teman kuliahku salah satu teman kuliahku mengajak teman teman alumni sma nya jadilah total pesertanya 9 orang
2022-11-18 12:44:29+00:00,delicattso,lu anjir setengah taon kaga keliatan ngapain sih lu bertapa di gunung ye semedi
2022-11-18 12:44:21+00:00,Alva1588,ini tipsnya min mendaki gunung biar gak terlalu lelah info aja sih kalo miminnya masih jomblo ya maap
2022-11-18 12:44:15+00:00,megavlodon,nomin college au d dingin mau diangetin saat j en o dan j ae m in ngecamp di gunung dingin menerjang buat yang sedi
2022-11-18 12:44:05+00:00,lantheorchids,saking senangnya dikasib surprise besoknya ayah membawa sang istri camping di gunung
2022-11-18 12:43:40+00:00,diksiiku,seperti kata kata led zeppelin jika matahari menolak untuk bersinar aku akan tetap mencintaimu jika gunung runtuh ke laut masih akan ada kau dan aku bidadari
2022-11-18 12:43:27+00:00,sasintsoshum,ini kok tugas dan kegiatan menjelang pas kenapa menumpuk seperti gunung salak sih
2022-11-18 12:43:14+00:00,laxxcya,one piece belum tamat nder aku baru nonton one piece anjay baru nonton 16 eps mau lanjut maraton tapi tugas macam gunung
2022-11-18 12:43:04+00:00,kumparan,kepala basarnas ternate fathur rahman mengatakan saat dilakukan kroscek mereka hanya melakukan ekspedisi di gunung ibu halmahera barat publisherstory ceritamalukuutara
2022-11-18 12:42:31+00:00,serbita1,perlu gord hyper turun gunung
2022-11-18 12:42:27+00:00,Micka0619,pesona dan keindahan pegunungan mampu mengalihkan semua hal itu paling tidak bagiku tapi tetap saja doa dan kewaspadaan selalu mengiringi langkahnya saat mendaki gunung
2022-11-18 12:42:26+00:00,Micka0619,bahkan belumlah era telepon genggam seperti sekarang namun demikian jika sudah berada di gunung aku sedikit melupakan hal hal yang mistis dan menyeramkannya
2022-11-18 12:42:25+00:00,Sinelir17,berarti gunung yang dibuat bertapa arya galuh dulu ya
2022-11-18 12:41:53+00:00,bujukrayuu,lagi2 dibikin speechless woii kemana aja aku sih perasaan udah yg paling tau gosip ternyata disini ada komunitas lsl dan rata2 udah kena hiv di daerah gunung kayakgini loh kayak wow nggak bisa berkata2 lagi
2022-11-18 12:40:03+00:00,kompasiana,pendakian gunung merbau via selo beserta retribusinya
2022-11-18 12:39:58+00:00,kittygalisback,ke gunung jam 3 minta siapa yang bangunin ya gws
2022-11-18 12:38:49+00:00,iyoiyoiyoiyoiya,cerita sebentar cerita horor cetar cetor 8 gunung putri
2022-11-18 12:38:39+00:00,Micka0619,aku ingat pernah membaca berita di koran sekelompok anak muda yang sedang berwisata ke daerah kebun raya cibodas yang merupakan bagian dari kawasan gunung gede saat mereka berfoto pada sebuah air terjun mereka terkejut melihat hasil fotonya
2022-11-18 12:38:37+00:00,Micka0619,dahulu ketika masih di bangku sekolah dasar aku sudah sering mendengar cerita cerita tentang gunung gede tapi seputar kisah kisah kejadian mistisnya
2022-11-18 12:38:36+00:00,Micka0619,saat itu adalah pengalaman pertamaku ke gunung gede yang berada di jawa barat tepatnya di antara kabupaten bogor kabupaten cianjur dan kabupaten sukabumi
2022-11-18 12:38:29+00:00,FalNdaru,depresi yang terjadi akibat masa pandemi yang menimbulkan stress kronis ditambah dengan kondisi komorbiditas yaitu lansia
2022-11-18 12:37:16+00:00,nanditofa,foto2 yg diambil minggu lalu mengingatkan syair ini tanah tandus kerontang banjir datang itu pasti dr lagunya iwan f
2022-11-18 12:37:00+00:00,syaf_ml,batu gunung ya seperti ada garis garis putih kek alur sungai nya
2022-11-18 12:36:31+00:00,Micka0619,meskipun belum bisa juga dikategorikan sebagai anak pecinta alam yang kegiatannya rutin mendaki berbagai gunung mendaki gunung kulakukan semata mata karena aku menyukai dan mengagumi keindahan gunung dengan hutan rimbanya hawanya yang sejuk dan udaranya yang menyegarkan
2022-11-18 12:36:30+00:00,Micka0619,namaku norman bukan nama sebenarnya penulis aku akan menceritakan pengalaman mendaki gunungku di tahun 2006 waktu itu aku masih kuliah di semester 7 aku menyukai kegiatan mendaki gunung
2022-11-18 12:36:05+00:00,PutriNurL,orang yang sering naik gunung pasti gak gampang baper dan pikirannya pasti terbuka
2022-11-18 12:35:54+00:00,HiSony1,depresi yang terjadi akibat masa pandemi yang menimbulkan stress kronis ditambah dengan kondisi komorbiditas yaitu lansia
2022-11-18 12:35:36+00:00,sparklingstra,aku punya genk sama temen sma terus karena kita semua anak gunung dimana sianyak suka jelek daripada spam di grup mending buat grup isinya buat cek sinyal jadi isinya bener bener serandom ini
2022-11-18 12:35:07+00:00,mistaaimanvevo,kumpulan pelancong menyelamatkan diri di sebuah dewan terbuka di tempat lebih tinggi sementara menunggu ketibaan bomba awan
2022-11-18 12:35:00+00:00,AkunMuram,shitposter mah fokus shitposting aja kaya musisi kapal pas titanic mau nabrak gunung es
2022-11-18 12:34:51+00:00,kekepin12,naik angkot jurusan cisarua turun di pemberentian terkahir di tugu atau wisata gun
2022-11-18 12:33:31+00:00,Micka0619,cerita sebentar cerita horor cetar cetor 8 gunung putri threadstorytime threadhorror ceritaserem ceritahoror ceritahorror cerpenmisteri flashhorror idn horor ceritahantu horror
2022-11-18 12:33:18+00:00,yunayunwoi,caranya request buku di ipusnas gmn ya pengen bgt re read novel blitz by rudiyant dulu pernah baca pas sma suka bgt sama alurnya tentang pendakian sekelompok muda mudi di gunung yg belum pernah dijamah manusia horornya berasa bgt woi merindingg
2022-11-18 12:33:08+00:00,keIaut,gunung
2022-11-18 12:33:07+00:00,mbangbong_,spill video pas kena badai di gunung dong
2022-11-18 12:32:54+00:00,irjaa_s,sgn suro dipo lereng gunung prahu sendiko ngestokaken nderek dawuh santrigay
2022-11-18 12:32:36+00:00,gjlskm,lucu banget adikmu berbakat akhirnya ibu guru tidak hanya melihat gambar dua gunung sawah dan jalan saja lucu b
2022-11-18 12:32:12+00:00,Zombeyy3,pemndangan yg indah diatas gunung nan besar dan memikat
2022-11-18 12:32:11+00:00,JhoHarja,masa gunung tandus di hunan gunung setinggi 1500 meter di bikin kan jalan steger undak undak tangga stager biar bisa naik turun dan bersekolah akses internet juga domba domba mereka di beli pemerintah pak xie tapi jika sudah lulus smp wajib militer
2022-11-18 12:31:57+00:00,diass_utami,baru sampe rumah dan sepi baru besok pulangnya ya pak prabu sabtu sore dirumah semoga ini pemandangan gunung slamet berkabut foto kapan ini cantik sekali
2022-11-18 12:31:44+00:00,doiiva,gunung padang cianjur
2022-11-18 12:31:44+00:00,ambisfs,schapp hallo ada yang mau barter like lomba tugas gak komen ya entar sendder chat trivia vulkanik merupakan tanah yang tercampur letusan gunung api
2022-11-18 12:30:36+00:00,itobf1,promo diskon arsy sport sandal gunung pria jepit abu diskon 33 checkout sekarang ht
2022-11-18 12:30:31+00:00,javasea3,hahaha masa sih dia menyepi di gunung ijen nyari pesugihan om
2022-11-18 12:30:31+00:00,urgentidentity,sing nolak men ngidang ane luh ngemang muncuk gunung agung e
2022-11-18 12:29:55+00:00,Paperplane161,apapun yang ditakdirkan bagimu akan sampai kepadamu walaupun berada di bawah dua gunung dan apa yang tidak ditakdirkan untukmu tidak akan sampai meskipun berada di antara kedua bibirmu
2022-11-18 12:29:47+00:00,habbangy,iya yejiii ini aku lagi bingung dalangnya juga bingung disini gunung disana gunung tetap di ovj
2022-11-18 12:29:45+00:00,tahaqm,foto2 yg diambil minggu lalu mengingatkan syair ini tanah tandus kerontang banjir datang itu pasti dr lagunya iwan f
2022-11-18 12:29:26+00:00,climax_ao,mau hiking ke gunung atau main ke pantai kami menyediakan paket menarik dgn hrga bersaing utk lbih jelasnya langsung hub hotline di 081 2225 4442
2022-11-18 12:28:59+00:00,syasya_ar17,keren banget loh untuk anak sd kelas 2 aku dulu gambar gunung sawah jalanan matahari ditengah gunung udah berasa kayak gambaran adekmu nder
2022-11-18 12:28:23+00:00,blueoceanreef,yes he is my 911 gue jth dr mtr nyamper ke kntr dijmpt gue skt di gofood in mkn yg rela bgt jmpt jam 3 pagi di kp rambutan abis gue naik gunung padahal hari krja semua deh semua wkwk pdhl anak mami bgt nih anak dulu ga blh berani nyetir keluar jkt skrng tiap minggu ke bgr wkwk
2022-11-18 12:27:09+00:00,iniemailizza,done markup harga melampau2 sangat dahh kenapaa bukan purchase kat puncak gunung kinabalu pon smpa
2022-11-18 12:26:19+00:00,L0ANERSIN,oke jadi inner child ini sempet disebutkan sama carl jung buat rekanan psikolog pasti gak asing sama bapak ini bapaknya gunung es id ego dan superego erwin tertawa mengingat carl jung hampir setiap mata kuliah yang ia akan selalu membahasnya sebagai pembukaan
2022-11-18 12:26:00+00:00,andriramdanii_,ke gunung hejo ka
2022-11-18 12:26:00+00:00,dwioktariyadi,sabaar yooo sabaarrr masnya sudah lama ndak aktif biar mbah tengkorak yang turun gunung
2022-11-18 12:24:54+00:00,sedangberupaya,random bngt kepikiran mau naik gunung
2022-11-18 12:24:49+00:00,Roomans_86,sabaar yooo sabaarrr masnya sudah lama ndak aktif biar mbah tengkorak yang turun gunung
2022-11-18 12:24:29+00:00,oktapianii,lucu banget adikmu berbakat akhirnya ibu guru tidak hanya melihat gambar dua gunung sawah dan jalan saja lucu b
2022-11-18 12:23:54+00:00,onyourare,dijual karena mau naek gunung guys
2022-11-18 12:23:39+00:00,AHafzan,kumpulan pelancong menyelamatkan diri di sebuah dewan terbuka di tempat lebih tinggi sementara menunggu ketibaan bomba awan
2022-11-18 12:23:38+00:00,luckylucky0971,di gunung ini
2022-11-18 12:22:16+00:00,PasswingB,ada lah gunung kembar
2022-11-18 12:21:50+00:00,shiiracha,buka tiktok baru lihat vt cewek pergi kemping sendirian di gunung asli keren banget berani kemping sendirian
2022-11-18 12:21:47+00:00,aarieshere,gunung sari
2022-11-18 12:21:46+00:00,CeperStone,badai view ga kebuka ywdh lomba lari aja di bukit teletubbies gunung prau
2022-11-18 12:21:44+00:00,diinnnsss,si ibu sama si tante mukanyaa jg jauuuuhhh cakepan si ibu kemana2 mulaijulid tau deh ni tante ke dukun di gunung mana sampe si kumis klepak kelepek ninggalin anak bini
2022-11-18 12:21:28+00:00,DevilFromIsrael,yailahh naik gunung murah kali semurah harga diri lo wkwkwkk anak2 gunung perasaan ga bangsat kayak lu dah wkwkwkwk
2022-11-18 12:21:10+00:00,clumsyboiii,cosplay mendaki gunung semeru
2022-11-18 12:20:32+00:00,DandanHamdani10,wow mntppp gunung kembar yg sngttt indah
2022-11-18 12:19:47+00:00,pidutDin,kumpulan pelancong menyelamatkan diri di sebuah dewan terbuka di tempat lebih tinggi sementara menunggu ketibaan bomba awan
2022-11-18 12:19:21+00:00,reel_wahyudi,ke gunung apa kepantai hari weekend kalian
2022-11-18 12:18:29+00:00,ChairulIklas_M,foto2 yg diambil minggu lalu mengingatkan syair ini tanah tandus kerontang banjir datang itu pasti dr lagunya iwan f
2022-11-18 12:16:22+00:00,nezardw7,tiada gunung yang tak mampu didaki dan tiada laut yang tak bisa arungi
2022-11-18 12:15:52+00:00,blytheaashi,betul bli misalnya semoga nitizen 62 heboh krn 700ha hutan alam di kab gunung mas kalteng dibabat habis utk
2022-11-18 12:13:44+00:00,P9j6n,viral di fb keadaan terkini gunung ganang di perak jujurnya aku sedih dengan apa yang berlaku tetapi seorang temanku berkata
2022-11-18 12:13:40+00:00,pitleee,hujan tadi sangat deras sampe mataku perih di perjalanan tambah gelap lagi karena turun gunung
2022-11-18 12:13:16+00:00,temudari,jalur merbabu via thekelan merupakan jalur tertua yg ada di gunung merbabu jalur tersebut mulai di buka sekitar tahun 19
2022-11-18 12:12:52+00:00,yourfavperson90,badanmu bagus lekukannya kaya gunung api bikin meleleh
2022-11-18 12:12:42+00:00,soufflebaby,bagus banget ini bakat gambarnya keren bangeeet gak kaya aaya dulu gambarnya cuma 2 gunung tengahnya matahari di kasih jalan ama sawah bentuk v
2022-11-18 12:12:24+00:00,soufflecoklatt,bentar ini twitter beneran mau gone padahal gue nunggu singto ngetwit pengalaman mistis ketika mendaki gunung a thread
2022-11-18 12:12:02+00:00,huachengfs,jadii yang bawa yi hui ke atas gunung itu temen2 nya zhou jinheng stress anjirrr stresssssss
2022-11-18 12:11:10+00:00,azamsuratem,kumpulan pelancong menyelamatkan diri di sebuah dewan terbuka di tempat lebih tinggi sementara menunggu ketibaan bomba awan
2022-11-18 12:10:43+00:00,n0nalee,help rt aku mau infoin buat yang tinggal di daerah bumi mutiara gunung putri lagi ada promo makanan ala jepang nih
2022-11-18 12:10:42+00:00,ohmeelo,annoucement mcm ni slalunya nk tarah gondolkan bukit amp gunung
2022-11-18 12:10:11+00:00,magnoliaphi,aku arep wisata gunung budheg karo selebtwit t a rung sido o ir
2022-11-18 12:10:02+00:00,lareinesya,tapi sebenernya mau pantai atau gunung sama2 serem sihh
2022-11-18 12:10:00+00:00,Jawaban,alkitab mencatat tentang sebuah gunung yang bernama gunung hermon apakah disini tempat pertemuan yesus musa dan elia jawabancom fakta alkitab bible biblebuild
2022-11-18 12:09:49+00:00,sabahbarunews,30 terperangkap akibat kepala air dari gunung kinabalu
2022-11-18 12:09:17+00:00,tabungandomba,d antr pkerjaan mnsia yg trbaik a seorang laki laki yang menggembala domba di puncak gunung dr atas gunung ini atau lembah dari beberapa lembah
2022-11-18 12:08:05+00:00,poyukoyuu,wow aku bs nya gambar 2 gunung doang
2022-11-18 12:06:55+00:00,EvaApri33966506,jumatberkah pagii gud morningg udah bangun tidur dari maljum ada rekomendasi sandal gunung dari brand indonesia under 200
2022-11-18 12:06:55+00:00,helausuungkecil,foto2 yg diambil minggu lalu mengingatkan syair ini tanah tandus kerontang banjir datang itu pasti dr lagunya iwan f
2022-11-18 12:06:24+00:00,Mnkanam1,mau nambahin untuk sekarang iya benar umr jogja kota udah 2 1jt sleman 2jt tapi di bantul gunung kidul kulon progo masih 1 7 1 8 dan ini baru di tahun 2022 kalau di tahun 2018 udah 2jt berati itu udah melebihi umr
2022-11-18 12:06:24+00:00,kabigon89,betul bli misalnya semoga nitizen 62 heboh krn 700ha hutan alam di kab gunung mas kalteng dibabat habis utk
2022-11-18 12:05:27+00:00,dndpit,unsoed harus punya pedestrian buat fakultas2 kampus belakang sih kasian bgt yg kosannya di limas klo mau ke kampus jalan kaki serasa naik gunung mlewati bebatuan hiks
2022-11-18 12:05:06+00:00,yesrizwan,kumpulan pelancong menyelamatkan diri di sebuah dewan terbuka di tempat lebih tinggi sementara menunggu ketibaan bomba awan
2022-11-18 12:04:36+00:00,Malkalitu_,rxz tinggi2 tu dok sblah rumah putri gunung dia tu x dak kena mengena dgn aq dia suka pecah masuk rumah aq
2022-11-18 12:04:19+00:00,iftulfira,kumpulan pelancong menyelamatkan diri di sebuah dewan terbuka di tempat lebih tinggi sementara menunggu ketibaan bomba awan
2022-11-18 12:03:54+00:00,airadium,kumpulan pelancong menyelamatkan diri di sebuah dewan terbuka di tempat lebih tinggi sementara menunggu ketibaan bomba awan
2022-11-18 12:03:51+00:00,opik_gunners,foto2 yg diambil minggu lalu mengingatkan syair ini tanah tandus kerontang banjir datang itu pasti dr lagunya iwan f
2022-11-18 12:03:39+00:00,mhdnajmi__,kumpulan pelancong menyelamatkan diri di sebuah dewan terbuka di tempat lebih tinggi sementara menunggu ketibaan bomba awan
2022-11-18 12:03:23+00:00,myerlifo,kumpulan pelancong menyelamatkan diri di sebuah dewan terbuka di tempat lebih tinggi sementara menunggu ketibaan bomba awan
2022-11-18 12:03:11+00:00,peoplespowerr,kumpulan pelancong menyelamatkan diri di sebuah dewan terbuka di tempat lebih tinggi sementara menunggu ketibaan bomba awan
2022-11-18 12:02:50+00:00,501Awani,kumpulan pelancong menyelamatkan diri di sebuah dewan terbuka di tempat lebih tinggi sementara menunggu ketibaan bomba awaninews awani745
2022-11-18 12:01:55+00:00,Aziz_Adikara,demi koe laut bakal tak sebrangi gunung bakal tak daki tapi engko sek ijek udan iki
2022-11-18 12:01:25+00:00,bibah_Mumtaz,sesungguhnya seorang muslim membayangkan dosa dosanya seperti duduk di kaki gunung dan ia takut tertimpa olehnya sedangkan seorang yang fajir menganggap dosanya seperti lalat yang hinggap dihidungnya lalu dikibasnya hr tirmidzi
2022-11-18 12:01:15+00:00,irzan69448350,sambutan deepavali di puteri gunung meriah dan makanan super sedap nibongtebal kitaboleh
2022-11-18 12:01:08+00:00,rkhaniew,aku yang dah smk masih gambar gunung
2022-11-18 12:00:49+00:00,TaufiqSobari,foto2 yg diambil minggu lalu mengingatkan syair ini tanah tandus kerontang banjir datang itu pasti dr lagunya iwan f
2022-11-18 12:00:33+00:00,raraamyname,ku habis mendaki gunung lewati lembah wkwk udah ak polbek ya bin
2022-11-18 12:00:27+00:00,ohxhoun,kan gunung ada laharnya terus bolong tengahnya
2022-11-18 12:00:12+00:00,tututinut,ini ada untung nya gak buat gue dan gampang banget buat nolak kalo gak sesuai dr hati gue atau gue abaikan kayak yaudah take it or leave it sesuai sm maunya gue tp kl sm temen deket bener2 mendaki gunung lewati lembah gue gila2an ayo an bgt anaknya
2022-11-18 11:59:52+00:00,semanisLambeku8,lebih mudah mengubah gunung menjadi debu daripada menanamkan cinta di hati yang dipenuhi dengan kebencian ali bin abi thalib me btslover
2022-11-18 11:59:27+00:00,climax_ao,takut mau hiking ke gunung atau gak punya pralatan kami sediakan wisata dan sewa peralatannya jd jgn ragu2 lg langsung aja hub cp kami
2022-11-18 11:58:35+00:00,piyan_dominique,ngecamp di gunung bareng ayang
2022-11-18 11:57:55+00:00,alvnpryoga,coba ke gunung bromo mbak pasti darahnya tinggi
2022-11-18 11:57:24+00:00,jangwoncyie,ha gunung
2022-11-18 11:56:57+00:00,IDWeCare,contohnya seperti warga di wilayah gunung kidul dan kulon progo yogyakarta untuk mendapatkan air bersih mereka harus berjalan sangat jauh bahkan terkadang mereka harus membeli dengan harga mahal yaitu rp20 ribu untuk 20 liter air
2022-11-18 11:56:03+00:00,NotesBapakIbu,notesayahibu kebaikan seorang ayah lebih tinggi daripada gunung dan kebaikan seorang ibu lebih dalam daripada dasar laut
2022-11-18 11:55:52+00:00,madhep_ngulon,spill video pas kena badai di gunung dong
2022-11-18 11:55:18+00:00,SugihPolsek,polsek gunung sugih
2022-11-18 11:54:56+00:00,basicgvrl,cek gunung harta rosalia indah
2022-11-18 11:54:35+00:00,direktoridosen,breaking news turun gunung bantu kasus mahasiswa ipb dg membuka posko pengaduan semoga cepet beres ya kali aja ada korban dari kampus lain korban dg modus yang sama bisa kontak bpkn
2022-11-18 11:53:54+00:00,YakAns1,
2022-11-18 11:53:25+00:00,bolututung212,kamu mengisi kesadaranku seperti malam dengan hutan seperti gunung dengan musim semi seperti jalan dengan hujan seperti badai dengan padang pasir seperti samudera biru letih datanglah biarkan aku mencintaimu biarkan aku memberikan hidupku padamu suwun cak hepi wiken semuanya
2022-11-18 11:52:41+00:00,tegarcamspeed,seseorang yang telah diberikan ujian setinggi gunung tidak akan pernah tersandung terlebih hanya karena batu kerikil yan
2022-11-18 11:52:04+00:00,AhmadShiddiqN,wah gunung padang jadi inget artikel2 dan konspirasi2 yg kubaca taun 2015an
2022-11-18 11:51:04+00:00,mizan_mks,namun yang terbanyak berasal dari hadramaut yaman atau biasa disebut dengan orang orang hadhrami diantaranya sunan ampel sunan bonang sunan drajat sunan giri sunan kudus sunan gunung gunung jati kh hasyim asyari kh ahmad dahlan dll
2022-11-18 11:51:04+00:00,DevaleF,apakah pantangannya termasuk jika penganten baru tidak boleh berkunjung ke gunung teh barusan banget ngalamin bulan lalu istri saya hampir hilang gara2 ditarik
2022-11-18 11:50:00+00:00,babufess,babu gais kalpalata lotus bisa ga ditanem di teapot aku males farmingnya harus mendaki gunung lewati lembah buset dah
2022-11-18 11:49:39+00:00,andy_pranantyo,foto2 yg diambil minggu lalu mengingatkan syair ini tanah tandus kerontang banjir datang itu pasti dr lagunya iwan f
2022-11-18 11:49:38+00:00,Hazellehazelnut,bgegar la tu gunung kinabalu
2022-11-18 11:48:57+00:00,Prnchybrid,betul bli misalnya semoga nitizen 62 heboh krn 700ha hutan alam di kab gunung mas kalteng dibabat habis utk
2022-11-18 11:47:14+00:00,jemputpaksa,seru uga nih episode pertamanya di gunung padang
2022-11-18 11:47:11+00:00,burung_kondor,gaskeun ke bromo bareng teman keluarga kantor tersedia private trip all destination gunung amp tempat wisata jawa
2022-11-18 11:46:44+00:00,_elsba,gunung series voal premium rp25 500 goto goodbyetwitter hah twitter
2022-11-18 11:45:44+00:00,flakka_coca,2018 udah jenuh banget semester 3 kuliah skip langsung abis semua di bulan pertama ya buat berenang buat naik gunung seneng banget rasanya kaya ga punya tanggung jawab semua bener2 gua lepas sempet mikir mau keluar juga begitu nilai keluar semua mau pulang rumah aja takut wkwk
2022-11-18 11:44:40+00:00,sekgunungkijang,kegiatan polsek gunung kijang dalam rangka jumat berkah divisihumaspolri poldakepri humaspoldakepri polresbintan polsekgunungkijang polripresisi polrimelayani polrimengayomi polrimelindungi polisiindonesia bersamahadirmelayani jumatberkah
2022-11-18 11:44:39+00:00,urironmine,effortnya melebihi gunung everest pas udah jadian kek tai
2022-11-18 11:44:24+00:00,7chillgoo_,gunung
2022-11-18 11:43:46+00:00,akramaaf_,gunung gede nan indah
2022-11-18 11:43:14+00:00,zeronol0,foto2 yg diambil minggu lalu mengingatkan syair ini tanah tandus kerontang banjir datang itu pasti dr lagunya iwan f
2022-11-18 11:42:52+00:00,scriptswittt,lucu banget adikmu berbakat akhirnya ibu guru tidak hanya melihat gambar dua gunung sawah dan jalan saja lucu b
