created_at,author,cleaned_tweet
2022-10-29 18:26:40+00:00,Heloraras,cucok banget nih besok ajakin all family ke fjb2022 yg ada di gbk senayan dan nikmati 90 ragam kuliner nusantara kenalirasanyaindonesia pejuangrasanyaindonesia biar masukny gratis tanpa antri daftar dulu disini ya gt gt
2022-10-29 18:24:06+00:00,shelavi18,info kuliner malam
2022-10-29 18:23:06+00:00,dewiananda__,gak sia sia sih ke acara festival jajanan bango di plaza parkir timur gbk senayan jakarta soalnya ada 90 kuliner nusantara disana yuk yg mau kesana bisa daftar dulu disini kenalirasanyaindonesia fjb2022 pejuangrasanyaindonesia
2022-10-29 18:22:41+00:00,larasaprilly,tau gaksih kalo fjb2022 hadir kembali nih di gbk senayan dari tgl 28 30 oktober yuk pejuangrasanyaindonesia cobain 90 ragam kuliner nusantara yg enak bgt regist disini gratis masuk tanpa antri gengs kenalirasanyaindonesia
2022-10-29 18:22:04+00:00,cenilklopo,yuk pada ikutan ygy siapa bilang menu khas daerah tak bisa tembus pasar mancanegara sate ambal khas kebumen jateng salah s
2022-10-29 18:19:32+00:00,ucingbelekan,klo ada review kuliner harus cermat sama kalimat yg dipakai dlm video kalo cuma bahas melimpah kekinian hits hidden gems enak parah mantul endul kemungkinan kui cen review bayaran pokoknya pak bondan mak nyuss kiblatku semua rasa dibahas
2022-10-29 18:19:32+00:00,Heloraras,asikk akhirnya fjb2022 kembali hadir gengs yg hobi kulineran wajib kenalirasanyaindonesia dgn 90 ragam kuliner nusantara cuss pejuangrasanyaindonesia lgsg melipir ke gbk senayan jgn lupa regist disini biar masuknya no antri amp gratis
2022-10-29 18:19:16+00:00,maya_hasegawa,kuliner indonesia
2022-10-29 18:14:18+00:00,dewiananda__,festival jajanan bango yg udah dimulai dari tgl 28 oct hari ini hari terakhir loh buruan daftar sekarang di link ini biar bisa ngerasain 90 kuliner nusantara xixi kenalirasanyaindonesia fjb2022 pejuangrasanyaindonesia
2022-10-29 18:10:18+00:00,liliiboreachium,innalillahi wa innaillaihi rojiun aku sama temenku yang pegi ke festival kuliner biasa konser aja udah agak gimana gitu desek desekkan kek gerah banget ya allah ini gak kebayang liat jalannya sepanjang itu dari ujung keujung gak ada space sama sekali truly a nightmare
2022-10-29 18:09:10+00:00,lolipawww,aku kan suka jajan n kuliner ya moga aja jodoh aku besok ngga pelit dan perhitungan aamii
2022-10-29 18:08:17+00:00,ajsardnsh,besok hari terakhir festival jajanan bango loh kalian gamau nyobain 90 kuliner nusantara yang ada disana yuk daftar dulu disini kenalirasanyaindonesia fjb2022 pejuangrasanyaindonesia
2022-10-29 18:07:19+00:00,akusiapadahhh,sebagai orang baru di jakarta drop rekomendasi kuliner di jakarta yg menurut kalian enak dong dari yang murah sampai yang
2022-10-29 18:04:34+00:00,txtapaadanya,kenalirasanyaindonesia guys hanya di acara fjb2022 jangan lupa besok hari terakhir ya pejuangrasanyaindonesia kalian bisa nikmatin 90 ragam kuliner loh
2022-10-29 17:58:23+00:00,syaifuddin1969,liburan sekalian wisata kuliner bareng geng kesayangan ke singapura
2022-10-29 17:53:15+00:00,Muhamma03425151,jangan ke bali kalo masi dipermasalahkan kearifan lokal dan kuliner khas nya selama ini dan
2022-10-29 17:50:46+00:00,fanamerahzembud,terang bulan lebih ke black hole alias kuliner dari mana ini bangsat
2022-10-29 17:47:26+00:00,nindoyyyy,gacuma berburu kuliner siii hehe
2022-10-29 17:47:14+00:00,damhnf27,info kuliner malam pwt
2022-10-29 17:41:14+00:00,mailovvv,nah fjb2022 udah diadakan dari tanggal 28 30 oct which is today is the last day ayo merapat di gbk senayan untuk kita kenalirasanyaindonesia karena banyak 90 ragam kuliner nusantara cus daftar tanpa antri gratis di pejuangrasanyaindonesia
2022-10-29 17:38:53+00:00,ervin_larasati,puan maharani dikenal sebagai pemimpin yang menyukai kuliner khas indonesia puan mengajak rakyat untuk mencintai kuliner indonesia
2022-10-29 17:38:28+00:00,ggukney,ayo guys buruan dateng ke festival jajanan bango besok hari terakhir jangan sampe ketinggalan buat nyicipin 90 kuliner nusantaranyaa daftar aja disini kenalirasanyaindonesia fjb2022 pejuangrasanyaindonesia
2022-10-29 17:38:02+00:00,mailovvv,ketemu yuk di jfb 2022 gbk senayan dengan 90 ragam kuliner nusantara hari minggu ini jadi hari terakhir lho jadi cus deh kenalirasanyaindonesia dan daftar gratis masuk tanpa antri di see you di fjb2022 pejuangrasanyaindonesia
2022-10-29 17:33:26+00:00,JOERAGANGroup,ingin punya usaha kuliner joeragan rasa paling dicari dijamin diburu pembeli yuk join kemitraan kami skrg
2022-10-29 17:30:01+00:00,soeripsarap,yg lagi malam mingguan di area kuliner lengkong kecil jangan lupa mampir dan cobain spesial menu kami yaitu iga bakar rawit si
2022-10-29 17:28:48+00:00,mailovvv,yippie tinggal hari ini nih minggu 30 oct fjb2022 nemenin weekend kita at least masih ada waktu utk kenalirasanyaindonesia dengan 90 ragam kuliner nusantara di gbk senayan seru kaan burudeh daftar untuk masuk gratis tanpa antri
2022-10-29 17:22:39+00:00,___nadiarosalia,kuliner khas umr dibawah 2 juta
2022-10-29 17:17:56+00:00,detikcom,tempe menjadi ikon google doodle hari ini 29 oktober 2022 konon makanan berbahan kedelai itu disebut berasal dari bayat klaten seperti apa faktanya via
2022-10-29 17:15:39+00:00,spicychicken03,ayok aku punya banyak rekomendasi tempat kuliner
2022-10-29 17:13:38+00:00,tmbkbr,ingar tmbkbr k nya kuliner
2022-10-29 17:13:27+00:00,aku_sukseees,ayoo teman daftar masih ada kesempatan ni buat ikutan event fjb2022 daftar di sini ya lumayan bisa menikmati 90 ragam kuliner nusantara di gbk senayan mulai 28 30 oct amp bisa gratis masuk tanpa antri jga kenalirasanyaindonesia pejuangrasanyaindonesia
2022-10-29 17:12:36+00:00,aku_sukseees,langsung daftar aja mumpung masih ada kesempatan buat ikutan event fjb2022 di gbk senayan disini daftarnya yah ada 90 ragam kuliner nusantara dan bisa masuk gratis tanpa antri juga lohhhh kenalirasanyaindonesia pejuangrasanyaindonesia
2022-10-29 17:12:10+00:00,ontosoroh_nyai,weekend kuineran yuuuk di festival jajanan bango di gbk senayan fjb2022 registrasi dulu ya biar masuknya gratis tanpa antri kita nikmati ragam kuliner nusantara kenalirasanyaindonesia pejuangrasanyaindonesia
2022-10-29 17:11:25+00:00,tweetbre01,kalo aku huka jasa teman kuliner kira2 ada yg mau bayar nggak yah
2022-10-29 17:09:31+00:00,Retnowonosari,biar gampang dan gak ribet isi link ini ya agar kamu bisa masuk tanpa antri amp menikmati 90 ragam kuliner nusantara di fjb2022 di gbk senayan besok pagi karena tinggl sehari besok kuy kenalirasanyaindonesia pejuangrasanyaindonesia makin semangat
2022-10-29 17:09:22+00:00,mhmdfkrhdyt,besok masih bisa karena dari 28 30 oct ayoo daftar sini event fjb2022 ada 90 ragam kuliner nusantara dan bisa masuk gratis tanpa antri juga ajak semua teman kalian guys biar seru ke gbk senayan kenalirasanyaindonesia pejuangrasanyaindonesia
2022-10-29 17:08:22+00:00,mhmdfkrhdyt,masih bisa loh buat ikutan event fjb2022 guys daftar di sini lumayan juga bisa menikmati 90 ragam kuliner nusantara di gbk senayan mulai 28 30 oct dan bisa gratis masuk tanpa antri jga ajak doi sekalian bsa kenalirasanyaindonesia pejuangrasanyaindonesia
2022-10-29 17:07:22+00:00,stiayulia,wih seru banget loh ges di fjb2022 tadi ada 90 ragam kuliner nusantara juga ayo daftar skrg jg di bisa gratis masuk tanpa antri loh mumpung acaranya masih ada sampai 30 oct ini di gbk senayan jakarta kenalirasanyaindonesia pejuangrasanyaindonesia
2022-10-29 17:06:38+00:00,tifosi_XLVIII,akting terbaik manasm adlah ketika beliau jdi gembel di kulino kuliner episode burger sungguh pasti kalau ada org tidak tau itu cuma syuting pasti sudah digelandang dinsos
2022-10-29 17:04:27+00:00,ndrypd,mas mas mirip yuni shara konten jiroluger paling laku hanyalah kulino kuliner sayangnya
2022-10-29 17:04:17+00:00,masjidalfairuz,kajian sadar halal kak chelsy founder dari kuliner muslim indonesia
2022-10-29 17:03:04+00:00,kopiefem,sebagai orang baru di jakarta drop rekomendasi kuliner di jakarta yg menurut kalian enak dong dari yang murah sampai yang
2022-10-29 17:00:30+00:00,Butternflyn,catat buat para pejuangrasanyaindonesia kalau besok di gbk senayan ada 90 ragam kuliner nusantara dalam fjb2022 dan gratis masuk tanpa antri cukup aftar ke link kenalirasanyaindonesia
2022-10-29 17:00:28+00:00,jony_khuo,jangan ke bali kalo masi dipermasalahkan kearifan lokal dan kuliner khas nya selama ini dan dari dulu tidak ada masalah mau babi guling bantal kasur ga suka yah jangan lewati jalan dpn warungnya
2022-10-29 16:59:55+00:00,ragdoll_lover_,mending ke depannya tadi kuliner wkwkwkw
2022-10-29 16:59:41+00:00,urcupofwine,kuliner khas umr dibawah 2 juta
2022-10-29 16:59:35+00:00,ceritaririn,seru bgt guys di fjb2022 ada 90 ragam kuliner nusantara yang belum dateng yuk buruan daftar sekarang di karena bisa gratis masuk tanpa antri mumpung acaranya masih ada sampai 30 oct ini di gbk senayan kenalirasanyaindonesia pejuangrasanyaindonesia
2022-10-29 16:58:55+00:00,ItsMasAl,kuliner malam bersama bapack bapack
2022-10-29 16:58:42+00:00,slowwiinne,besok hari terakir fjb2022 di senayan gbk ada 90 kuliner buat kalian kenalirasanyaindonesia ramein guys cus ke gbk senayan masuk gratis tanpa antrian daftar yuk pejuangrasanyaindonesia
2022-10-29 16:58:18+00:00,GrowthGem,pengen seru seruan di hari libur yuk datang ke fjb2022 di gbk senayan besok hari terakhir kamu bisa makan 90 ragam kuliner nusantara sekaligus gratis masuk tanpa antri lagi segera daftar ke link kenalirasanyaindonesia pejuangrasanyaindonesia
2022-10-29 16:57:26+00:00,stiayulia,untuk kalian yang mau ke gbk senayan buat coba 90 ragam kuliner nusantara di festival jajanan bango fjb2022 masih ada kesempatan nih sampai 30 oct 2022 ini registrasi dulu yaa di link ini bisa gratis masuk tanpa antri lho kenalirasanyaindonesia
2022-10-29 16:57:03+00:00,upiqjie,wali kota danny jamu senator malarndirri mccarthy kuliner khas makassar
2022-10-29 16:56:59+00:00,racunestetik_,gua kasih tau nih jgn sampai kelewatan event festival jajanan bango ada 90 ragam kuliner nusantara amp masuknya gratis tanpa antri loh apalagi besok udah hari terakhir nih caranya kalian tinggal daftar di kenalirasanyaindonesia fjb2022
2022-10-29 16:56:07+00:00,DEWITOGEL1,wali kota makassar jamu senator mccarthy dengan kuliner tradisional
2022-10-29 16:56:05+00:00,slowwiinne,mau ingetin buat pecinta kuliner jangan lewatin fjb2022 buat kalian ada 90 kuliner buat kalian kenalirasanyaindonesi ayok lah datang ke gbk senayan besok gratis masuk tanpa antrian daftarnya di
2022-10-29 16:56:04+00:00,bamthori,icip icip kuliner nusantara tak perlu susah lagi tinggal datang ke gbk senayan hari minggu besok di acara fjb2022 90 ragam kuliner nusantara menantimu cukup daftar ke link gratis masuk tanpa antri kenalirasanyaindonesia pejuangrasanyaindonesia
2022-10-29 16:55:20+00:00,elvina711,puan maharani dikenal sebagai pemimpin yang menyukai kuliner khas indonesia puan mengajak rakyat untuk mencintai kuliner indonesia
2022-10-29 16:55:17+00:00,rangwirs,ntar ada geng kuliner popfood mas menus hahhaa siap kawal
2022-10-29 16:55:10+00:00,ceritaririn,buat yang belum dateng ke gbk senayan untuk coba 90 ragam kuliner nusantara di fjb2022 kalian masih ada kesempatan sampai 30 oct 2022 ini registrasi disini yaa bisa gratis masuk tanpa antri kenalirasanyaindonesia pejuangrasanyaindonesia
2022-10-29 16:53:45+00:00,Butternflyn,kalau kamu pengen wisata kuliner tanpa pergi jauh mending ke gbk senayan besok karena ada 90 ragam kuliner nusantara di fjb2022 dan gratis masuk tanpa antri cukup daftar ke link kenalirasanyaindonesia pejuangrasanyaindonesia
2022-10-29 16:53:19+00:00,racunestetik_,yok yok guys dateng ke acara festival jajanan bango fjb2022 ada 90 ragam kuliner nusantara dan masuknya gratis tanpa antri dengan daftar di ya masa ga gass kenalirasanyaindonesia fjb2022 pejuangrasanyaindonesia
2022-10-29 16:52:34+00:00,Tanseriat,terhitung sudah 24 jam ia menikmati surga dunia ini mencicipi kuliner khasnya sate lilit salah satu makanan favoritnya tentu pabtai jadi salah satu hal paling wajib ia lakukan seperti malam ini ia dan kawanannya sepakat minum di pinggir pantai
2022-10-29 16:52:19+00:00,slowwiinne,event fjb2022 buat nemenin weekend kalian besok paling tepat deh ada 90 kuliner buat kalian cobain cus ke gbk senayan kalo mau masuk gratis tanpa antrian daftar di kenalirasanyaindonesia pejuangrasanyaindonesia
2022-10-29 16:51:41+00:00,GrowthGem,belum lengkap kalau belum mampir ke fjb2022 di mana 90 ragam kuliner nusantara ada di dalamnya berlokasi di gbk senayan amp sampai besok aja loh segera daftar ke link voila bisa gratis masuk tanpa antri kenalirasanyaindonesia pejuangrasanyaindonesia
2022-10-29 16:51:14+00:00,aquariusdoyi,oh iya kan kemarin ke fjb2022 ya tempat di gbk senayan di plaza parkir timur makanannya enak enak beneran 90 ragam kuliner nusantara sih haha yg mau ke sana ini link daftar yuk yuk buat bisa kenalirasanyaindonesia pejuangrasanyaindonesia
2022-10-29 16:50:58+00:00,puxrsewin,td ke fjb2022 sm pacar nyobain banyak makanan karena emng ada 90 ragam kuliner nusantara enak bgt trs kemarin daftar di link ini di gbk senayan ini acara dari 28 30 oktober bsk sih jgn lupa ke sana ya buat kenalirasanyaindonesia pejuangrasanyaindonesia
2022-10-29 16:50:22+00:00,GmoOfficial3,dalam rangka menyambut sumpah pemuda dan memperkenalkan budaya serta kuliner indonesia di prancis escale java menga
2022-10-29 16:50:13+00:00,racunestetik_,guyss besok udah tanggal 30 nih last day untuk fjb ada 90 kuliner yg bisa kamu cobain happynya kalian bisa gratis masuk tanpa antri loh caranya cuma daftar di link ini buruan ya kenalirasanyaindonesia fjb2022 pejuangrasanyaindonesia
2022-10-29 16:49:53+00:00,cewegabutttt,fjb 2022 hadir kembali fjb2022 ada 90 ragam kuliner nusantara yg mesti km cobain lohh yg mau cobain gas deh sampe tgl 30 oktober ini daftarnya di link masuk tanpa antri kenalirasanyaindonesia di gbk senayan yak
2022-10-29 16:49:23+00:00,cewegabutttt,fjb hadir kembali shayy kenalirasanyaindonesia fjb2022 besok tgl 30 oktober masih ada nih gas ke gbk senayan disana ada 90 ragam kuliner nusantara loh regis di gratis masuk tanpa antri
2022-10-29 16:49:01+00:00,cewegabutttt,asikk kenalirasanyaindonesia fjb2022 fjb 2022 hadir kembali di gbk senayan ada 90 ragam kuliner nusantara loh gassin bro masih ada nih sampe 30 oktober regis di gratis masuk tanpa antri mantul kannnn
2022-10-29 16:48:30+00:00,akasyalvn,aslideh td aku ke fjb2022 bingung bgt mau makan apa wkwkkw byk bgt aaa pen semuaa kalian wajib ke fjb jugasi di gbk senayan soalnya ada 90 ragam kuliner nusantara gratiss kok masuknya nih daftar disini kenalirasanyaindonesia pejuangrasanyaindonesia
2022-10-29 16:48:11+00:00,travcouple_id,oh iya jangan sampe lupa isi ya m biar cepet gratis masuk tanpa antri amp bisa langsung santap 90 ragam kuliner nusantara di fjb2022 di gbk senayan besok pagi fjb hadir kembali biar semua tau kenalirasanyaindonesia pejuangrasanyaindonesia
2022-10-29 16:48:11+00:00,alcruhqx,kenalirasanyaindonesia fjb2022 fjb 2022 hadir kembali regis di gratis masuk tanpa antri ada 90 ragam kuliner nusantara loh buruan deh kesana msih ada smpe 30 oktober di gbk senayan
2022-10-29 16:48:09+00:00,bamthori,kamu yang suka jajanan enak amp beraneka macam bisa banget coba 90 ragam kuliner nusantara di gbk senayan terselenggara fjb2022 sampai besok 30 oct apalagi gratis masuk tanpa antri dengan daftar ke kenalirasanyaindonesia pejuangrasanyaindonesia
2022-10-29 16:47:49+00:00,travcouple_id,pengen nggak ngerasain kenalirasanyaindonesia di fjb2022 epgen dong kuy jadi pejuangrasanyaindonesia fjb 2022 di gbk senayan dari 28 30 oct ini kuy isi biar gratis masuk tanpa antri sajian 90 ragam kuliner nusantara menantimu
2022-10-29 16:47:44+00:00,alcruhqx,kenalirasanyaindonesia dengan adanya fjb2022 fjb 2022 hadir kembali ada 90 ragam kuliner nusantara cus deh yg mau coba masih ada sampe 30 oktober di gbk senayan regis di gratis masuk tanpa antri lohh gaiss
2022-10-29 16:47:32+00:00,0xClaBigWin,fjb 2022 rame bangettt nih di gbk senayan dari 28 30 oct aja langsung aja eksplor 90 ragam kuliner nusantara bisa langsung daftar dan gratis masuk tanpa antrii yukkkk kenalirasanyaindonesia fjb2022 pejuangrasanyaindonesia
2022-10-29 16:47:10+00:00,alcruhqx,kenalirasanyaindonesia dengan fjb2022 kabar baikk fjb 2022 hadir kembali gaiss di gbk senayan dan ada 90 ragam kuliner nusantara loh gas yg mau kesana deh masih ada sampe 30 oktobet regis di gratis masuk tanpa antri manteb kan
2022-10-29 16:46:55+00:00,OscarAndry20,yuk pada ikutan ygy siapa bilang menu khas daerah tak bisa tembus pasar mancanegara sate ambal khas kebumen jateng salah s
2022-10-29 16:46:43+00:00,ali_njajali,sate klathak pak pong asli jogja yg dibeli om rindu kuliner sate khas jejeran dia tu sampe dibelain nunggu restock 1 jam antrean panjang wkwkwk
2022-10-29 16:46:32+00:00,luckypitaa,fjb2022 masih avail sampe 30 oktober kan ya kalian yang di sekitar gbk senayan masih bisa loh jalan jalan jajan menikmati 90 ragam kuliner indonesia disana jangan lupa ya gais sayang kalo ketinggalan kapan lagi kan ada kaya gini kenalirasanyaindonesia pejuangrasanyaindonesia
2022-10-29 16:46:25+00:00,bublecutiepie,fjb 2022 hadir kembali bestie ada 90 ragam kuliner nusantara buat kalian yg mau nyobain gasin deh masih ada ni smpe tgl 30 oktober kenalirasanyaindonesia dengan fjb2022 di gbk senayan regis di gratis masuk tanpa antri
2022-10-29 16:46:23+00:00,sins_https,pengen kuliner kulineran kek orang
2022-10-29 16:46:18+00:00,luckyloeyli,besok 30 okt hari terakhir fjb2022 di gbk senayan jakarta yuk jgn sampe nyesel ga ikutan eksplor 90 ragam kuliner nusantara gratis biar masuknya ga antri bisa daftar dulu di link kenalirasanyaindonesia pejuangrasanyaindonesia
2022-10-29 16:46:15+00:00,0xClaBigWin,wuih fjb 2022 masih ada ya di gbk senayan sampe 30 oct bisa eksplor 90 ragam kuliner nusantara yang enak banget yuk daftar dan gratis masuk tanpa antri kenalirasanyaindonesia fjb2022 pejuangrasanyaindonesia
2022-10-29 16:46:08+00:00,hilman_070,baru aj kuliner malam chef mie tektek anglo cikutra ga ada matinya
2022-10-29 16:46:01+00:00,bublecutiepie,asik fjb 2022 hadir kembali buat yg mau nyobain buruan deh masih ada smpe tgl 30 oktober ada 90 ragam kuliner nusantara loh di gbk senayan yaa kenalirasanyaindonesia fjb2022 regis di gratis masuk tanpa antri
2022-10-29 16:45:34+00:00,bublecutiepie,kenalirasanyaindonesia fjb2022 fjb 2022 hadir kembali loh di gbk senayan ada 90 ragam kuliner nusantara buat yg mau dateng cus deh masih ada sampe tgl 30 oct minggu besok regis di gratis masuk tanpa antri
2022-10-29 16:45:21+00:00,puxrsewin,ga nyangka sih ya fjb2022 hadir lagi bawa 90 ragam kuliner nusantara terus gratis masuk tanpa antri daftarnya di sini lokasi di gbk senayan yukk terakhir besok loh jangan nyesel ga cobain kesana kenalirasanyaindonesia pejuangrasanyaindonesia
2022-10-29 16:44:46+00:00,punyaingee,omg fjb 2022 hadir kembali yg mau nyobain buruan deh masih ada smpe tgl 30 oct ada 90 ragam kuliner nusantara loh di gbk senayan yaa kenalirasanyaindonesia fjb2022 regis di gratis masuk tanpa antri
2022-10-29 16:44:34+00:00,Nurulhaayati,yaampun udh wktunya ajanih kt ke festival jajanan bango fjb2022 28 30 oktober di parkir timur gbk senayan jakarta barengan hayu dn msuk grtis tnp antri cuss klik sini udah ngiler mau nikmatin 90 ragam kuliner nusantara biar bs kenalirasanyaindonesia
2022-10-29 16:44:24+00:00,punyaingee,kenalirasanyaindonesia fjb2022 fjb 2022 hadir kembali loh di gbk senayan ada 90 ragam kuliner nusantara gas dateng masih ada sampe 30 oktober regis di gratis masuk tanpa antri
2022-10-29 16:44:14+00:00,Butternflyn,besok hari terakhir buat cicipin 90 ragam kuliner nusantara di gbk senayan dalam acara fjb2022 so bagi kamu pejuangrasanyaindonesia segera daftar ke buat kenalirasanyaindonesia gratis masuk tanpa antri
2022-10-29 16:44:11+00:00,aquariusdoyi,mau ripiw kemarin dah ke fjb2022 yang ada 90 ragam kuliner nusantara daftar di sini gratis masuk tanpa antri beneran ga boong yg mau ke sana buruan deh dari tanggal 28 30 oktober aja buat kenalirasanyaindonesia pejuangrasanyaindonesia
2022-10-29 16:43:50+00:00,punyaingee,kenalirasanyaindonesia with fjb2022 good news fjb 2022 hadir kembali di gbk senayan ada 90 ragam kuliner nusantara loh gas deh cobain masih ada sampe 30 oktober regis di gratis masuk tanpa antri
2022-10-29 16:43:29+00:00,GrowthGem,pecinta kuliner di sekitar gbk senayan yuk hadir di fjb2022 ada 90 ragam kuliner nusantara cuma sampai besok aja segera daftar ke link gratis masuk tanpa antri kenalirasanyaindonesia pejuangrasanyaindonesia
2022-10-29 16:43:27+00:00,hiliiiiih,besok terakhir gaes jajan ayok kita jajan icip 90 ragam kuliner nusantara di gbk senayan y ges y daftar dsni untuk masuk tnpa antri kenalirasanyaindonesia fjb2022 pejuangrasanyaindonesia
2022-10-29 16:42:56+00:00,walnvy,fjb 2022 rame banget guyss adanya di gbk senayan nihh sampe 30 oct ajaa jangan sampe kelewatan eksplor 90 ragam kuliner nusantara bisa masuk gratis tanpa antri loh yuk daftar kenalirasanyaindonesia fjb2022 pejuangrasanyaindonesia
2022-10-29 16:42:26+00:00,Nurulhaayati,weekend dah tiba yeaaay wktunya kt ke festival jajanan bango fjb2022 28 30 oct di parkir timur gbk senayan jakarta sma2 ya biar bs msuk grtis tnp antri hrus klik sini gasabar buat nikmatin 90 ragam kuliner nusantara rame2 utk kenalirasanyaindonesia
2022-10-29 16:42:17+00:00,hiliiiiih,sambil nunggu si ganteng perform lebih baik makan kenalirasanyaindonesia di fjb2022 icip 90 ragam kuliner nusantara yakaann yuk daftar dsni pejuangrasanyaindonesia
2022-10-29 16:41:50+00:00,walnvy,fjb 2022 lagi rame nih masih ada sampe 30 oct aja di gbk senayan yuk dateng buat eksplor 90 ragam kuliner nusantara masuknya gratis tanpa antri daftarnya di sini kenalirasanyaindonesia fjb2022 pejuangrasanyaindonesia
2022-10-29 16:41:41+00:00,luckyloeyli,jangan sampai kelewat fjb2022 hadir 28 30 okt di gbk senayan kapan lagi kan bisa nyicipin 90 ragam kuliner nusantara gratis yuk buruan daftar di link biar masuk tanpa antri kenalirasanyaindonesia pejuangrasanyaindonesia
2022-10-29 16:41:29+00:00,deandra_andita,ajak teman saudara dan org terdekat utk datang ke fjb2022 yang kini hadir kembali disana ada sekitar 90 ragam kuliner nusantara lokasinya di gbk senayan yuk besok hari terakhir loh buruan daftar gratis masuk tanpa antri kenalirasanyaindonesia
2022-10-29 16:40:35+00:00,akasyalvn,klean tadi ada yg ke fjb2022 gaaa seruuu yaah bisa hunting 90 ragam kuliner nusantara disanaa yg blm sempet kesana kuysss besokk gays lgsg gow ke gbk senayan buat kenalirasanyaindonesia jangan lupa daftar dl disinii pejuangrasanyaindonesia
2022-10-29 16:40:29+00:00,Nurulhaayati,jiaaakh dah weekend yuk kt ke festival jajanan bango fjb2022 28 30 oct di parkir timur gbk senayan jakarta tmpt nya seneng msuk grtis tnp antri cuma klik sini gas kt nikmatin 90 ragam kuliner nusantara utk kenalirasanyaindonesia yeaaay
2022-10-29 16:40:22+00:00,bveatrix,jalan jalan ke pasar beli mangga yuk ke festival 90 kuliner nusantara fjb2022 udah hadir kembali nih reminder besok 30 okt hari terakhir jadi save the date guys lokasinya ada di gbk senayan ya gratis masuk tanpa antri kenalirasanyaindonesia
2022-10-29 16:40:17+00:00,InvesJamurJabon,ingin punya resto kuliner joeragangroup di bandung dibuka kemitraan amp investasi utk lokasi bdg join skrg
2022-10-29 16:39:20+00:00,travcouple_id,selamat malam minggu oh ya besok ada festival jajanan bango fjb2022 lohh ingett 28 30 oct ya di parkir timur gbk senayan jkt isi ini deh biar bisa masuk tanpa antri kuy nikmati sensasi 90 ragam kuliner nusantara amp kenalirasanyaindonesia
2022-10-29 16:38:48+00:00,mhmdfkrhdyt,yuk dong mumpung masih ada kesempatan nih masih 28 30 oct cuss buru daftar fjb2022 disini kalian bisa menikmati 90 ragam kuliner nusantara dan bisa gratis masuk tanpa antri guys di gbk senayan kenalirasanyaindonesia pejuangrasanyaindonesia
2022-10-29 16:38:05+00:00,aquariusdoyi,halo temen temenn siapa mau bareng ke gbk senayan buat event fjb2022 ada 90 ragam kuliner nusantara loh ayo deh daftar biar kenalirasanyaindonesia pejuangrasanyaindonesia
2022-10-29 16:38:04+00:00,sakatonikabcey,guys yuk hari minggu besok datang ke fjb2022 yang hadir kembal loh disana ada 90 ragam kuliner nusantara lokasinya di gbk senayan dann besok hari terakhir loh buruan daftarmya pun gratis masuk tanpa antri kenalirasanyaindonesia
2022-10-29 16:38:03+00:00,balonudarakuu,seru banget ya kayaknya festival jajanan bango tuh ada 90 ragam kuliner nusantara cuyy auto kenyang kabar baiknya kalian bisa masuk gratis tanpa antri dengan daftar di gampang bett kenalirasanyaindonesia fjb2022 pejuangrasanyaindonesia
2022-10-29 16:37:54+00:00,peniti_meniti,setuju terimalah bali apa adanya ga perlu ada kamuflase2an sesaat g20 bisa berganti namun
2022-10-29 16:37:15+00:00,sundreamy_,para pecinta kulinerr yuk dateng ke fjb atau festival jajanan bango di gbk senayan menarik bgt disana bakal banyak kuliner lo guysss tgl 28 30 oktober masuknya gratis daftar aja no antri2 club kenalirasanyaindonesia fjb2022 pejuangrasanyaindonesia
2022-10-29 16:37:14+00:00,lichun03,wah gak sabar bet bakal gass ke festival jajanan bango fjb2022 28 30 oct di parkir timur gbk senayan jkt mau masuk gratis tanpa antri juga isi ini aja yak yuk ikutan nikmatin 90 ragam kuliner nusantara kenalirasanyaindonesia
2022-10-29 16:36:48+00:00,sundreamy_,weekend ini ada yg bikin happy lhoo fjb hadir kembalii banyak banget beragam kuliner nusantara yg bisa dicoba daftar nya gratis ya gengs disini lokasinya di gbk senayan 28 30 oktober kenalirasanyaindonesia fjb2022 pejuangrasanyaindonesia
2022-10-29 16:36:43+00:00,Nuyuybestiemu,mimpi ngga nih klo festival jajan bango bkl ada di gbk senayan parkir timur tgl 28 30 oktober trs masa bs gratis msuk tnp antri cuma dg dftr di link ini kesempatan buat coba 90 ragam kuliner nusantara biar bs kenalirasanyaindonesia fjb2022 gabole klwt
