created_at,author,cleaned_tweet
2022-11-01 16:47:24+00:00,afalmafaaa,ga sabar bgtt pgn nyobain kuliner pwt yg udh w bookmark ampe berdebu
2022-11-01 16:46:47+00:00,xxxjsta,wisata kuliner bareng haechan mamavote nctdream
2022-11-01 16:42:05+00:00,OJKMT_L,wisata kuliner bareng haechan mamavote nctdream
2022-11-01 16:40:28+00:00,hugkwonli,wisata kuliner bareng haechan mamavote nctdream
2022-11-01 16:40:17+00:00,InvesJamurJabon,ingin punya resto kuliner joeragangroup di bandung dibuka kemitraan amp investasi utk lokasi bdg join skrg
2022-11-01 16:38:18+00:00,dhchanlee,list kuliner kl aku ke solo makin banyak ajaaa
2022-11-01 16:34:16+00:00,PempekJOERAGAN,investasi kuliner ala joeragan invest 25 jutaan cek infonya disini join skrg
2022-11-01 16:32:43+00:00,ferdisandhy,kuliner malam enak sekitar gejayan mantap banget ga ada duanya
2022-11-01 16:28:08+00:00,kompasiana,tips usaha kuliner bertahan di tengah ancaman krisis 2023
2022-11-01 16:26:11+00:00,blokmsquare,colourful november dengan jadwal yang semakin seru dan event event yang menarik antara lain snack on kampung kuliner minangkabau infinix gaming master the food carnival serta pameran otomotif amp pameran multi produk info marketing 021 72802000 atau chat wa 082288883429
2022-11-01 16:25:33+00:00,Popmama_com,kuliner malam jogja yang enak murah dan asyik untuk nongkrong bareng keluarga
2022-11-01 16:25:09+00:00,HariWah49215350,pergi makan malam dengan keluarga netizen ini alami kejadian yang tak menyenangkan keluarganya diberi tagihan rp 1 juta unt
2022-11-01 16:24:35+00:00,rajodurian,rasakan lembut dan gurihnya kuliner rajo durian ini di outlet outlet kami atau pun bisa anda bawa pulang kuliner rajodurian
2022-11-01 16:24:29+00:00,lizaariani5,sobatrupiah bagaimana reaksi delegasi g20 ketika disuguhin nasi uduk lahap buktinya menteri keuangan dan guber
2022-11-01 16:21:36+00:00,detikcom,pergi makan malam dengan keluarga netizen ini alami kejadian yang tak menyenangkan keluarganya diberi tagihan rp 1 juta untuk sayuran ini saja waduh
2022-11-01 16:20:21+00:00,duc_ti_pot,sad news kuliner legendaris nasi uduk kota intan yang sudah berdiri selama 50 tahun diambil secara paksa oleh oran
2022-11-01 16:19:54+00:00,TiyarmanGulo,tips usaha kuliner bertahan di tengah ancaman krisis 2023
2022-11-01 16:18:35+00:00,nolantv_com,tempat pariwisata masakan warung man gege sanur tawarkan menu khas bali yg disajikan secara unik video bali destinasiwisata disajikan
2022-11-01 16:18:01+00:00,mayrenmarker,wisata kuliner bareng haechan mamavote nctdream
2022-11-01 16:13:06+00:00,Nopppppp_,partner ghibah main dan kuliner terbaik memanglah ayang
2022-11-01 16:10:09+00:00,nindaputri__,sobat kuliner nih yukkk gas
2022-11-01 16:10:08+00:00,InvesJamurJabon,investasi resto kuliner joeragan paling diminati saat ini prospektif dan potensial join
2022-11-01 16:10:07+00:00,spezializazi,yg lewat di tiktok jember mulu dr yg kuliner dr yg wisuda trs anak perantauan yg ke jember apa ini tandanya ak hrs main ke jember lgiiii
2022-11-01 16:09:44+00:00,pantepik,kuliner malam enak sekitar gejayan mantap banget ga ada duanya
2022-11-01 16:09:44+00:00,wolipop,di inggris ada museum dengan konsep yang unik semua benda yang dipamerkan adalah makanan yang pernah digigit seorang selebriti ini potretnya
2022-11-01 16:08:00+00:00,AchmadEkaP,kuliner sukses dengan sarimi isi dua sarimi siap mengeluarkan sarimi isi dud
2022-11-01 16:04:17+00:00,PempekJOERAGAN,investasi resto kuliner joeragan paling diminati saat ini prodpektif dan potensial join
2022-11-01 16:03:04+00:00,nolantv_com,kisah seorang pria di pangkalpinang sukses ubah ruko menjadi tempat pariwisata masakan balai kopi video balai
2022-11-01 16:01:33+00:00,gemeinschaeft,dan emg dasar anaknya macam pergi kuliner berjalan jadi ada aja rekomendasi atau kemauannya itulah yang bikin aku sat set sat set jalan terus kalau oke aku rekomendasiin ke temenku
2022-11-01 15:54:40+00:00,Mpon_Mponn,kehebatan pak genjot kinerja mes hingga tembus 22 negara ini semata2 dilakukan agar kita lebih maju lagi su
2022-11-01 15:52:20+00:00,adevaaaa89,tempe kemul kuliner khas wonosobo sudah ditetapkan sebagai warisan budaya tak benda wonosobo jawatengah indonesia
2022-11-01 15:50:22+00:00,kadek97,ngobrol bareng raditya dika ditemani aktor komedian ichal kate sambil makan makan di kantin blauran cipete obrolan se
2022-11-01 15:49:47+00:00,Dipafahmi_,mumpung masih dalam suasana habis gajian aku mau kasih rekomendasi kuliner jogja selain gudeg tapi nggak kalah enak a threa
2022-11-01 15:48:21+00:00,republikaonline,pengusaha kuliner yakin krisis global 2023 tidak akan separah dampak ppkm
2022-11-01 15:41:58+00:00,detikhot,di inggris ada museum dengan konsep yang unik semua benda yang dipamerkan adalah makanan yang pernah digigit seorang selebriti ini potretnya
2022-11-01 15:38:12+00:00,dreeblissad,adaaaa recommend gak hrs kemana selain kuliner
2022-11-01 15:37:45+00:00,f_h3rl,ternyata produk indomie yang ada di indonesia dan di luar negeri punya beberapa perbedaan mulai dari kemasan varian rasa hi
2022-11-01 15:35:52+00:00,AgungRiyad13,kuliner info tah mun liwat ka daerah sukaraja aya nasgor cebanan kalo aku suka ga pake telor soalnya alergi jadi hargany
2022-11-01 15:34:53+00:00,RAlbertus,kuliner malam enak sekitar gejayan mantap banget ga ada duanya
2022-11-01 15:32:03+00:00,dudunanalala,ngobrolin kuliner gak ada habisnya mimin mau spill nih kantin viral di uii yuk ikut mimin explore tempat jajan pada
2022-11-01 15:31:55+00:00,Nathan_Dika,sad news kuliner legendaris nasi uduk kota intan yang sudah berdiri selama 50 tahun diambil secara paksa oleh oran
2022-11-01 15:31:36+00:00,Jakaandre696,ada yg di sekitar an sumarecon bsd kuliner an yukk
2022-11-01 15:29:41+00:00,MissDerpDark,sad news kuliner legendaris nasi uduk kota intan yang sudah berdiri selama 50 tahun diambil secara paksa oleh oran
2022-11-01 15:29:37+00:00,ngeindomie,nder kamu dom mana bisa nntn premier xxi ikut open trip brg org lain atau ke cafe kucing or anjing gt buat lepas penat kalo suka makan bs mamam kuliner khas kotaa or coba festival gt nder
2022-11-01 15:29:22+00:00,srlyrf,kuliner malam enak sekitar gejayan mantap banget ga ada duanya
2022-11-01 15:27:47+00:00,glennmalonda,nasi uduk kota intan menjadi salah satu ikon kuliner legendaris di pasar baru pemiliknya mengungkapkan ada sabotase dan peng
2022-11-01 15:26:25+00:00,unyasjafrina,membeli fried chicken dalam jumlah banyak dilakukan banyak orang jika ada sisa dan mau memakannya keesokan hari begini 4 ca
2022-11-01 15:26:19+00:00,maafgakduluya,kuliner apa kita malem ini
2022-11-01 15:24:46+00:00,shnandrikka,membeli fried chicken dalam jumlah banyak dilakukan banyak orang jika ada sisa dan mau memakannya keesokan hari begini 4 ca
2022-11-01 15:24:32+00:00,txtdarisukabumi,kuliner info tah mun liwat ka daerah sukaraja aya nasgor cebanan kalo aku suka ga pake telor soalnya alergi jadi hargany
2022-11-01 15:23:13+00:00,myjjaksarang,knp ya video kuliner org india yg tersebar di internet kebanyakan yg kurang bersih gitu tapi entah kenapa gue tonton sampe abis ada masalah apa sih gue
2022-11-01 15:13:51+00:00,abcdsampejk,kalau kamu lagi jenuh dan ngerasa hidup gitu gitu aja mungkin itu pertanda untuk mulai mencoba hal baru bisa dengan
2022-11-01 15:13:32+00:00,ayfa_D_Ace,kuliner jogja enak underrated thread ini dibuat menurut rasa dan lidah sendiri
2022-11-01 15:12:34+00:00,dhuka_it77,koridor godean tak jadi mandeg berubah rute menjadi ngabean wirobrajan tegalrejo jati kencana demak ijo kuliner belut
2022-11-01 15:10:23+00:00,transonlinecom,gofood bantu usaha kuliner di tengah perkampungan bertahan saat pandemi menerjang
2022-11-01 15:10:00+00:00,FXHarminanto,koridor godean tak jadi mandeg berubah rute menjadi ngabean wirobrajan tegalrejo jati kencana demak ijo kuliner belut godean rehat demak ijo pingit tugu mangkubumi malioboro punokawan ngabean jam operasi pagi dan sore 5 30 8 00 dan 14 30 17 00 tarif standar transjogja
2022-11-01 15:07:46+00:00,jakarta_food,detikfood gaya keren adik brigadir j reza hutabarat saat kulineran
2022-11-01 15:05:43+00:00,detikfood,gaya keren adik brigadir j reza hutabarat saat kulineran
2022-11-01 15:05:37+00:00,rapmafmums,karna tadi king dan queen udah ngebahas banyak banget yakan dari traveling kuliner terus fashion juga dan karna udah jam 10 juga waktunya king aska dan queen aul undur diri dari kingandqueen thankyou campusbrainers
2022-11-01 15:03:23+00:00,twenibesha,membeli fried chicken dalam jumlah banyak dilakukan banyak orang jika ada sisa dan mau memakannya keesokan hari begini 4 ca
2022-11-01 15:00:53+00:00,rapmafmums,infostyle kurang lengkap kalo udah ngebahas traveling kuliner tapi enggak ngebahas fashion gitu queen aul dan king aska mau ngebahas jaket kimono nih jadi emang banyak yang masih susah ngebedain ya antara outer biasa sama kimono gitu nihh ada fotonya kok kingandqueen
2022-11-01 14:58:43+00:00,wakaconih,lo harus tau apa yg buat di interest kek k pop musik kuliner or something like that tp yg paling penting doi harus interest sama lo si kalo ngga ya mending skip buang buang waktu
2022-11-01 14:58:37+00:00,momogimaulagy,kalau kamu lagi jenuh dan ngerasa hidup gitu gitu aja mungkin itu pertanda untuk mulai mencoba hal baru bisa dengan
2022-11-01 14:58:34+00:00,BenHestu,psikopat adalah psikologi dan kopat semacam kopat tahu pojok magelang atau kopat tahu blora kedua kopat ini enak banget dan bikin hidup tambah cerdas menjadi psikopat asal asalan pasti ngga cerdas oleh sebab itu perlu kuliner kopat tahu yang lejen itu
2022-11-01 14:58:29+00:00,kumpulanberit,resep chicken katsu black pepper olahan ayam goreng tepung yang enak gurih dan menggugah selera
2022-11-01 14:57:51+00:00,Dindon16,sad news kuliner legendaris nasi uduk kota intan yang sudah berdiri selama 50 tahun diambil secara paksa oleh oran
2022-11-01 14:56:14+00:00,DewainsaE,di magelang ada kuliner legendaris yang patut kamu coba namanya sop senerek bu atmo sejak lebih dari 60 tahun lalu
2022-11-01 14:56:06+00:00,littlerjnie,wisata kuliner bareng haechan mamavote nctdream
2022-11-01 14:54:50+00:00,olalisaaa,grup yg kalo urusan makan mmng cepat skali kuliner teross
2022-11-01 14:51:16+00:00,renggalism,kayaknya sih cak uut pelopor sego sambel tempong yang ada di malang ya sambelnya yg khas dan super super puwedes sampai mem
2022-11-01 14:50:33+00:00,charlesmpg88_,sobatrupiah bagaimana reaksi delegasi g20 ketika disuguhin nasi uduk lahap buktinya menteri keuangan dan guber
2022-11-01 14:49:39+00:00,Daxxzs,dips tolong tambahin info kuliner semarang yg harus dicoba sebelum ninggalin semarang please thank you
2022-11-01 14:48:54+00:00,Saremlyn,kuliner malam enak sekitar gejayan mantap banget ga ada duanya
2022-11-01 14:44:26+00:00,pesawat_tempurr,kisarasa keren pol docuseries kuliner indo yg enak banget ditonton
2022-11-01 14:43:15+00:00,aftanergizerz,rawon krengsengan ini selalu menjadi tujuan kuliner baik warga lokal maupun pendatang ke surabaya rasa nikmatnya sulit diungkapkan rawon pak pangat ketintang surabaya
2022-11-01 14:41:36+00:00,redberkalteng,dermaga rambang berpotensi menjadi alternatif wisata kuliner di palangka raya
2022-11-01 14:39:58+00:00,fallinjaemin,wisata kuliner bareng haechan mamavote nctdream
2022-11-01 14:39:56+00:00,ceweadaaja,dips tolong tambahin info kuliner semarang yg harus dicoba sebelum ninggalin semarang please thank you
2022-11-01 14:38:58+00:00,yosiefayuli,di semarang pas siang ry nanti kita diajak makan malem nasabah abis itu kita jalan lagi aja cari kuliner malem gitu pas malem abis makan malem pulang mandi skineran bobo2an jompolyfe
2022-11-01 14:37:41+00:00,scnbro,kuliner malam enak sekitar gejayan mantap banget ga ada duanya
2022-11-01 14:37:32+00:00,Mariacristine81,pantjoran pik pusat kuliner food street
2022-11-01 14:37:22+00:00,dicky_tinton,dunia pariwisata benar2 mati suri waktu itu yg di kerja di hotel resto kuliner banyak yg dirumahkan krn memang usaha2 tsb ga ada pemasukan yg berarti sedangkan biaya2 operational spt listrik industri dsb argo terus berjalan dan sampai kpn jg waktu itu blm bs terlihat
2022-11-01 14:36:19+00:00,Mariacristine82,pantjoran pik pusat kuliner food street
2022-11-01 14:35:41+00:00,fallincchan,wisata kuliner bareng haechan mamavote nctdream
2022-11-01 14:34:55+00:00,Dd_vii,wisata kuliner bareng haechan mamavote nctdream
2022-11-01 14:33:06+00:00,RiaVertika1,di jawa timur terkenal kuliner murahnya sepertinya maaf itu agak kemahalan deh kak
2022-11-01 14:31:42+00:00,BaksoJOERAGAN,ingin punya usaha kuliner joeragan rasa paling dicari dijamin diburu pembeli yuk join kemitraan kami skrg
2022-11-01 14:30:24+00:00,kinginjapanese,aduh mamank kuliner kenapa harus ngupload review 3 rasa moon chicken pas gua masi di malang si anjirrrr ngilerrrr coookkkk buka cabang di malang plisss
2022-11-01 14:27:49+00:00,WellToto,di magelang ada kuliner legendaris yang patut kamu coba namanya sop senerek bu atmo sejak lebih dari 60 tahun lalu
2022-11-01 14:24:39+00:00,moncherie94,btw kangen konten2 jwestbros kenapa bubaran ya dulu satu2nya youtuber food vlogger paling jujur cm mereka sisanya ya begitulah wkwk skrg yg jujur lg reviewnya cm ada mamank kuliner
2022-11-01 14:24:12+00:00,bentang_ra,kuliner info tah mun liwat ka daerah sukaraja aya nasgor cebanan kalo aku suka ga pake telor soalnya alergi jadi harganya 8 rb rasanya enak pisan
2022-11-01 14:24:00+00:00,Martabak_LEGIT,investasi kuliner martabak legit group khas bandung invest 25jt saham bagi hasil 500rb bln kontrak 3 th join now
2022-11-01 14:23:47+00:00,divisipublikasu,nah kuliner sekitar kono oke2 namanya stadion mandala krida
2022-11-01 14:20:02+00:00,ngalamfess,oyi saran kuliner yg ada di mog dong rekk
2022-11-01 14:17:00+00:00,kumpulanberit,cuma modal mie instan dan tahu bisa jadi cemilan yang enak banget ikuti langkah membuatnya
2022-11-01 14:16:42+00:00,gsungnin,wisata kuliner bareng haechan mamavote nctdream
2022-11-01 14:16:23+00:00,AnnieNugraha,bakso goreng anugerah gor pajajaran bandung setelah sekian purnama akhirnya bisa merasakan lezatnya bagor dan mie ayam spesialnya jempolan pokoknya jelajah kuliner bandung yg recommended baksogorenganugerah kulinerbandung gorpajajaranbandung
2022-11-01 14:16:08+00:00,detikcom,membeli fried chicken dalam jumlah banyak dilakukan banyak orang jika ada sisa dan mau memakannya keesokan hari begini 4 cara hangatkan fried chicken
2022-11-01 14:16:00+00:00,Not_Foundds,nasi uduk kota intan menjadi salah satu ikon kuliner legendaris di pasar baru pemiliknya mengungkapkan ada sabotase dan peng
2022-11-01 14:13:49+00:00,Marketing_co_id,hari ini 1 november diperingati sebagai hari inovasi nasional inovasi bisa diterapkan di berbagai bidang mulai dari kulin
2022-11-01 14:13:15+00:00,alphomega_,saya usul supaya bin membina usaha kuliner
2022-11-01 14:12:24+00:00,filianofita,kalau kamu lagi jenuh dan ngerasa hidup gitu gitu aja mungkin itu pertanda untuk mulai mencoba hal baru bisa dengan
2022-11-01 14:12:02+00:00,BanyTerman,4 rekomendasi tempat kuliner di wonosobo warung mie ongkrang longkrang ayam goreng bugisan fraternal house white house cafe wonosobo kulinerwonosobo indonesia
2022-11-01 14:11:39+00:00,gus_azman,ternyata produk indomie yang ada di indonesia dan di luar negeri punya beberapa perbedaan mulai dari kemasan varian rasa hi
2022-11-01 14:11:17+00:00,nico_apri,di magelang ada kuliner legendaris yang patut kamu coba namanya sop senerek bu atmo sejak lebih dari 60 tahun lalu
2022-11-01 14:10:48+00:00,detikcom,di magelang ada kuliner legendaris yang patut kamu coba namanya sop senerek bu atmo sejak lebih dari 60 tahun lalu
2022-11-01 14:10:33+00:00,nolantv_com,tempat pariwisata masakan a differ di pik tawarkan sensasi kulineran sambil nikmati olahraga golf video destinasiwisata differ golf
2022-11-01 14:10:15+00:00,gorengandua,di kabupaten boyolali jawa tengah ada kuliner legendaris unik bernama jenang pecel gurihnya jenang sumsum ditambah sirama
2022-11-01 14:10:12+00:00,InvesJamurJabon,ingin punya usaha kuliner paling potensial saat ini kami mengusung konsep kuliner sehat higienis halal amp nikmat
2022-11-01 14:09:02+00:00,gus_azman,menu makanan di salah satu restoran yang menggunakan aplikasi ojek online ini tampak membingungkan tawarkan menu nasi campur
2022-11-01 14:08:19+00:00,detikcom,menu makanan di salah satu restoran yang menggunakan aplikasi ojek online ini tampak membingungkan tawarkan menu nasi campur namun fotonya nasi ayam
2022-11-01 14:08:06+00:00,AEPishere,ternyata produk indomie yang ada di indonesia dan di luar negeri punya beberapa perbedaan mulai dari kemasan varian rasa hi
2022-11-01 14:07:23+00:00,jakarta_food,detikfood ronny talapessy pengacara barada e saat makan papeda hingga dimsum
2022-11-01 14:06:26+00:00,berisikpadaan,bukannya dikasih kue ulang tahun para jomblo di negara ini harus siap dilempari bubuk kayu manis jika belum menikah di usia
2022-11-01 14:06:22+00:00,nyonyahsyuuper,kayaknya sih cak uut pelopor sego sambel tempong yang ada di malang ya sambelnya yg khas dan super super puwedes sampai mem
2022-11-01 14:05:59+00:00,Occxxwinsus_DS,siapa bilang menu khas daerah tak bisa tembus pasar mancanegara sate ambal khas kabupaten kebumen jawa tengah salah satun
2022-11-01 14:05:52+00:00,detikcom,bukannya dikasih kue ulang tahun para jomblo di negara ini harus siap dilempari bubuk kayu manis jika belum menikah di usia 25 tahun
2022-11-01 14:05:48+00:00,malangkuliner,kayaknya sih cak uut pelopor sego sambel tempong yang ada di malang ya sambelnya yg khas dan super super puwedes sampai mem
2022-11-01 14:05:38+00:00,detikfood,ronny talapessy pengacara barada e saat makan papeda hingga dimsum
2022-11-01 14:05:14+00:00,NNazarudi,ternyata produk indomie yang ada di indonesia dan di luar negeri punya beberapa perbedaan mulai dari kemasan varian rasa hi
2022-11-01 14:04:48+00:00,detikcom,ternyata produk indomie yang ada di indonesia dan di luar negeri punya beberapa perbedaan mulai dari kemasan varian rasa hingga bumbunya sudah tau
2022-11-01 14:04:19+00:00,PempekJOERAGAN,kuliner paling ajip pempekjoeragan rasa gurih dan nikmat dipadu dgn cuko yang kental manis amp pedas dijamin pool
2022-11-01 14:03:30+00:00,4_gp2024,siapa bilang menu khas daerah tak bisa tembus pasar mancanegara sate ambal khas kabupaten kebumen jawa tengah salah satunya kuliner lokal ini berhasil menembus pasar luar negeri bahkan semakin dikenal seusai ikut progam lapak ganjar sahabatganjar ganjarpranowo ganjar
2022-11-01 14:03:21+00:00,izyxdgs,um keluargaku mau main kesinii tp bingung pol mau ngajak makan kulineran dimana gamau ngecewain karna ak udah beberapa tau
2022-11-01 14:01:20+00:00,javafoodie_,kuliner malam enak sekitar gejayan mantap banget ga ada duanya
2022-11-01 14:00:34+00:00,kanayashilaaa,both abis hunting foto bareng jaemin terus pulangnya wisata kuliner bareng haechan mamavote nctdream
2022-11-01 14:00:02+00:00,CNNIDdaily,di kabupaten boyolali jawa tengah ada kuliner legendaris unik bernama jenang pecel gurihnya jenang sumsum ditambah siraman saus kacang yang pedas membuat kuliner unik ini selalu ramai diburu pembeli
2022-11-01 13:59:17+00:00,Fuad_Lha9,program ini bertujuan untuk mengembangkan kuliner halal yang dimiliki oleh daerah daerah di indonesia yang bertujuan agar eko
2022-11-01 13:55:29+00:00,detikcom,restoran di india ini menyentuh hati karena aksi inisiatifnya restoran itu menyediakan lapangan kerja bagi orang yang tuli dan bisu salut
2022-11-01 13:49:37+00:00,Valin_Abdillah,kenapa sekarang para pelaku umkm kuliner berlomba lomba jadi aneh ya esensi makanan dikonsumsi untuk kenikmatan tuh jadi bergeser fokusnya sekarang adalah viraaaaallll
2022-11-01 13:49:08+00:00,IndraGunawanku,jajanan pasar ragam produk kuliner warisan budaya leluhur negeri ini kian terhimpit membanjirnya jajanan modern yang secara umum merupakan hasil adaptasi dari produk asing dukung pengembangan umkm teh butong dan toba sari
2022-11-01 13:47:16+00:00,rashaespa,sekian wisata kuliner hari ini
2022-11-01 13:46:16+00:00,dhnbydha,kuliner solo sek enak endi kak
2022-11-01 13:42:11+00:00,ellzdin,jajan kuliner workout baca buku nnton komedi lari webinar ngonten dan join course adalah jalan ninja biar tetep stabil ditengah derasnya arus radar toxic stay calm and slay babe
2022-11-01 13:39:00+00:00,friscila,kalau kamu lagi jenuh dan ngerasa hidup gitu gitu aja mungkin itu pertanda untuk mulai mencoba hal baru bisa dengan
2022-11-01 13:36:13+00:00,frimayana,nasi uduk kota intan menjadi salah satu ikon kuliner legendaris di pasar baru pemiliknya mengungkapkan ada sabotase dan peng
2022-11-01 13:33:39+00:00,cukkadama,and finally rumah om haji menutup smua kuliner gratis untuk hari ini hahhaha
2022-11-01 13:30:42+00:00,cinoyie7dreamxo,wisata kuliner bareng haechan mamavote nctdream
2022-11-01 13:27:39+00:00,happyenemies,sad news kuliner legendaris nasi uduk kota intan yang sudah berdiri selama 50 tahun diambil secara paksa oleh oran
2022-11-01 13:26:45+00:00,rashaespa,aku tadi habis wisata kuliner
2022-11-01 13:26:45+00:00,cinoyie7dreamxo,wisata kuliner bareng haechan nctdream mamavote
2022-11-01 13:26:42+00:00,hrj00__,wisata kuliner bareng haechan renjun maaf yah aku gabisa ngelukis soalnya mamavote nctdream
2022-11-01 13:25:30+00:00,RiadlinRafif,sad news kuliner legendaris nasi uduk kota intan yang sudah berdiri selama 50 tahun diambil secara paksa oleh oran
2022-11-01 13:25:15+00:00,el_fian,rolasan telat bgt sate satekambing tongseng kuliner kulinerborobudur kulinermagelang warung sate dan tongseng mbak ning
2022-11-01 13:24:01+00:00,njmine1308,wisata kuliner bareng haechan renjun maaf yah aku gabisa ngelukis soalnya mamavote nctdream
2022-11-01 13:23:44+00:00,whothateniw_,wisata kuliner bareng haechan renjun maaf yah aku gabisa ngelukis soalnya mamavote nctdream
2022-11-01 13:22:14+00:00,jogjafamilyfm,armada teman bus jogja yang melintas di rute godean ngabean terancam dicabut oleh pemerintah alasannya pada rute yang dimaksud yakni koridor 2 jalur godean dari pusat kuliner belut godean ke ngabean okupansi penumpangnya sangat rendah sumber tribun news jogjanewsupdate
2022-11-01 13:21:43+00:00,onyourrra,wisata kuliner bareng haechan renjun maaf yah aku gabisa ngelukis soalnya mamavote nctdream
2022-11-01 13:18:54+00:00,happyenemies,nasi uduk kota intan menjadi salah satu ikon kuliner legendaris di pasar baru pemiliknya mengungkapkan ada sabotase dan peng
2022-11-01 13:17:44+00:00,HumaspolresKaur,selasa 01 november 2022 kapolres kaur akbp dwi agung setyono s i k m h hadiri pembukaan uji kompetensi wartawan angkatan ke xviii bertempat di gedung sentral kuliner bintuhan
2022-11-01 13:16:22+00:00,Haloocii_,wisata kuliner bareng haechan nctdream mamavote
2022-11-01 13:16:10+00:00,aktifeast_,info kuliner taiwan
2022-11-01 13:14:28+00:00,Bidawangsakti,sad news kuliner legendaris nasi uduk kota intan yang sudah berdiri selama 50 tahun diambil secara paksa oleh oran
2022-11-01 13:13:33+00:00,PelitaBanten,lirik lagu no comment tuty wibowo kuliner tutywibowo
2022-11-01 13:13:22+00:00,RumaJamurBDG,para pemburu kuliner khas bandung wajib mencoba camilan terbaru kami moyster dari olahan jamur tiram segar sehat yummy n kranchy
2022-11-01 13:11:43+00:00,BikinLaparMata,kunjungan ke pantai panjang bengkulu terasa kurang lengkap bila belum mencicipi aneka kuliner seafood infobengkulu
2022-11-01 13:11:34+00:00,Parambaka,dosa sejak kapan ada dosa yang enak bukannya semua dosa itu nggak enak atau ini tentang massala dosa kuliner khas negeri acha achaa
2022-11-01 13:11:07+00:00,horekaaddict,aku bikin konten quiz seberapa indonesia kamu di jepang dan masuk video petualangan kuliner si cepot amp sahabat jepang
2022-11-01 13:10:13+00:00,khjsjnna,wisata kuliner bareng haechan mamavote nctdream
2022-11-01 13:03:45+00:00,me_haryono,nasi uduk kota intan menjadi salah satu ikon kuliner legendaris di pasar baru pemiliknya mengungkapkan ada sabotase dan peng
2022-11-01 13:03:45+00:00,renjunviuw,wisata kuliner sama haechan dong soalnya aku suka makannn mamavote nctdream
2022-11-01 13:02:28+00:00,eidrifh,pengen wisata kuliner
2022-11-01 13:01:01+00:00,bramjk_,ngikuti film pendek sejarah kuliner di kisarasa host nya chef auranya jadi anteng nonton
2022-11-01 13:00:39+00:00,ieunhui42514590,wisata kuliner bareng haechan maaf na tapi urusan perut gabisa dipikir 2 kali mamavote nctdream
2022-11-01 13:00:13+00:00,MotivaHarian,pengen bisnis kuliner bakso mie sosis roti sambal es krim dll ikuti trainingnya di setiap bulan klik
2022-11-01 12:59:55+00:00,riecherie,wisata kuliner bareng haechan mamavote nctdream
2022-11-01 12:59:42+00:00,keisukeabdul,sad news kuliner legendaris nasi uduk kota intan yang sudah berdiri selama 50 tahun diambil secara paksa oleh oran
2022-11-01 12:58:09+00:00,hiiparkjsung,wisata kuliner bareng haechan mamavote nctdream
2022-11-01 12:55:16+00:00,desiindrianii,kalau kamu lagi jenuh dan ngerasa hidup gitu gitu aja mungkin itu pertanda untuk mulai mencoba hal baru bisa dengan
2022-11-01 12:54:45+00:00,sidiqsetiawan80,kuliner yg habis makan gak bayar
2022-11-01 12:54:37+00:00,rajodurian,dengan 8 outlet yang tersebar di jakarta depok dan bogor memudahkan anda untuk menikmati hidangan kuliner dari kami kuliner rajodurian
2022-11-01 12:52:14+00:00,thisishillaa,wisata kuliner bareng haechan maaf na tapi urusan perut gabisa dipikir 2 kali mamavote nctdream
2022-11-01 12:51:56+00:00,xxxradd,wisata kuliner bareng haechan mamavote nctdream
2022-11-01 12:50:33+00:00,HCLWx,kantong kuliner itu dikelola mandiri desa kalau gak salah di surabaya kecuali untuk yang di area taman kota masuk ke pengaturan pemkot
2022-11-01 12:50:19+00:00,rafandra_adi,gue nonton konser apa kuliner ya masa yang jualan makanan makanannya enak semua
2022-11-01 12:49:26+00:00,sukasukanyaku,kalau kamu lagi jenuh dan ngerasa hidup gitu gitu aja mungkin itu pertanda untuk mulai mencoba hal baru bisa dengan
