created_at,author,cleaned_tweet
2022-10-29 11:04:20+00:00,PempekJOERAGAN,ingin punya usaha kuliner joeragan rasa dan kualitas no 1 dijamin diburu pembeli yuk join kemitraan skrg
2022-10-29 11:01:11+00:00,nurvst,yup mungkin pada awalnya nasi bhuk adalah menu untuk mengobati rindu akan kampung halaman lambat laun bercampur dengan unsur kuliner lokal mungkin lho ya tapi yang jelas enak hehehe
2022-10-29 10:58:57+00:00,Satlantascmh,samsat nite kita seperti biasa dengan ditemani live musik kuliner dan nongkrong setiap sabtu jam 05 sore hingga 08 malam jabar ratna
2022-10-29 10:57:10+00:00,provjateng,siapa bilang menu khas daerah tak bisa tembus pasar mancanegara sate ambal khas kebumen jateng salah satunya kuliner
2022-10-29 10:56:22+00:00,Beranda_Godean,dulu berharap angkutan ini sampai per4tan godean keutara dan memutar lewat tgp ketimur baru ke kuliner welut melewati beberapa sekolah yang ada disana sehingga bisa jd alternatif untuk para pelajar memakai angkutan masal ini
2022-10-29 10:56:13+00:00,pesonaindonesia,yuk bergerak bersama bareng mas menteri minggu 30 oktober 05 30 wib gedung sapta pesona ekhm selain badan sehat akan ada hadiah jutaan rupiah dan pameran kuliner fesyen dan kriya dari 50 desa wisata terbaik jangan lewatin kesempatan ini diindonesiaaja
2022-10-29 10:55:35+00:00,kumparan,sejumlah tempat wisata kabupaten tegal menyediakan aneka kuliner tradisional salah satunya wisata pasar slumpring di desa cempaka kecamatan bumijawa publisherstory panturapost
2022-10-29 10:53:37+00:00,detikcom,tema google doodle hari ini adalah tempe atau tempeh tempe ini ternyata disebut berasal dari tembayat klaten pada 4 abad silam via
2022-10-29 10:52:25+00:00,republikaonline,festival jajanan bango menghadirkan 90 penjaja makanan dari seluruh indonesia
2022-10-29 10:52:04+00:00,jogmfs,jog info kuliner yang patut di coba
2022-10-29 10:51:10+00:00,shineeprl,kuliner khas umr dibawah 2 juta
2022-10-29 10:50:51+00:00,Onkelfian,yaampun setidaknya ayodong masa udah list kuliner satupun tidak direalisasikan heuhuhu
2022-10-29 10:49:25+00:00,infocimahico,cung siapa yang hobinya jajan nih mimin kasih rekomendasi tempatnya kalau kalian biasanya suka jajan di mana cim cimahi infocimahi bandung jawabarat jakarta kotacimahi lembang jajajan rekomendasi kuliner
2022-10-29 10:48:51+00:00,idrisngrh,kuliner khas umr dibawah 2 juta
2022-10-29 10:47:52+00:00,hymulan,kuliner khas umr dibawah 2 juta
2022-10-29 10:47:02+00:00,BumbelFess,bf nanti malem main yuk ke festival kuliner serpong atau kuliner pasar lama tangerang mana nih kali aja bisa lanjut motoran m2m
2022-10-29 10:46:31+00:00,tbfcsm,yg diberangus baliho kebetulan yg diphoto ada kuliner babinya jd terkesan negatif padahl objek utama adalah baliho bukan kulinernya
2022-10-29 10:45:00+00:00,menfesspelangi_,piw nanti malem main yuk ke festival kuliner serpong atau kuliner pasar lama tangerang mana nih kali aja bisa lanjut motoran m2m
2022-10-29 10:44:55+00:00,iyanke,kuliner khas umr dibawah 2 juta
2022-10-29 10:44:54+00:00,faktualnewsco,berdiri sejak 1970 tahu solet mak ni jadi kuliner legendaris di mojokerto
2022-10-29 10:43:50+00:00,airlangga_hrt,pertemuan ini bertambah hangat karena disuguhi kuliner tradisional masyarakat indonesia seperti soto betawi sate lilit pisang goreng wedang jahe dsb
2022-10-29 10:42:43+00:00,Kuliner__Bekasi,kuda berkaki 5
2022-10-29 10:42:13+00:00,escobranyusss,top story murah banget jajan nasi pecel dan es teler rp 3 500 di pasar bangilan tuban see more
2022-10-29 10:41:26+00:00,EchaaIchaa,sebagai orang baru di jakarta drop rekomendasi kuliner di jakarta yg menurut kalian enak dong dari yang murah sampai
2022-10-29 10:40:16+00:00,InvesJamurJabon,dokumentasi liputan trans tv kuliner jamur more info pin 2bcf59db call sms wa 0812 2269 0766 investasisyariah
2022-10-29 10:38:47+00:00,IndonesiainIsb,kehadiran produsen langsung indonesia di pakistan diharapkan dapat semakin meningkatkan volume perdagangan bilateral serta turut memperkenalkan kuliner khas indonesia di kalangan masyarakat pakistan inidiplomasi indonesianway rintiskemajuan
2022-10-29 10:38:41+00:00,nanaa_zaa,kuliner khas umr dibawah 2 juta
2022-10-29 10:37:52+00:00,Iqbalsilatuahm5,gus muhaimin festival free your mind amp health your body minggu 30 oktober 2022 di halaman tennis indoor senayan
2022-10-29 10:36:09+00:00,Blasttotheair,soal rasa itu pilihan soal murah itu juga pilihan jaya food hadir sebagai prodak untuk penikmat kuliner dari olahan
2022-10-29 10:36:08+00:00,damar7701,yukkk merapat gaes ke festival ganjar pronowo banyak kuliner umkm nya loh dan acara2 lainnya gpfestdieng
2022-10-29 10:35:47+00:00,ADhaifullah_,cocok juga shel bawain acara icip2 kuliner kayak ginii
2022-10-29 10:35:37+00:00,christo_reese,tujuannya apa dilepas emg dirasa bakal ngeganggu tamu g20 itu kuliner lokal woi
2022-10-29 10:34:51+00:00,YUPriMad,setuju terimalah bali apa adanya ga perlu ada kamuflase2an sesaat g20 bisa berganti namun
2022-10-29 10:34:20+00:00,asadmoko,sunset di kampung turis pusat kuliner pantai pamugaran pangandaran 29 okt 2022 bersama genus travel bandung
2022-10-29 10:32:09+00:00,jogjamnfs,jog info kuliner yang patut di coba
2022-10-29 10:32:04+00:00,NUANSAMART9991,yoww tasikmalaya kuliner from goronggorong crew for you madafaka kulinertasikmalaya wisatakuliner
2022-10-29 10:31:06+00:00,aishi_ishasha,gila abis dzuhur baru berangkat jam 5 dah pulang lemah bgt gue pergi event selalu cuma demi wisata kuliner gak tau kadang gue merasa lelah dikeramaian tapi kadang gue seneng rame heran kan
2022-10-29 10:30:07+00:00,welfareidonline,selain punya beragam tempat wisata dan tradisi budaya unik bali juga punya kuliner tradisional yang lezat makanan khas bali tentu sangat beragam jadi saat ke bali anda jangan lupa mencicipi aneka kuliner tradisionalnya yang jarang diketahui tersebut
2022-10-29 10:29:43+00:00,Betterthinkz,infooo cangkruk kuliner dsbb
2022-10-29 10:28:42+00:00,Blasttotheair,mau cari rekomendasi kuliner di twitter bisa cek di
2022-10-29 10:28:05+00:00,Madiun_Info,lapak pesona terapkan standar tinggi agar pengunjung puas madiun madiuninfo informasimadiun beritamadiun madiunnews kabarmadiun wisatamadiun peristiwamadiun ekonomi kuliner wisatakuliner kulinermadiun umkm lapakumkm kotamadiun madiunkota
2022-10-29 10:27:39+00:00,SOSjiel,nama fans untuk j l is jlstar 15 february 1994 hobby menggambar ng game kuliner jalan jalan main permainan ekstrem dan tidur
2022-10-29 10:25:11+00:00,ghazyalfarras,cocok juga shel bawain acara icip2 kuliner kayak ginii
2022-10-29 10:24:19+00:00,masprass__,ayo main sini ke sby kuliner xixixi
2022-10-29 10:23:45+00:00,michaelmediaone,bisnis kuliner di tanah air terus menarik minat para investor perusahaan di bidang sambal ini bahkan menerima pendanaan
2022-10-29 10:22:47+00:00,94dimple_,kuliner khas umr dibawah 2 juta
2022-10-29 10:22:43+00:00,detikfinance,bisnis kuliner di tanah air terus menarik minat para investor perusahaan di bidang sambal ini bahkan menerima pendanaan senilai rp 15 miliar
2022-10-29 10:20:57+00:00,tadhik23,acara e kan kuliner iku
2022-10-29 10:18:34+00:00,Popmama_com,selain menyajikan suasana yang berbeda kuliner malam bandung juga dikenal enak dan murah
2022-10-29 10:18:18+00:00,masprass__,iya next kalau main ke sby mampir kesini terus kuliner lontong kupang hehehe
2022-10-29 10:17:06+00:00,minjeongitb,winsip ngajak sarapan kuliner uwiw yg wajib dicoba
2022-10-29 10:16:44+00:00,kumpulanberit,rahasia memasak semur jengkol yang enak dan empuk dijamin tidak bau dan bikin ketagihan
2022-10-29 10:16:32+00:00,RiosSN,cocok juga shel bawain acara icip2 kuliner kayak ginii
2022-10-29 10:16:24+00:00,kumpulanberit,resep membuat sambal terasi mentah super pedas dan lezat bikin boros nasi di rumah
2022-10-29 10:16:17+00:00,asmarooney,emak keracunan promo kuliner an dari tiktok duh piye iki
2022-10-29 10:16:08+00:00,kumpulanberit,cara membuat donat ubi gula aren banyak yang belum tahu padahal resepnya simpel
2022-10-29 10:15:54+00:00,kumpulanberit,cara buat ice cream ala restoran cuma butuh 3 bahan tanpa pakai mesin dijamin sukses
2022-10-29 10:15:27+00:00,pinnlava,kuliner khas umr dibawah 2 juta
2022-10-29 10:13:01+00:00,AboutTNG,sabtu 29 10 sore di kawasan kuliner pasar lama masih nyaman buat jajan karena tidak berdesakan meski begitu tetap jaga barang berharga bawaanmu buat yang sedang di pasar lama atau yang akan datang malam mingguan nanti
2022-10-29 10:12:49+00:00,tangerangnews,pecinta kuliner ini 6 rekomendasi bakso enak di tangerang via
2022-10-29 10:11:17+00:00,sandyculinaire,redesign reconcept bingung usaha kuliner udah jalan tapi management belum support biar jadi bisnis autopilot kontak kami di bio scc aja
2022-10-29 10:10:25+00:00,jachedva,partner ghibah main dan kuliner terbaik memanglah ayang
2022-10-29 10:06:43+00:00,detik_sulsel,mencicipi lezatnya tiram bakar barru dengan aroma khas yang mengundang selera
2022-10-29 10:06:13+00:00,hartonotour,sebagai orang baru di jakarta drop rekomendasi kuliner di jakarta yg menurut kalian enak dong dari yang murah sampai
2022-10-29 10:05:43+00:00,ninylz,kuliner khas umr dibawah 2 juta
2022-10-29 10:05:43+00:00,detikfood,simpel dan cantik ini 5 kafe nuansa putih di sekitar jakarta
2022-10-29 10:04:33+00:00,btungka1997,setuju terimalah bali apa adanya ga perlu ada kamuflase2an sesaat g20 bisa berganti namun
2022-10-29 10:04:27+00:00,honneycheez,dari kmrn pgn bgt kuliner tp gd tmn trs hadehhh
2022-10-29 10:04:21+00:00,Arkobumen,lha iki mas pakarnya kuliner
2022-10-29 10:03:17+00:00,aryaramadani_,ada info menarik nih fjb 2022 hadir kembali di gbk senayan dari tanggal 28 30 oct ada 90 ragam kuliner nusantara gratis masuk tanpa antri buruan daftar di kenalirasanyaindonesia fjb2022 pejuangrasanyaindonesia
2022-10-29 10:01:14+00:00,PuspaViyem,bismillah sambel mercon jando sapi kuliner bandung by guning tot jeletot tak endol endol maknyus bikin bibir jontor order
2022-10-29 10:00:22+00:00,deenands,kuliner khas umr dibawah 2 juta
2022-10-29 09:58:30+00:00,DrEvaChaniago,soal rasa itu pilihan soal murah itu juga pilihan jaya food hadir sebagai prodak untuk penikmat kuliner dari olahan
2022-10-29 09:57:56+00:00,dorramaturgy,kapan ya bisa wisata kuliner di italia
2022-10-29 09:57:46+00:00,aryaramadani_,guys btw fjb 2022 hadir kembali nih di gbk senayan dari tanggal 28 30 oct ada 90 ragam kuliner nusantara gratis masuk tanpa antri buruan daftar di kenalirasanyaindonesia fjb2022 pejuangrasanyaindonesia
2022-10-29 09:57:15+00:00,FajarKNatanael,kuliner khas umr dibawah 2 juta
2022-10-29 09:56:02+00:00,Fajarsurya27,kuliner khas umr dibawah 2 juta
2022-10-29 09:55:03+00:00,Jarangpulangsi1,g20 berdampak positif pada tambahan terbukanya lapangan kerja di sektor kuliner fashion dan kriya sumatera utara kttg20 presidensig20 g20indonesia recovertogetherrecoverstronger g20indonesia2022 groupoftwentyindonesia pulihbersama
2022-10-29 09:54:51+00:00,ainutshabrina,kuliner khas umr dibawah 2 juta
2022-10-29 09:54:34+00:00,rajodurian,rajo durian juga melayani pemesanan durian dengan pengiriman ke seluruh indonesiadalam jumlah partai kecil menengah dan besar kuliner rajodurian
2022-10-29 09:53:58+00:00,Martabak_LEGIT,investasi kuliner legendaris martabak legit group investasi 1 gerai 100juta bagi hasil 2juta bulan join now
2022-10-29 09:53:06+00:00,arifabduh,kuliner khas umr dibawah 2 juta
2022-10-29 09:52:40+00:00,cyntiafrn,sebagai orang baru di jakarta drop rekomendasi kuliner di jakarta yg menurut kalian enak dong dari yang murah sampai
2022-10-29 09:52:02+00:00,merdekadotcom,besarnya prospek bisnis kuliner di indonesia ada yang baru raih pendanaan usd 1 juta
2022-10-29 09:46:32+00:00,berisikpadaan,wahhh ternyata ndog gulung 50 ewu gedene sakmene lho rek kiro kiro kuliner opo maneh seng kudu dituku porsi jumbo koyok
2022-10-29 09:45:03+00:00,uarmygope,fess coba rekomendasiin kuliner yg wajib banget dicoba kalau ke solo dong
2022-10-29 09:44:29+00:00,michelanugerah,seneng nonton kisarasa eps 8 ceritanya asik amp keliatan antusias banget minton jadi pengen ke jogja
2022-10-29 09:42:57+00:00,siapawaelah,bandung kerap menjadi tempat wisata bagi para vakansier untuk menjauh sejenak dari rutinitas terutama bagi jakartans ad
2022-10-29 09:40:41+00:00,archenaaar,seandainya aku malam mingguan dengan haechan aku bakal ajak haechan buat kuliner malam di lengkong kecil bandung apalagi ngajak buat nyobain seblak nct127 nct 127injkt nct127 neo city the link neocity the link jkt dyandraglobal concert
2022-10-29 09:40:32+00:00,paradigmafilm,seneng nonton kisarasa eps 8 ceritanya asik amp keliatan antusias banget minton jadi pengen ke jogja
2022-10-29 09:40:23+00:00,fajarargowiliss,kuliner khas umr dibawah 2 juta
2022-10-29 09:38:32+00:00,pontifun,kemana2 penasarannya ama jenis kuliner ini
2022-10-29 09:36:50+00:00,AMP_Stories,cerita ilustrasi tempe mendoan yang jadi goggle doodle detikjabar cerita
2022-10-29 09:36:40+00:00,detik_jabar,cerita ilustrasi tempe mendoan yang jadi goggle doodle
2022-10-29 09:36:08+00:00,askabd_,pgn wisata kuliner
2022-10-29 09:36:02+00:00,De_Liput,10 soto bokoran 1949 satu lagi kuliner legendaris yang wajib kamu coba di semarang namanya soto bokoran 1949 berbeda dengan kuah soto ayam pada umumnya berwarna bening kuah soto di sini cenderung berwarna kecokelatan semarang kuliner kulinersemarang
2022-10-29 09:35:40+00:00,detikfood,viral 5 makanan berbentuk mr p ini hebohkan media sosial
2022-10-29 09:35:34+00:00,De_Liput,9 warung pecel satu porsi pecel berisi nasi hangat rebusan bayam kacang panjang tauge yang disiram bumbu kacang semarang kuliner kulinersemarang
2022-10-29 09:35:21+00:00,aslisuroboyo,wahhh ternyata ndog gulung 50 ewu gedene sakmene lho rek kiro kiro kuliner opo maneh seng kudu dituku porsi jumbo koyok ngene tulis nang komen yo rek video lengkape nang tiktokaslisuroboyo
2022-10-29 09:34:48+00:00,De_Liput,8 tahu gimbal berkunjung ke semarang belum afdol rasanya kalau gak mencoba tahu gimbal yap tahu gimbal memang merupakan salah satu kuliner khas semarang semarang kuliner kulinersemarang
2022-10-29 09:34:11+00:00,De_Liput,7 mie kopyok mie kopyok adalah makanan khas semarang yang wajib dicoba satu porsi mie kopyok berisi lontong mi kuning taoge tahu pong dan kerupuk gendar semarang kuliner kulinersemarang
2022-10-29 09:33:26+00:00,De_Liput,6 seafood pak sangklak letak kota semarang yang berada di pesisir membuat banyak gerai seafood bermunculan salah satunya seafood pak sangklak wisata kuliner semarang ini sudah dikelola oleh tiga generasi semarang kuliner kulinersemarang
2022-10-29 09:33:08+00:00,yudhi__pramono,kuliner khas umr dibawah 2 juta
2022-10-29 09:32:55+00:00,biiiguuudttt_,cocok juga shel bawain acara icip2 kuliner kayak ginii
2022-10-29 09:32:53+00:00,De_Liput,5 es putar conglik setelah lelah berkeliling kota semarang yang cukup panas menikmati es puter conglik rasanya menyegarkan ada berbagai varian rasa yang dapat dipilih seperti durian coklat kelapa dan alpukat semarang kuliner kulinersemarang
2022-10-29 09:32:28+00:00,addiniyaa_,bandung kerap menjadi tempat wisata bagi para vakansier untuk menjauh sejenak dari rutinitas terutama bagi jakartans ad
2022-10-29 09:32:09+00:00,vindestwitt,bandung kerap menjadi tempat wisata bagi para vakansier untuk menjauh sejenak dari rutinitas terutama bagi jakartans ada rekomendasi kuliner dan tempat asik apa ya di vakansi ke bandung tonton videonya di youtube vindes klik vindes bervakansi
2022-10-29 09:32:05+00:00,De_Liput,4 toko oen untuk kamu penggemar kuliner manis toko oen bisa jadi tempat wisata kuliner semarang yang sayang jika dilewatkan toko oen merupakan restoran legendaris yang sudah ada sejak tahun 1936 semarang kuliner kulinersemarang
2022-10-29 09:31:32+00:00,De_Liput,3 soto bangkong soto bangkong merupakan kuliner legendaris yang sudah ada dari sekitar tahun 1950 an satu porsi soto bangkong berisi bihun irisan bawang ayam suwir dan bawang goreng dengan siraman kuah bening yang kaya bumbu rasanya gurih dan menyegarkan semarang kuliner
2022-10-29 09:31:01+00:00,inisangkara,review kuliner di solo itu terbanyak di google maps ku makanannya murah bumbunya nampol tapi suka herman aja
2022-10-29 09:30:53+00:00,De_Liput,2 leker paimo leker paimo adalah salah satu kuliner legendaris di semarang yang menyajikan beragam kue leker dengan isi yang bervariasi seperti cokelat susu putih keju manis telur sosis dan menu leker variasi lainnya semarang
2022-10-29 09:30:29+00:00,De_Liput,setiap hidangan dimasak satu persatu dalam wajan kecil sehingga kualitas dan rasa makanan tetap terjaga semarang kuliner semarang
2022-10-29 09:30:10+00:00,De_Liput,1 bakmi djowo rekomendasi kuliner semarang legendaris ini menyajikan olahan mi dan nasi goreng yang dimasak dengan peralatan tradisional yaitu tungku dari tanah liat dan arang sebagai sumber api kuliner semarang kulinersemarang
2022-10-29 09:29:36+00:00,De_Liput,lantas apa saja makanan khas yang termasuk khas semarang berikut daftar kuliner legendaris kota semarang semarang kuliner kulinersemarang
2022-10-29 09:29:04+00:00,De_Liput,semarang dikenal dengan banyak sekali ragam makanan bukan hanya lumpia saja lho semarang menyajikan berbagai kuliner lezat dan menarik untuk dicicipi mulai dari yang manis hingga gurih yang wajib kalian coba ketika berkeliling kota semarang semarang kuliner kulinersemarang
2022-10-29 09:28:28+00:00,De_Liput,10 kuliner legendaris kota semarang jika kalian berkunjung ke suatu tempat tak lengkap rasanya jika tidak mencoba makanan khasnya ya sama halnya dengan kalian saat mengunjungi semarang
2022-10-29 09:27:48+00:00,dianflorent,kuliner khas umr dibawah 2 juta
2022-10-29 09:27:08+00:00,De_Liput,melegenda ini 10 kuliner kota semarang yang wajib dicoba
2022-10-29 09:26:33+00:00,jounnhy,nah ini yang paling aku suka jjs bareng adik pertama pasti tujuan utamanya adalah berburu kuliner nyamnyam siap siap aja pu
2022-10-29 09:26:18+00:00,inisangkara,aku yang lahir sampe sma di solo mau kasih info kuliner solo orang solo atau kalau ada yang mau nambahin boleh banget
2022-10-29 09:25:27+00:00,imananda01,sumbangsih indonesia untuk dunia lewat kuliner
2022-10-29 09:25:16+00:00,inisangkara,memang murah murah banget makanan di solo mie ayam sebanyak ini es teh total 11rb kalian harus coba deh kalo ke solo gui
2022-10-29 09:23:06+00:00,ceraphim_,main aja ke galabo nnti banyak pilihan kuliner nya
2022-10-29 09:22:40+00:00,danassaputro,kuliner khas umr dibawah 2 juta
2022-10-29 09:21:28+00:00,FFOODFESS,fess coba rekomendasiin kuliner yg wajib banget dicoba kalau ke solo dong
2022-10-29 09:21:05+00:00,raniaaulfa,punya banyak list kuliner jakarta dr yg mainstream sampe yg hidden gem tp males ngetik alamatnya
2022-10-29 09:21:02+00:00,raniaaulfa,sebagai orang baru di jakarta drop rekomendasi kuliner di jakarta yg menurut kalian enak dong dari yang murah sampai
2022-10-29 09:19:05+00:00,yawaumaa,hari ini punya temen bahas doodle art gugel bahas susu uht bahas event luar kampus bahas konser bahas buku bahas tulisan bahas penyanyi ini itu bahas lagu ini itu bahas kuliner bahas krisis iklim bahas deep talk bahas konspirasi dan itu semuanya beda orang kan
2022-10-29 09:18:57+00:00,zaima_01,bismillah sambel mercon jando sapi kuliner bandung by guning tot jeletot tak endol endol maknyus bikin bibir jontor order
2022-10-29 09:17:13+00:00,beyubaystory,ada yang tahu apa saja kuliner khas pariaman berikut ini ulasannya
2022-10-29 09:15:10+00:00,BumbelFess,bf malam ini ada yang mau ke festival kuliner serpong tangerang area yuk yang mau aja siapa tau lanjut keliling motoran m2m
2022-10-29 09:15:01+00:00,menfesspelangi_,piw malam ini ada yang mau ke festival kuliner serpong tangerang area yuk yang mau aja siapa tau lanjut keliling motoran m2m
2022-10-29 09:12:51+00:00,GenGaruda45,mau cari rekomendasi kuliner di twitter bisa cek di
2022-10-29 09:12:16+00:00,tribunjogja,tempe kemul kuliner khas wonosobo sudah ditetapkan sebagai warisan budaya tak benda
2022-10-29 09:11:31+00:00,makasipos,teruntuk sobat makasi yang tertarik memulai usaha makanan kekinian ada baiknya intip dulu trennya lewat ulasan berikut ini setidaknya nama nama bisnis kuliner ini cukup menjanjikan untuk sobat jadikan usaha makasipos aplikasikasir sahabatumkm umkmindonesia selaludekatumkm
2022-10-29 09:09:00+00:00,hmzhh_mn,selama pengalaman gue ngerantau dan traveling ke berbagai kota di indonesia soal kuliner jakarta still da best
2022-10-29 09:08:46+00:00,danifahriaaal,klo kd makan somay ke kuliner baiman tu mpat kah
2022-10-29 09:05:37+00:00,detikfood,murah banget jajan nasi pecel dan es teler rp 3 500 di pasar bangilan tuban
2022-10-29 09:05:35+00:00,diantaratitik,barangkali nanti bisa dicari jalan tengahnya apalagi kalo usahanya kuliner kalo ada 100 orang kritik dan 10 orang yg muji ya ada baiknya kita dengerin kritik dari 100 orang itu toh biar penjualannya juga baik kan
2022-10-29 09:01:46+00:00,ooh_bihunn,cocok juga shel bawain acara icip2 kuliner kayak ginii
2022-10-29 09:01:00+00:00,vickyfarhan95,glad im not into music festival lebih seneng ke festival jajanan kuliner kayak hari ini semoga eo dari festival musiknya bisa berbenah juga ya
2022-10-29 09:00:55+00:00,DwiAnggaF,terima kasih saya ucapkan kepada yang telah memberikan sponsor untuk wisata kuliner hari ini saiki aku mukokk kewareken cuk
2022-10-29 09:00:28+00:00,ViNNismyname,cocok juga shel bawain acara icip2 kuliner kayak ginii
2022-10-29 09:00:20+00:00,FaizalOktaW,tadi nonton acara review kuliner di singapura setiap akhir sesi ada petunjuk untuk ke lokasi pake angkutan umum kira kira kalau surabaya bisa bikin acara konten kayak gini juga gak ya min
2022-10-29 09:00:06+00:00,Genpi_Co,malang terkenal dengan kuliner baksonya salah satunya bakso bakar trowulan yang memiliki cita rasa khas sekali mencoba dijamin ketagihan baksobakar
2022-10-29 08:59:42+00:00,romsvae,nah ini yang paling aku suka jjs bareng adik pertama pasti tujuan utamanya adalah berburu kuliner nyamnyam siap siap aja pulang ke rumah dimarahin ambu karena ga bantuin ngabisin masakannya
2022-10-29 08:58:31+00:00,keluarga_cmr,capek kerja memupuk kekayaan itu buat siapa sih makin ke sini makin ga jelas waktunya kuliner sore dari kota jauh nih cari temen siapa ya
2022-10-29 08:57:03+00:00,gagitugie___,cocok juga shel bawain acara icip2 kuliner kayak ginii
2022-10-29 08:56:35+00:00,hyakaze,jogja emg bener gudang kuliner apa gimana dah menggoda bener makanannya
2022-10-29 08:55:17+00:00,bunyday,sebagai orang baru di jakarta drop rekomendasi kuliner di jakarta yg menurut kalian enak dong dari yang murah sampai
2022-10-29 08:52:46+00:00,coscgo,mamah tuh kalo ngasih uang sesuai porsinya cuma kalo soal wisata kuliner dia selalu gas terus mau berapapun harganya
2022-10-29 08:51:25+00:00,nita_andrianiii,kuliner khas umr dibawah 2 juta
2022-10-29 08:49:42+00:00,HaffyHapz,kuliner khas umr dibawah 2 juta
2022-10-29 08:49:24+00:00,escobranyusss,top story 5 kafe matcha hits ada tart dan scone matcha yang juara enaknya see more
2022-10-29 08:48:59+00:00,JoeBali5,kuliner dulu
2022-10-29 08:48:05+00:00,rara_adina,kuliner khas umr dibawah 2 juta
2022-10-29 08:47:36+00:00,detik_jateng,jadi tema google doodle tempe ternyata dari tembayat klaten
2022-10-29 08:47:21+00:00,fahriajaoke,cocok juga shel bawain acara icip2 kuliner kayak ginii
2022-10-29 08:46:12+00:00,KopBam,kalo dasarnya potensi merugikan tunjukin aja di kalimat yang mana dari twit yang mana biar keluhan kalian berstandar soal narasi dan reaksi ya dibedakanlah twit kuliner aja bisa dikomentarin jahat
2022-10-29 08:45:58+00:00,rainofmercyy,kuliner khas umr dibawah 2 juta
2022-10-29 08:42:40+00:00,aceruuuuuu,cocok juga shel bawain acara icip2 kuliner kayak ginii
2022-10-29 08:42:33+00:00,hendrifisnaeni,tahu adalah kuliner tertua yang diperkenalkan orang tionghoa di nusantara ia menjadi penyelamat masyarakat jawa di masa k
2022-10-29 08:42:15+00:00,Asabiqulhimam,uda ngefollow akun akun kuliner jogja mau kucobain satu satu
2022-10-29 08:41:06+00:00,almaududi92,sebagai orang baru di jakarta drop rekomendasi kuliner di jakarta yg menurut kalian enak dong dari yang murah sampai
2022-10-29 08:39:52+00:00,chikybal,wisata kuliner
2022-10-29 08:39:14+00:00,berlianmedia1,siapa bilang menu khas daerah tak bisa tembus pasar mancanegara sate ambal khas kabupaten kebumen jawa tengah salah satunya kuliner lokal ini berhasil menembus pasar luar negeri bahkan semakin dikenal seusai ikut progam lapak ganjar
2022-10-29 08:38:24+00:00,HeyDetya,kuliner khas umr dibawah 2 juta
2022-10-29 08:37:19+00:00,helloitisme66,kuliner khas umr dibawah 2 juta
2022-10-29 08:36:15+00:00,faisal76787,mau cari rekomendasi kuliner di twitter bisa cek di
2022-10-29 08:35:18+00:00,infojogja,kuliner khas umr dibawah 2 juta
2022-10-29 08:30:56+00:00,detikcom,sebentar lagi program kuliner food affair with mark wiens akan tayang nih detikers banyak pengalaman seru saat proses syuting program kuliner di singapura ini lho
2022-10-29 08:27:41+00:00,rrecent22,sebagai orang baru di jakarta drop rekomendasi kuliner di jakarta yg menurut kalian enak dong dari yang murah sampai
2022-10-29 08:26:47+00:00,detikcom,detikers tahu nggak sih kuliner legendaris di blitar ini namanya warung martumi beroperasi sejak 1960 dari dapur tradisionalnya tersaji lodeh tewel dan ayam lodeh hangat hangat yummy
2022-10-29 08:26:07+00:00,perih_atin,sebuah catatan kuliner selama berada di ibu kota kita mencoba mencicipi segala kuliner disini dan ya tipis mereview
2022-10-29 08:26:01+00:00,Madura_tv,bangkalan juara terbaik dalam festival kuliner makanan khas jawa timur
2022-10-29 08:25:35+00:00,detikcom,eksis sejak tahun 1925 restoran eka ria di daerah gambir jakarta pusat kini masih menjadi tempat makan favorit yang sajikan hidangan kanton autentik
2022-10-29 08:24:11+00:00,PadjadjaranTea,bismillah sambel mercon jando sapi kuliner bandung by guning tot jeletot tak endol endol maknyus bikin bibir jontor order
2022-10-29 08:21:45+00:00,arieparikesit,yang di bandung yuk ngariung besok 08 0 10 00 sherlock nya kang jalan riau yah lanjut 10 00 12 00 rama ramen nya kang dan ngubek kuliner pasar cihapit theaaaa diantosan sadayanan hanupeace sateuacanna
