created_at,author,cleaned_tweet
2022-10-30 16:01:25+00:00,parkhajiftp,riquelme bukan pemain tercepat bukan pula paling berprestasi tapi sepak bola yg dia hadirkan begitu indah untuk dinikm
2022-10-30 16:01:13+00:00,YHermala,jangan lupa datang dan saksikan festivallampionterbang lampionterbang di pantai parangtritis nlfest lfedeparis
2022-10-30 16:00:59+00:00,Madridfansss02,riquelme bukan pemain tercepat bukan pula paling berprestasi tapi sepak bola yg dia hadirkan begitu indah untuk dinikm
2022-10-30 16:00:52+00:00,passutricom,ngapain ke pantai sendirian biasalah cuci mata mumpung suami nggak dirumah
2022-10-30 16:00:16+00:00,detik_jatim,peritual lawu dicari di sumur jolotundo yang konon tembus pantai selatan
2022-10-30 15:59:55+00:00,tomkodz,riquelme bukan pemain tercepat bukan pula paling berprestasi tapi sepak bola yg dia hadirkan begitu indah untuk dinikm
2022-10-30 15:59:29+00:00,Barataabagas,riquelme bukan pemain tercepat bukan pula paling berprestasi tapi sepak bola yg dia hadirkan begitu indah untuk dinikm
2022-10-30 15:58:36+00:00,theoreticallie,itachi kisame dan sosori sedang meikmati semilir angin pantai dengan irama myuzik khas pesisir
2022-10-30 15:56:33+00:00,gondessanfor,riquelme bukan pemain tercepat bukan pula paling berprestasi tapi sepak bola yg dia hadirkan begitu indah untuk dinikm
2022-10-30 15:56:27+00:00,wallflwrx,just in pkr has announced more of its ge15 parliamentary candidates anwar ibrahim tambun wan azizah bandar tun razak
2022-10-30 15:56:26+00:00,Lzoxpo,akhirnya malam mingguan di tepi pantai sama ayang terlaksana
2022-10-30 15:56:07+00:00,mambagirlbby,satu setengah jam lebih mungkin gw berdiri dipinggir pantai diatas karang nangis ga perduliin orang2 sekitar
2022-10-30 15:55:35+00:00,Daselvaaaa,di komunitas olahraga yg gue ikutin ini ada pasutri yang umur pernikahannya dh lma dan pas mau ngestalk ig komunitas ada akun ibu ini and i decided to stalk her sumpah romantis bangett mashallah dan up to date skali postingannya suka jalan2 ke pantai gnung together
2022-10-30 15:55:01+00:00,epat86_,boleh jom ikut aku kat kuantan nanti kita makan sambil lepak kat pantai
2022-10-30 15:54:39+00:00,bayu8drmwn,riquelme bukan pemain tercepat bukan pula paling berprestasi tapi sepak bola yg dia hadirkan begitu indah untuk dinikm
2022-10-30 15:54:17+00:00,gatauakumales,hmmmmmch beli saja kali yh karena kan ya gapapa pen aja beli mwehehhehehehe kalo ke pantai lagi kan atau keluar kota sama temen temen lagi kan lucu gemash oake baju itu
2022-10-30 15:53:50+00:00,cuitanskipper,riquelme bukan pemain tercepat bukan pula paling berprestasi tapi sepak bola yg dia hadirkan begitu indah untuk dinikm
2022-10-30 15:53:05+00:00,daus_grunje,medan selera mpkl pantai batu laut kuala langat telah dinobatkan sebagai johan kategori a medan selera di bawah pbt ag
2022-10-30 15:52:45+00:00,racvntikvs,rak ngono cah sg ng pantai anggone oitfit gaul tibake seko kota sebelah mas banyakan dari mereka datengnya ke pantai yg udah jadi kafe bukan yg masih warungan biasa aku ng pantai ya sering mau sendiri mau ada temennyaaaa
2022-10-30 15:52:39+00:00,Hanafi507,yang susah buat move on dr solo akses transportasi lengkap spot makanan banyak dan pasti enak akses ke tempat wisata alam terhitung dekat mau gunung atau pantai infrastruktur lebih tertata jauh lbh tertata drpd daerah sekeliling dki bahkan
2022-10-30 15:52:28+00:00,bloddymarry7,mantai malem enak jg yh agk candu soalnya melamun didekat pantai semoga sj aman yh
2022-10-30 15:52:18+00:00,inibukujiwa,bestseller pesta buku pantai timur top 5 buku 1 fainni qarib 2 buya hamka berbicara tentang perempuan
2022-10-30 15:51:56+00:00,satiregramjules,loh kok sama aku ke pantai dikit pas brenang paling jarak 5 6 meter dr tepi pantai udah was was duluan takut ada hiu yg siap hap diriku
2022-10-30 15:51:35+00:00,kounkireia,pantai ntar hanyut dekorasinya kan lucu yh
2022-10-30 15:51:30+00:00,insolent_human,nu pkb pantai selatan
2022-10-30 15:51:10+00:00,anggunpsptaaaa1,aku rela lari di pantai sambil bawa produk whitelab di siang hari di tengah panas terik nya matahari labuan bajo buat ketemu sehun whitelabxsehun scientistganteng whitelab whitelabid
2022-10-30 15:51:00+00:00,ernawidiyaina,ku tengok pantai ni sampai abis leher aku noleh pas dijalan
2022-10-30 15:50:25+00:00,W2Amanda,ke pantai sma ayank
2022-10-30 15:45:28+00:00,alunberingin,riquelme bukan pemain tercepat bukan pula paling berprestasi tapi sepak bola yg dia hadirkan begitu indah untuk dinikm
2022-10-30 15:44:32+00:00,Koi1802,masih ingat dengan 942 project itu lho upaya pengendalian dampak musim hujan pengamanan pantai dan pengelolaan air dgn
2022-10-30 15:43:57+00:00,andijojo72,pantai yuk
2022-10-30 15:43:53+00:00,wiksszz,saya perlukan masa untuk berbual depan pantai lgiiiiiiii nk bincangggg bnyk hal lgi
2022-10-30 15:43:42+00:00,Le00Leo,indonesia adalah negara maritim terbesar di dunia dengan perairan seluas 93 ribu km2 dan panjang pantai sekitar 81 ribu km2 atau hampir 25 panjang pantai di dunia
2022-10-30 15:43:40+00:00,FatenSyaheera,jalan baru laluan untuk basikal kat pantai batu buruk sedak ah lepas ning ride gi pata muto sohbeng wak bolok lalu ikut
2022-10-30 15:42:16+00:00,Risdanurwidia,kangen joging di pinggir pantai
2022-10-30 15:42:08+00:00,mendingturuneh,kadang ono mas tapi bocah seko kandeman tulis dll kadang yo cah punk sing mlipir pantai nek sing seko batang kota raono tah outfite do stylish kabeh ogh wkwkwk
2022-10-30 15:41:25+00:00,neatieqaamd,ni sebab baru lepas tengok ji chang wok gi pantai dokleh deki nok gok gi biar dalam gallery pon hahahhahahahahaha
2022-10-30 15:40:39+00:00,dioisme,gue seumur belom pernah ke pantai ancol
2022-10-30 15:40:36+00:00,baliexpressnews,pengerjaan penataan pantai seminyak legian dan kuta samigita terus berproses khusus di pantai kuta kini telah didatangkan beberapa patung yang akan menghiasi pantai tersebut
2022-10-30 15:40:17+00:00,ErasPtg,riquelme bukan pemain tercepat bukan pula paling berprestasi tapi sepak bola yg dia hadirkan begitu indah untuk dinikm
2022-10-30 15:40:01+00:00,bayu_maz,riquelme bukan pemain tercepat bukan pula paling berprestasi tapi sepak bola yg dia hadirkan begitu indah untuk dinikm
2022-10-30 15:39:10+00:00,Hidethosie89,woi lu pada tau gak ini penampakan pertama pantai tanjung kemirai jauh beda kan ma sekarang
2022-10-30 15:36:40+00:00,SutinWiwik,pantai asmara neng
2022-10-30 15:36:27+00:00,hybby___,ini ayang dan cabat2 aku waktu kemaren kita sok ngide bbq dadakan di pantai berkah banget punya mereka yg tiap diajak meskipun dadakan selalu bilang hayuk gas
2022-10-30 15:36:25+00:00,kaptenupil,riquelme bukan pemain tercepat bukan pula paling berprestasi tapi sepak bola yg dia hadirkan begitu indah untuk dinikm
2022-10-30 15:36:16+00:00,a__o___l,bulan 11mi lusa dan sudiang belum jadi kabupaten btp belum jadi kota madya antang belum terisolasi hertasning sedkkit
2022-10-30 15:35:26+00:00,ariefhid13,riquelme bukan pemain tercepat bukan pula paling berprestasi tapi sepak bola yg dia hadirkan begitu indah untuk dinikm
2022-10-30 15:35:10+00:00,funiculie,tmi tadi pagi aku abis nyeruput milo sambil liatin ombak pantai
2022-10-30 15:34:36+00:00,imam_wicaksono,riquelme bukan pemain tercepat bukan pula paling berprestasi tapi sepak bola yg dia hadirkan begitu indah untuk dinikm
2022-10-30 15:33:07+00:00,AndrianDA15,riquelme bukan pemain tercepat bukan pula paling berprestasi tapi sepak bola yg dia hadirkan begitu indah untuk dinikm
2022-10-30 15:32:35+00:00,adniluya,cakep banget pantai mana ini
2022-10-30 15:30:59+00:00,ky00tt,couldnt believe esok nak pergi kedah dah tak pernah study jauh jauh diploma pon kat shah alam je tiba tiba ni jauh lepastu utara pulak tu kita ni paling jauh pon pantai timur jah so lepasni milo ice amp milo beng jadi ayaq milo la ni jkjk
2022-10-30 15:30:45+00:00,Faizhidar,aku paham ketika berbagi cerita dengan mereka saudariku disini mereka belajar dari kebodohannya masing sepertinya lucu namun jika moment saat itu ia rasakan mungkin sakit begitu pula kehidupan dijalaninya tak perlu serius karena pasir pantai lambat laut surut dan tenggelam
2022-10-30 15:30:10+00:00,nftsvauxrlt,pemasangan gerobak di sepanjang pantai kuta yang terbuat dari kayu ulin kini menuai protes pedagang pantai kuta apa penyebab
2022-10-30 15:29:24+00:00,climax_ao,gak cuman gunung yang mau ke pantai air terjun atau city tour juga bisa sini kami temenin harga bersahabat langsung aja hubungi cp kami
2022-10-30 15:28:52+00:00,Regdenef,riquelme bukan pemain tercepat bukan pula paling berprestasi tapi sepak bola yg dia hadirkan begitu indah untuk dinikm
2022-10-30 15:28:47+00:00,aizattazia,selalu homestay ada kolam je ni siap ada pantai boleh memuatkan 26 orang dengan 5 bilik tidur tts beach village seme
2022-10-30 15:28:08+00:00,nisssyaa,minggu citorek negeri di atas awan bayah pantai sawarna pantai tanjung layar pantai bagedur senin malingping pantai bagedur kejadian hp ilang rabu malingping rangkas tigaraksa gaada capenya bukan cape but alhamdulillah gakerasa
2022-10-30 15:28:02+00:00,qnaethiopia,doa laut yg mencium pantai kece bgt
2022-10-30 15:27:34+00:00,ldnprdn,riquelme bukan pemain tercepat bukan pula paling berprestasi tapi sepak bola yg dia hadirkan begitu indah untuk dinikm
2022-10-30 15:27:19+00:00,A_zheen48,pantai sarang
2022-10-30 15:27:03+00:00,haiyay_ay,1 liburan ke pantai
2022-10-30 15:25:49+00:00,Siipelupa1,riquelme bukan pemain tercepat bukan pula paling berprestasi tapi sepak bola yg dia hadirkan begitu indah untuk dinikm
2022-10-30 15:25:24+00:00,Arta_Heathent,kamu itu kayak suasana pantai dan gunung yang bikin sejuk dan lupa tentang apa itu kesedihan dan juga bikin kangen kalo udah sampe rumah
2022-10-30 15:25:05+00:00,azmeinaizam,salah tu hotel menarik di penang pool dia nice teruk nak mandi pantai pun boleh sebab pantai depan tu jer lepas mandi p
2022-10-30 15:23:59+00:00,dikyock,riquelme bukan pemain tercepat bukan pula paling berprestasi tapi sepak bola yg dia hadirkan begitu indah untuk dinikm
2022-10-30 15:23:56+00:00,dseazes,iya disini masih ada pantai yg blm terjamah manusia wkwkwkkw ayoo ke pantai healing wkwkwkw
2022-10-30 15:22:14+00:00,Narongbiru,ibarat buih buih di tepian pantai
2022-10-30 15:22:06+00:00,hodophilenaz,gak lebih suka renang di pantai pulau
2022-10-30 15:21:51+00:00,merahmekya,double tree by hilton pun best secluded beach tak ramai orang cuma dari hotel nak ke pantai tu kena guna jejantas kecik
2022-10-30 15:20:52+00:00,anberil_iderus,riquelme bukan pemain tercepat bukan pula paling berprestasi tapi sepak bola yg dia hadirkan begitu indah untuk dinikm
2022-10-30 15:19:57+00:00,nikzulhilmi,naib presiden bersatu datuk mohd rafiq naizamohideen mengumumkan keluar parti berkuat kuasa serta merta hari ini pen
2022-10-30 15:19:34+00:00,detikcom,pemasangan gerobak di sepanjang pantai kuta yang terbuat dari kayu ulin kini menuai protes pedagang pantai kuta apa penyebabnya
2022-10-30 15:19:01+00:00,eddydaud,naib presiden bersatu datuk mohd rafiq naizamohideen mengumumkan keluar parti berkuat kuasa serta merta hari ini pen
2022-10-30 15:17:52+00:00,racheat,pengen cari tempat yg sepi tapi ga bikin kesepian ga suka keramaian tapi ga punya banyak waktu buat liburan lama nih bisa
2022-10-30 15:16:31+00:00,kntlsadness,teras pantai nder daerah unp jalan belibis di ujuang bana trus masuk smpang
2022-10-30 15:15:53+00:00,Poyoh01,klo sy gk punya om mikroskop malah sebaliknya teleskop buat bintang kalo pas ke daerah pelosok amp pantai yg jauh dr pemukiman beuh mantep om
2022-10-30 15:15:52+00:00,ojonyerah,riquelme bukan pemain tercepat bukan pula paling berprestasi tapi sepak bola yg dia hadirkan begitu indah untuk dinikm
2022-10-30 15:14:20+00:00,FerdoPuja,iya soalnya beberapa scene emang pake foto real live sama kaya di anime my dress up darling yang episode pantai
2022-10-30 15:13:55+00:00,nisssyaa,touring oktober yg bikin tangan belang jd pengacara kamis tigaraksa jakarta selatan kajian aeon gbk senayan park jumat tigaraksa malingping pantai pasir putih mlp sabtu malingping bayah pantai sawarna lupa nama pantainya cikotok citorek
2022-10-30 15:13:54+00:00,HRMalik12,tahan dulu boss kebutuhan gas ue telah menjadi objek permainan para spekulan kapal lng menunggu harga ue naik lebih t
2022-10-30 15:13:39+00:00,ionkarbon,laut begitu indah dengan deburan ombak yang menyatu dengan angin aku berdiri di sisi pantai menikmati suasana yang begitu damai
2022-10-30 15:13:21+00:00,sigid_b,sampaii di kota toraja pantai losari pisang epekkk bagso ati raja pusang nugget coto gagak konro bakarr nyamiiiiiii nyamiiii hmm ihiyyy
2022-10-30 15:13:19+00:00,riidonn_,riquelme bukan pemain tercepat bukan pula paling berprestasi tapi sepak bola yg dia hadirkan begitu indah untuk dinikm
2022-10-30 15:12:07+00:00,ArianaAbascal1,flash sale wizi topi olahraga topi pantai wanita topi matahari sports hat diskon 38 checkout sekarang
2022-10-30 15:12:01+00:00,putridewia_a,flash sale wizi topi olahraga topi pantai wanita topi matahari sports hat diskon 38 checkout sekarang
2022-10-30 15:11:06+00:00,vanilamilktea,wkwkw pas bgt video asli konsonan langit jg di pantai airi yg jadi mc nya
2022-10-30 15:10:40+00:00,rafisimin,riquelme bukan pemain tercepat bukan pula paling berprestasi tapi sepak bola yg dia hadirkan begitu indah untuk dinikm
2022-10-30 15:10:25+00:00,virusbentukhati,hp mati karena kena air msh bisa dibenerin gk sih emak gw ke bibir pantai pake tas isi 2 hp kedorong temennya jatoh trs kena ombak
2022-10-30 15:08:40+00:00,khongnicoo,ketika aku sampai di negeri antah berantah yang tak tahu akan arah hanya bintang dan matahari sebagai teman perjalanan hingga ku tak resah dan goyah ku menikmati hembusan nafas alami dan mendengarkan laut bercerita cerita pantai dan karang yang menungguku di akhir dari kelana
2022-10-30 15:08:04+00:00,jejenugas,mirip kopi pagi eh daerah pantai unp pokoknya
2022-10-30 15:07:38+00:00,HilmanKaizen,jalan baru laluan untuk basikal kat pantai batu buruk sedak ah lepas ning ride gi pata muto sohbeng wak bolok lalu ikut
2022-10-30 15:07:04+00:00,racvntikvs,ah ora bro sg ng kono anggone kaos racing koncoku nk do ng pantai macake rak koiki
2022-10-30 15:07:04+00:00,silwiixx,topi nya kek topi pantai masa luffy
2022-10-30 15:06:56+00:00,sipalingsetia_,pke pasir pantai selatan
2022-10-30 15:06:44+00:00,TonyBcastello,naib presiden bersatu datuk mohd rafiq naizamohideen mengumumkan keluar parti berkuat kuasa serta merta hari ini pen
2022-10-30 15:06:40+00:00,TNSajidahh,jalan baru laluan untuk basikal kat pantai batu buruk sedak ah lepas ning ride gi pata muto sohbeng wak bolok lalu ikut
2022-10-30 15:06:14+00:00,nisssyaa,walaupun ada musibah hp temen kebawa ombak pas di pantai tp diganti sama yg lebih bagus 3x lipat
2022-10-30 15:05:58+00:00,nonmolare,riquelme bukan pemain tercepat bukan pula paling berprestasi tapi sepak bola yg dia hadirkan begitu indah untuk dinikm
2022-10-30 15:05:49+00:00,minipaocoklat,anak pantai banget memang aquaman belio ini love you bapak sayang
2022-10-30 15:05:48+00:00,daisyavcdo,ndi ndiii kek e aku terakhir hiling pas ng pantai iku deh
2022-10-30 15:05:45+00:00,fatih_annisa,iya bener aku ke jakarta kaget mall nya gede gede bangetttt sedangkan orang jakarta tereak tereak pas
2022-10-30 15:05:33+00:00,RameshRaoAKS,
2022-10-30 15:05:23+00:00,itunamasayaa,sandal pantai wanita import sandal pita bow beach soft empuk lentur beli disini
2022-10-30 15:05:06+00:00,andrwtd,riquelme bukan pemain tercepat bukan pula paling berprestasi tapi sepak bola yg dia hadirkan begitu indah untuk dinikm
2022-10-30 15:04:59+00:00,AqilaRasid,airbnb yang ada private beach amp swimming pool di semenyih jomkita rare gila ada pantai wehhh tak boleh brain lokasi
2022-10-30 15:04:48+00:00,RameshRaoAKS,
2022-10-30 15:03:11+00:00,biewaditya,ini coba nge zoom in di maps sekitar pantai gunung kidul ketemu drini hills
2022-10-30 15:02:39+00:00,suryabhq,yang bagus pantai mana mbaa wkwkw
2022-10-30 15:02:03+00:00,keppeen,jalan baru laluan untuk basikal kat pantai batu buruk sedak ah lepas ning ride gi pata muto sohbeng wak bolok lalu ikut
2022-10-30 15:01:59+00:00,wafiyzulkarnain,salah tu hotel menarik di penang pool dia nice teruk nak mandi pantai pun boleh sebab pantai depan tu jer lepas mandi p
2022-10-30 15:01:54+00:00,teLot,riquelme bukan pemain tercepat bukan pula paling berprestasi tapi sepak bola yg dia hadirkan begitu indah untuk dinikm
2022-10-30 15:01:09+00:00,nuzulisme,riquelme bukan pemain tercepat bukan pula paling berprestasi tapi sepak bola yg dia hadirkan begitu indah untuk dinikm
2022-10-30 15:00:24+00:00,apizot,salah tu hotel menarik di penang pool dia nice teruk nak mandi pantai pun boleh sebab pantai depan tu jer lepas mandi p
2022-10-30 14:59:24+00:00,sefianggoro,riquelme bukan pemain tercepat bukan pula paling berprestasi tapi sepak bola yg dia hadirkan begitu indah untuk dinikm
2022-10-30 14:59:08+00:00,hanamochi89,salah tu hotel menarik di penang pool dia nice teruk nak mandi pantai pun boleh sebab pantai depan tu jer lepas mandi p
2022-10-30 14:59:00+00:00,gery_nasan,riquelme bukan pemain tercepat bukan pula paling berprestasi tapi sepak bola yg dia hadirkan begitu indah untuk dinikm
2022-10-30 14:58:34+00:00,Artly06607615,kereen pas moment ny kk btw turun ny kk dri pantai padang ny langsung atau dri le cliff
2022-10-30 14:58:28+00:00,tautaumuncul,bibir pantai pernah pecah pecah ngga ya
2022-10-30 14:58:03+00:00,geisharas,aku udah curiga sih kamu hamil pas kamu kirim undangan pernikahan yang kamu adain di pantai selatan itu kata aku sih ya langganan aja bayinya biar gak balik ke gratisan lagi siapa nama anak kamu mpok
2022-10-30 14:57:29+00:00,ainulsyafiqahhh,selalu homestay ada kolam je ni siap ada pantai boleh memuatkan 26 orang dengan 5 bilik tidur tts beach village seme
2022-10-30 14:57:03+00:00,Aizat_azam,kena try di kelantan or ganu baru betul selesa sgt kt pantai barat
2022-10-30 14:57:01+00:00,biewaditya,hmm misalkan pantainya di daerah gunung kidul kebanyakan homestay kalo hotel yang deket ada di daerah wonosari dari wonosari ke pantai gunung kidul sekitar 15 km
2022-10-30 14:54:56+00:00,syakirshukri,jalan baru laluan untuk basikal kat pantai batu buruk sedak ah lepas ning ride gi pata muto sohbeng wak bolok lalu ikut
2022-10-30 14:54:54+00:00,lahanatasha,spoil moment nk sendu tepi pantai sorang2
2022-10-30 14:54:38+00:00,DaengKayo89,masih ingat dengan 942 project itu lho upaya pengendalian dampak musim hujan pengamanan pantai dan pengelolaan air dgn
2022-10-30 14:53:55+00:00,THVlNG,di sini untuk menawarkan les private cara menghitung pasir di pantai
2022-10-30 14:52:50+00:00,NajmiHaziqHanis,jalan baru laluan untuk basikal kat pantai batu buruk sedak ah lepas ning ride gi pata muto sohbeng wak bolok lalu ikut
2022-10-30 14:52:34+00:00,Ieanavvab,merasa aneh tapi harus pede karena unik itu keren jadi km harus coba ke pantai pakai kebaya
2022-10-30 14:52:31+00:00,diditdipta,riquelme bukan pemain tercepat bukan pula paling berprestasi tapi sepak bola yg dia hadirkan begitu indah untuk dinikm
2022-10-30 14:51:52+00:00,harrishaizat,salah tu hotel menarik di penang pool dia nice teruk nak mandi pantai pun boleh sebab pantai depan tu jer lepas mandi p
2022-10-30 14:51:32+00:00,abadikinicom,gubernur abdul gani kasuba meninjau lokasi sail tidore 2022 di kawasan pantai tugulufa
2022-10-30 14:51:05+00:00,toystoryaja,spill nama pantai nya
2022-10-30 14:50:57+00:00,angiliakusumo,aku pernah nginap di hotel queen ini 5 tahun yang lalu view oke tapi kalo mau mantai kurang oke karena pantai terdekatnya pantai parangtritis
2022-10-30 14:50:44+00:00,Betoktso,riquelme bukan pemain tercepat bukan pula paling berprestasi tapi sepak bola yg dia hadirkan begitu indah untuk dinikm
2022-10-30 14:50:32+00:00,seutaslara,ada ya orang dikasih angst tapi terhibur ya ada sih kalya namanya iya ini aku kasih daripada di block p aku sukanya outdoor tepi pantai
2022-10-30 14:49:29+00:00,lanunatuna,kawan ke pantai naik sepeda masuk berempat membayar karcis urusan partai boleh berbeda jangan lupa 2024 pilih bang anies
2022-10-30 14:48:11+00:00,malon90,memulih dan mencergaskan pertumbuhan ekonomi domestik fokus 2 infrastruktur dan utiliti 1 pembangunan dan pengurusan si
2022-10-30 14:47:55+00:00,nothappypeople1,jadi sebenernya kamu ngerasa vibes pantai atau emg lagi kangen kepantai malam si
2022-10-30 14:47:19+00:00,nothappypeople1,kalo udah hujan di tengah malem nih vibes nya tuh kangen bgt sama pantai
2022-10-30 14:47:15+00:00,winpotan17,riquelme bukan pemain tercepat bukan pula paling berprestasi tapi sepak bola yg dia hadirkan begitu indah untuk dinikm
2022-10-30 14:47:05+00:00,Bimosaurs,pantai timur mermaid hideaway
2022-10-30 14:46:48+00:00,Liamyeon1,itu myra yg wood sage dia tuh oceanic aquatic spices woody kalo digambarin tuh kaya kamu lagi main air di pantai siang hari jadi kerasa ada asinnya dari air laut trus seger karna main air dan warm karna lagi siang hari
2022-10-30 14:46:30+00:00,ocalynnn,pantai kalau malem vibes nyaaa cantikk bgttt yaa
2022-10-30 14:46:21+00:00,hrkurnianto,riquelme bukan pemain tercepat bukan pula paling berprestasi tapi sepak bola yg dia hadirkan begitu indah untuk dinikm
2022-10-30 14:46:19+00:00,ambiz_yoo,28 oktober 2022 dia jemput aku di kosan buat ke pantai losari abis itu kt jalan jalan naik motor trs main balon2 sama mainan lainnya baru makan jagung bakar karna aku udh bm dari lama happy bgt
2022-10-30 14:46:17+00:00,greedizgoodz,saya pantai boss pantai klang kpj klang saya tktau boss
2022-10-30 14:46:05+00:00,x2uptohigh,260 ia duduk di cafe tepat pinggir gang menuju penginapan berhadapan langsung dengan pantai di seberang jalan menurut penuturan penjaga penginapan hanin kerap pergi dari siang hingga malam hanya duduk diam di pantai sana
2022-10-30 14:45:58+00:00,Panwaslihajay,panwaslih kabupaten aceh jaya melaksanakan bimtek dan pembekalan kepada anggota panwascam se kabupaten aceh jaya di hotel pantai barat calang kabupaten aceh jaya dilaksanakan 30 31 oktober 2022
2022-10-30 14:45:39+00:00,atharienn,mjb kak tapi bukannya negara dengan garis pantai terpanjang di dunia itu kanada ya
2022-10-30 14:44:32+00:00,nang_24,riquelme bukan pemain tercepat bukan pula paling berprestasi tapi sepak bola yg dia hadirkan begitu indah untuk dinikm
2022-10-30 14:43:29+00:00,oohkenni,bismillahirohmanirohim aku rela jadi jodohnya sehun demi dapetin golden ticket untuk meet amp greet sama sehun dan ini ada foto kita berdua waktu lagi jalan2 di pantai lucu bgt kan maksa bgt ya hahaha whitelabxsehun scientistganteng
2022-10-30 14:43:20+00:00,RickyGalingging,riquelme bukan pemain tercepat bukan pula paling berprestasi tapi sepak bola yg dia hadirkan begitu indah untuk dinikm
2022-10-30 14:43:12+00:00,Ambun321,oo dari hasil menguras apbd dki selama 5 tahun hasil menjual puluhan ribu imb pantai reklamasi dari hasil menjual 191 pohon trembesi yang dicukur anis ya dana csr selama 5 tahun dan dari hasil kelebihan bayar ya
2022-10-30 14:41:45+00:00,dianatfandi,atau aku harus lari ke hutan belok ke pantai
2022-10-30 14:41:09+00:00,hppiestwomen,pantai siung gunung kidul
2022-10-30 14:40:43+00:00,johncm07,riquelme bukan pemain tercepat bukan pula paling berprestasi tapi sepak bola yg dia hadirkan begitu indah untuk dinikm
2022-10-30 14:39:28+00:00,okjelidrink,ini fotonya natan banyak bgt aplgi yg candid dr sie dokumentasi di pantai kmrin dia tuh emg seattractive itukah dia pasti banyak yg naksir
2022-10-30 14:38:17+00:00,Neberhaik,jalan baru laluan untuk basikal kat pantai batu buruk sedak ah lepas ning ride gi pata muto sohbeng wak bolok lalu ikut
2022-10-30 14:38:11+00:00,LP_PermisanNK,cilacap keindahan pesona pantai permisan nusakambangan merupakan daya tarik tersendiri dengan berbagai cerita dibalik misterinya yang merupakan wilayah bagian yang tak terpisahkan dari lapas kelas iia permisan nusakambangan minggu 30 10 2022
2022-10-30 14:38:07+00:00,synrenn,info pantai di mlg tp ada tawannya
2022-10-30 14:37:39+00:00,scrome78,
2022-10-30 14:37:33+00:00,rickyfererra,riquelme bukan pemain tercepat bukan pula paling berprestasi tapi sepak bola yg dia hadirkan begitu indah untuk dinikm
2022-10-30 14:37:16+00:00,fahramonicaa,benci fuschia benci polkadot benci pantai benci diri sendiri sih
2022-10-30 14:37:06+00:00,zenbhi,riquelme bukan pemain tercepat bukan pula paling berprestasi tapi sepak bola yg dia hadirkan begitu indah untuk dinikm
2022-10-30 14:36:43+00:00,FarhanMartin16,kasar kata ada makan di pantai dan poli kan beda sayang
2022-10-30 14:36:35+00:00,ambilkiri,riquelme bukan pemain tercepat bukan pula paling berprestasi tapi sepak bola yg dia hadirkan begitu indah untuk dinikm
2022-10-30 14:36:14+00:00,theodoresoren,riquelme bukan pemain tercepat bukan pula paling berprestasi tapi sepak bola yg dia hadirkan begitu indah untuk dinikm
2022-10-30 14:35:49+00:00,RandyCahya,riquelme bukan pemain tercepat bukan pula paling berprestasi tapi sepak bola yg dia hadirkan begitu indah untuk dinikm
2022-10-30 14:35:34+00:00,pluskosongsatu,gk bakalan berani gue begini apalagi gue orgnya panikan pikiran gue takut bgt tiba tiba ada buaya uler dll alasan gue gk berani nyebur kalo ke pantai pokoknya yg kek laut pantai sungai yg air air gak deh
2022-10-30 14:34:36+00:00,Sahal_Rifai,sampe bosen sama pantai anyer
2022-10-30 14:34:30+00:00,rumudi,sehubungan aktifitas pelabuhan ukraina sudah ditutup oleh rusia maka pelabuhan laut paling kuat di antara semua negara di
2022-10-30 14:34:23+00:00,ohye_wo,nemu hotel di lombok harganya cuma 200ribuan dongg cuma 2 menit ke pantai sengigi dan bisa jalan kakii hotelnya nye
2022-10-30 14:32:43+00:00,_kayyyyra,salah tu hotel menarik di penang pool dia nice teruk nak mandi pantai pun boleh sebab pantai depan tu jer lepas mandi p
2022-10-30 14:31:39+00:00,n_nynamf,salah tu hotel menarik di penang pool dia nice teruk nak mandi pantai pun boleh sebab pantai depan tu jer lepas mandi p
2022-10-30 14:31:19+00:00,WahidArie2,riquelme bukan pemain tercepat bukan pula paling berprestasi tapi sepak bola yg dia hadirkan begitu indah untuk dinikm
