created_at,author,cleaned_tweet
2022-10-30 10:53:54+00:00,dekopiccaso,diminta adek ngajarin ngambar di canvas tak kasih opsi warna sama gambar di kertas dulu balesannya kak gambar sama warnanya ganti yang normal aja kaya pemandangan laut sore aja atau pantai im not angry kid im disappointed
2022-10-30 10:53:50+00:00,kjlvVooo,gak jafi healing ke pantai anjritttt mutar mutar aja capek
2022-10-30 10:52:15+00:00,JUYEONLEMOT,pengen coba massage service deket pantai dah kalo besok masih sakit badan yaallaaah udah gonta ganti posisi masih nggak enak
2022-10-30 10:52:06+00:00,cyclebibay,pantai canti seru bgt asli
2022-10-30 10:50:49+00:00,DOPEGRANGER,awalnya altiero tak ingin bermain air manakala ia menatap wajah temannya satu persatu yang memperlihatkan raut wajah senang dan berakhirlah ia ikut menikmati dinginnya air pantai itu
2022-10-30 10:50:14+00:00,Bujaang,begitu pula dengan suasana venue hari ini lekat dengan tema musim panas yang diusung mulai dari pohon pohon yang men
2022-10-30 10:49:37+00:00,mhdhazim96,salah tu hotel menarik di penang pool dia nice teruk nak mandi pantai pun boleh sebab pantai depan tu jer lepas mandi p
2022-10-30 10:49:09+00:00,aizuddin_twider,tapi tula kalau ikut ideologi aku ni kita lagi sesuai berganding dengan kawasan sumatera timur yang digulingkan seluruh riau kerajaan2nya ada kaitan dengan melaka johor jambi amp palembang yang lain2 tiada kaitan brunei pulak dapat pesisir sarawak dan pantai timur sabah
2022-10-30 10:49:00+00:00,_rizuanmohd_,airbnb yang ada private beach amp swimming pool di semenyih jomkita rare gila ada pantai wehhh tak boleh brain lokasi
2022-10-30 10:48:58+00:00,jaewthnay,jalan jalan itu bisa ke pantai taman gitu waktu jajannya bisa belanja sedikit keluarga intimu aja ajak buat paylater jangan dipake dulu deh beli sesuatu pas kamunya ada uang aja ngomong juga sama keluargamu kalau kamu ngga bisa netapin hal kayak gt lagi
2022-10-30 10:45:25+00:00,aceh_disbudpar,ratusan scooterist memeriahkan kegiatan aceh vespa festival 2022 yang digelar dari mulai museum tsunami hingga pantai tebing lampuuk aceh besar pada sabtu 29 oktober 2022 peserta yang hadir juga dari berbagai kalangan yang masih eksis menunggangi vespa cahayaaceh
2022-10-30 10:45:25+00:00,BudiSan73889018,di pantai bgus tddi
2022-10-30 10:45:04+00:00,hanadhiakhrns,tilang manual dihapus bisa kali motoran sampai pantai widuri
2022-10-30 10:44:46+00:00,silvianaeliza04,hei pantai lama tak berjumpa
2022-10-30 10:44:24+00:00,Rr_Kesty,senja pantai pulau merah
2022-10-30 10:43:01+00:00,anwubis,also iya aku udah sempet galau kirain ga dapet trio bonten pantai taunya ada di dalem amplop skskskks mamaci agii kk tar
2022-10-30 10:41:59+00:00,nisfiani16,aku waktu skripsi juga nggak boleh pke judul itu akhirnya aku putar otak terus cari judul yang lain naah pas udah acc dg judul yng lain aku dituntut untuk harus selesai dalam 3 bulan oleh ortu ku aku nekat pergi ke pantai sendirian pas maghrib pulangnya kesasar
2022-10-30 10:41:57+00:00,wibisonohadi1,mungkin umat islam selalu diam jika di kambing hitam kan seperti saya bagai buih di pinggir pantai
2022-10-30 10:41:50+00:00,laksmiayu26,angin pantai anyer membuatku jompo
2022-10-30 10:40:50+00:00,little_fox_b,46 selamat datang di pantai asoka
2022-10-30 10:40:01+00:00,bontang_post,dia yang menghalangi jalan dia yang emosi
2022-10-30 10:39:24+00:00,semangkokrindu,pingin ke mall pingin ke cafe pingin nonton bioskop nonton konser ke pantai ke art museum huhuhu
2022-10-30 10:39:00+00:00,wsxc_e,suka pantai atau gunung ka
2022-10-30 10:38:03+00:00,ibuumardanlilo,imbau kenangan zaman study pantai teluk cempedak beach in kuantan pahang
2022-10-30 10:38:02+00:00,reyhanainun,pantai cemara sewu bantul yogyakarta
2022-10-30 10:36:48+00:00,TonyGre48377195,keren banget bunda pantai kritis yaa
2022-10-30 10:36:21+00:00,T97xd,ini adalah sebuah rangkaian projek yang berfokus pada pelestarian lingkungan laut serta pesisir pantai dan terdiri dari
2022-10-30 10:36:21+00:00,nuriamelia998,aku mimpi jefri nichol pacaran dan foto foto di pantai sama lucinta luna
2022-10-30 10:36:18+00:00,iniozy,otw langsung ke hotel di sekitaran pantai losari
2022-10-30 10:35:22+00:00,Tanseriat,medea hanya bisa tertawa melihat ketiga lelaki yang cukup rempong sebelum menikmati dinginnya air pantai namun rasa senang membuncah dalam diri pantai sudah menjadi tempat favorit teratasnya ditambah dengan kawan kawan yang menemani rasanya sempurna
2022-10-30 10:34:17+00:00,asbret,mupeng liat orang pada ke pantai gunung dll sabarrr dikit lagi
2022-10-30 10:33:50+00:00,Chanohee,aku suka pantai sama laut disana bisa ketemu temen temenku dari dunia air oh iya bali selalu di rekomendasiin orang orang
2022-10-30 10:33:44+00:00,ratuenpisi,pantai lampuuk banda aceh kaak
2022-10-30 10:32:48+00:00,detik_jatim,nelayan banyuwangi yang 4 hari hilang ditemukan tewas di pantai lampon
2022-10-30 10:32:13+00:00,dytra23,lebih dari 1 200 penari mayoritas adalah anak anak usia belia di bibir pantai boom menampilkan seni tradisi menjadi bagi
2022-10-30 10:31:53+00:00,biitssss,dipinggir pantai
2022-10-30 10:31:35+00:00,FlRSTLOVEE,dr mantan si yang bagus soalnya daerah pantai
2022-10-30 10:30:06+00:00,lukisangan,toh habis nyebur bisa langsung kembali ke bibir pantai kan begitu menemukan tempat sepi di dekat pohon bersama dengan entah tumpukan apa yang berada di sana
2022-10-30 10:30:01+00:00,FurqanShohimi,suka sangat dy main air pantai
2022-10-30 10:29:31+00:00,polairdiy,laporan terkini dari bripka ign heri anggota markas unit congot ditpolairud polda diy dari kawasan pantai glagah kulon
2022-10-30 10:29:13+00:00,idbcpr,liburan ke bali ini 34 pantai di bali terbaik wajib dikunjungi
2022-10-30 10:28:48+00:00,ash_rytii,yang menyenja menyisakan sejejak biru diselimuti pekat kurasa sebentar lagi hujan menurunkan bebannya pada tempat kami dataran rendah jauh dari pegunungan jauh dari pantai meski jauh relatif dan kata kawan jelek mutlak lalu seberapa jelekkah jelek itu aku ragu sebagian orang
2022-10-30 10:28:30+00:00,charontaois,aku kalo gabut resinless jalan kaki dari pantai tempat pertamakali mancing paimon sampai ke pojokan gurun nder real
2022-10-30 10:28:21+00:00,chamomile114,jangan retweet nanti pantai ni viral terus tak cantik like takpe
2022-10-30 10:28:18+00:00,lordistme,udah bangun udah main ke pantai juga haha
2022-10-30 10:27:53+00:00,publik_com,open promote salah satu pantai indah di natuna mau akunmu dipromote daftar sini yuk follow dulu lalu da
2022-10-30 10:27:50+00:00,kamalazizKinG,naib presiden bersatu datuk mohd rafiq naizamohideen mengumumkan keluar parti berkuat kuasa serta merta hari ini pengumuman peletakan jawatan itu dibuat pada sidang media khas di pantai puteri di sini susulan beliau tidak dicalonkan bersatu pada pru15 good riddance
2022-10-30 10:27:45+00:00,hatashifx,wtb onegingek hinata shoyo yg mana aja tp prefer hinata hbd hinata pantai sm hinata no 9 yg pake baju sma paling prio warunghq warunganime
2022-10-30 10:27:21+00:00,taem_mins,taito tu kaya kalo ga indoor ya pantai
2022-10-30 10:27:08+00:00,polairdiy,laporan terkini dari bripka karyanto sh anggota ditpolairud polda diy dari kawasan pantai gesing gunungkidul minggu 30
2022-10-30 10:26:49+00:00,detikcom,empat hari hilang ali masykur 26 nelayan banyuwangi ditemukan tewas maskur ditemukan tak bernyawa di sekitar pantai lampon
2022-10-30 10:26:41+00:00,afdolski21_,jelajah trak ayuh malaysia parlimen kubang pasu 30 oktober ahad 8 30 malam bilik gerakan utama parti keadilan rak
2022-10-30 10:26:03+00:00,manusiabukansi_,di pantai enaknya manggilin tsunami bg
2022-10-30 10:25:40+00:00,haris_dmazhar,masih ingat dengan 942 project itu lho upaya pengendalian dampak musim hujan pengamanan pantai dan pengelolaan air dgn
2022-10-30 10:25:29+00:00,treasuremenfess,teume ada yang punya foto haruto di pantai gak selain waktu rekaman mv ily
2022-10-30 10:25:24+00:00,soendoet1980,masih ingat dengan 942 project itu lho upaya pengendalian dampak musim hujan pengamanan pantai dan pengelolaan air dgn
2022-10-30 10:24:25+00:00,babyyhere,besrnya lepak pantai petang2
2022-10-30 10:23:19+00:00,jacquenesebei,salah tu hotel menarik di penang pool dia nice teruk nak mandi pantai pun boleh sebab pantai depan tu jer lepas mandi p
2022-10-30 10:22:34+00:00,Irmatazme,niatnya sore jalan2 ke pantai lagi tp karena body lagi g enak drpd besok tumbang tp hari ini cuacanya bagus bgt senjanya pasti bgs bgt
2022-10-30 10:21:53+00:00,intnliyana,salah tu hotel menarik di penang pool dia nice teruk nak mandi pantai pun boleh sebab pantai depan tu jer lepas mandi p
2022-10-30 10:21:36+00:00,danialqizah,salah tu hotel menarik di penang pool dia nice teruk nak mandi pantai pun boleh sebab pantai depan tu jer lepas mandi p
2022-10-30 10:19:42+00:00,puczzle,aaaa kangen ke pantai
2022-10-30 10:18:01+00:00,expeliarmurs,begitu pula dengan suasana venue hari ini lekat dengan tema musim panas yang diusung mulai dari pohon pohon yang men
2022-10-30 10:18:00+00:00,TousSurLesJeans,gue masih ga ngerti ama mereka mereka si orang yg ke pantai dan masuk ke aer dengan mengenakan celana jeans serta pakaian l
2022-10-30 10:16:35+00:00,creamfie,gue masih ga ngerti ama mereka mereka si orang yg ke pantai dan masuk ke aer dengan mengenakan celana jeans serta pakaian lengkap whyy whuaaaiii
2022-10-30 10:16:21+00:00,NugrahaAdityaS,pantai amp curug aja
2022-10-30 10:15:40+00:00,iezasevda,seafood murah boleh pergi ke pantai sungai bila2 asal tak hujan budaya membaca al quran sejak kecil
2022-10-30 10:14:35+00:00,Udang61763962,pantai maruni
2022-10-30 10:14:28+00:00,wanetabaek,cuman mau bilang aku seberuntung itu pas kuliah dapet temen yg mau ngajarin dengan sabar dapat temen yg kalo mau ke pantai langsung gas dapat temen yg bisa diajak berprestasi juga tapi aku selalu ngeluh karena hanya ada satu keinginanku yg tidak tercapai
2022-10-30 10:14:25+00:00,binus_fess,binus lu siapa deh cowo yang make kemeja pantai pas debat hima keinget2 mulu cakep soalnya hahaha
2022-10-30 10:13:44+00:00,DenjiSideRy,berbelang dah lengan mandi pantai
2022-10-30 10:13:42+00:00,kwahyuf,ya kalau gitu setelah pantai ada zee
2022-10-30 10:13:06+00:00,aphronot_,2x ke pantai selatan dan selalu amazed sama view nya
2022-10-30 10:11:30+00:00,nothoseox,cantik amp lucu banget caholnya maacih udh bikin amp jual cahol gemes ini pdhl lucuan kalo pake pc skyblue tapi belum ada next kalo ke pantai harus bgt bawa cahol ini
2022-10-30 10:11:19+00:00,kopipamungkas,gunung kidul pantai slili pen kesana karna akses nya cukup mudah si ndere
2022-10-30 10:11:14+00:00,V_ya217,sepertinya dia butuh pelajaran biar tau batasan antara daratan dan lautan itu pantai
2022-10-30 10:10:26+00:00,DiskominfoMKS,18 10 arus lalin sekitaran pantai losari pattimura terpantau ramai lancar cctvdiskominfomks gb
2022-10-30 10:10:01+00:00,todayislucas,pergi ke pantai sunsetan kitaa
2022-10-30 10:09:57+00:00,Kholil_eM,ada juga bit soal dia bangun pagi buat nyoba lift di kampusnya biar ga malu di keseharian bi
2022-10-30 10:08:52+00:00,kajejesha,hai jesy aku baru pulang dari pantai
2022-10-30 10:08:45+00:00,mrntkfins_,so far ini pantai paling bagus di jogja gak sia2 nempuh perjalanan jauh n tracknya yg ekstrim
2022-10-30 10:07:06+00:00,gombang,saatnya ke pantai biar bisa teriak2
2022-10-30 10:06:36+00:00,adorbsgal,tengah berada di tepi pantai kita bikin istana besaaar banget ini buat kamu satu skrup yang tergeletak diambilnya untuk diserahkan pada abraham sementara calista kini telah menggenggam satu dan meletakkan ember sedang di tengah tengah mereka
2022-10-30 10:06:31+00:00,dmwsdq,terkait distribusi kota2 pantai selatan tidak strategis buat skala industri yg besar tidak ada pelab
2022-10-30 10:05:38+00:00,Rr_Kesty,throwback menanti matahari tenggelam di pantai pulau merah banyuwangi difoto ibu tanpa sepengetahuan kami
2022-10-30 10:04:49+00:00,biayeley_,itu di pantai kartini
2022-10-30 10:04:40+00:00,tashazulkarnain,selalu homestay ada kolam je ni siap ada pantai boleh memuatkan 26 orang dengan 5 bilik tidur tts beach village seme
2022-10-30 10:04:28+00:00,flzoss,begitu pula dengan suasana venue hari ini lekat dengan tema musim panas yang diusung mulai dari pohon pohon yang men
2022-10-30 10:02:56+00:00,IndosiarTV,tari kolosal gandrung sewu kembali digelar warga antusias fokus setelah vakum selama dua tahun karena pandemi tari kolosal gandrung sewu di pantai boom banyuwangi jawa timur
2022-10-30 10:02:52+00:00,vjongyu,inii nderr ada jay di pantai ody selca 70k boleh nego dan keep event dom bandung jakarta timur yaa
2022-10-30 10:01:19+00:00,enhypenmart,hypebuy coba tawarin jay yang temanya pantai dong drop wangdom juga ya thank you
2022-10-30 10:00:09+00:00,ancoltmnimpian,tapi kita bertiga berhasil yakinin dia kalo ontang anting tuh seruuu akhirnya dia mau naik tapi dia bilang syaratnya mesti temenin dia foto foto ke pantai abis dari dufan langsung lah kita gas 4 8 havenofwonder ruangkeajaiban ancol kembalikeancol
2022-10-30 10:00:09+00:00,justfafifuu,ini di pantai mna kakk
2022-10-30 10:00:06+00:00,chikomaith,dan setelah sekian lama juga kulit gak belang and here i am matahari pantai selatan emang ye
2022-10-30 09:59:32+00:00,anderemployed,pantai kuta di bali kan
2022-10-30 09:58:27+00:00,mediaindonesia,akibat banjir rob tersebut sejumlah warung milik warga yang tidak jauh dari bibir pantai terkena dampaknya
2022-10-30 09:58:15+00:00,lixbaragi,kakak nonton infinite aku iriii aku dari kemarin skeptis karena yang udah pada survei bilang puanas banget deket pantai tapi semoga holding areanya beneran di dalem mall biar adem
2022-10-30 09:56:33+00:00,SultraKini_,wartawan dilarang liput proyek betonisasi pantai sousu
2022-10-30 09:56:24+00:00,babaHG_,pantai parangkusumo
2022-10-30 09:56:01+00:00,helmyazs,pulang kampung nih ke pantai kartini
2022-10-30 09:55:56+00:00,Muhamma84501183,di apartemen apartemen yg dibangun pengusaha reklamasi pantai utara
2022-10-30 09:55:33+00:00,bemfisipunej,pengoperasian nelayan tradisional indonesia di area zona penangkapan ikan australia dan landas kontinen kegiatan kapal penangkap ikan indonesia di zona penangkapan ikan australia di lepas pantai australia barat laut dan di laut arafura dll
2022-10-30 09:55:32+00:00,gempalbanget,akhirnya malam mingguan di tepi pantai sama ayang terlaksana
2022-10-30 09:55:24+00:00,nissdira,salah tu hotel menarik di penang pool dia nice teruk nak mandi pantai pun boleh sebab pantai depan tu jer lepas mandi p
2022-10-30 09:55:17+00:00,memontum_online,sebanyak 1 500 bibit pohon mangrove ditanam di pantai permata pilang probolinggo
2022-10-30 09:53:08+00:00,_Nurathiqah,boleh ke tak eh nak duduk kat pantai tengok sunset agak agak mak bagi tak hahahha eh risau pukul 7 je dah call tanya kat mana suruh balik
2022-10-30 09:52:56+00:00,boyfrenn,kopi hitam pisang goreng pantai mentari senja dan kamu
2022-10-30 09:51:03+00:00,idbcpr,ini dia pantai terbaik di bali wajib kunjung no 7 keren banget
2022-10-30 09:50:48+00:00,Sugeng09341014,minggukuh disini pantai selatan wonosari gunung kidul healing ya menikmati sisa umur yg smakin berkurang
2022-10-30 09:49:38+00:00,Rya_MaRyaNii,pengen cari tempat yg sepi tapi ga bikin kesepian ga suka keramaian tapi ga punya banyak waktu buat liburan lama nih bisa
2022-10-30 09:49:30+00:00,AbuSali63479167,minggu 30 10 2022 abu salim swadaya deli serdang pendataan produksi nelayan tpi pantai labu ikan gelama 102kg size 20 ikan kembung kuring 234kg size 6 ikan selar 114kg size 7 giatluhkpsatminkalmdn bpppmedan giatluhkp deliserdang
2022-10-30 09:49:01+00:00,MFfamiy,jwb saya ad kawan spital pantai hahahaha
2022-10-30 09:46:04+00:00,Gooners_Cirebon,kuningan majalengka daerah pegunungan sejuk cirebon indramayu pinggir pantai panas
2022-10-30 09:45:48+00:00,SejarahMalaysi1,hari ini dalam sejarah malaysia 30 10 1965 perasmian maktab perguruan lembah pantai sejarah hids
2022-10-30 09:45:31+00:00,SangNirnyawa,susah nak cari batik pantai timur yang santai atau kasual cari dekat lapak dagang dalam talian pun penuh batik seberang
2022-10-30 09:45:19+00:00,Tanseriat,usai menghubungi altiero angkasa bergegas pergi ke arah pantai di mana tiga
2022-10-30 09:44:17+00:00,wildanannur5,pantai mana mbk
2022-10-30 09:44:08+00:00,amrandika,susah nak cari batik pantai timur yang santai atau kasual cari dekat lapak dagang dalam talian pun penuh batik seberang ada cadangan tempat beli batik pantai timur yang mantap kalau boleh dalam talian lah dokrok nok gi tranung semate beli baju selai
2022-10-30 09:43:41+00:00,onlyhugtenya,jir mau geprek huft gmna klo mam geprek di pantai boleh gak yh
2022-10-30 09:43:19+00:00,slygoo_17EN,aku udh ikuy opsharenya ka tp harga wonu pantai dr seller mahal
2022-10-30 09:41:42+00:00,lukisangan,bukannya menyesal karena meninggalkan angkasa ciki justru terbahak siapa suruh ngilang gak balik modal abangnya kalo nungguin liat dong tuh memed aja baru dandan di pantai
2022-10-30 09:41:28+00:00,Officialhansei,8 bangi 9 puchong 10 petaling jaya 11 lembah pantai 12
2022-10-30 09:40:36+00:00,moonjun____,ada wonu pantai
2022-10-30 09:40:11+00:00,nojaemarkie,pantai with ayang
2022-10-30 09:39:51+00:00,ecahpipah,airbnb yang ada private beach amp swimming pool di semenyih jomkita rare gila ada pantai wehhh tak boleh brain lokasi
2022-10-30 09:39:49+00:00,budiawandki,masih ingat dengan 942 project itu lho upaya pengendalian dampak musim hujan pengamanan pantai dan pengelolaan air dgn
2022-10-30 09:39:14+00:00,Sani01111700,lagi2 umno tipu kjaan sediakan menerusi bajet 2023 untuk projek tebatan banjir dan baik pulih hakisan pantai di pahang
2022-10-30 09:38:51+00:00,elma_s87281,ngapain ke pantai sendirian biasalah cuci mata mumpung suami nggak dirumah
2022-10-30 09:37:19+00:00,syaaaaraaa,bestseller pesta buku pantai timur top 5 buku 1 fainni qarib 2 buya hamka berbicara tentang perempuan
2022-10-30 09:36:59+00:00,gfnyakyu,mau ke pantai kapan tp gatau kapan
2022-10-30 09:36:46+00:00,syatranji,usai menghubungi altiero angkasa bergegas pergi ke arah pantai di mana tiga kawannya berada ia tentu tak ingin ketinggalan untuk menyaksikan pemandangan pantai di sore hari rugi nanti anjir gue ditinggal tuturnya pada begitu tiba
2022-10-30 09:36:38+00:00,heyitsauwrelll,dah yuk kejar sempro aja dulu abis itu kita ke pantai
2022-10-30 09:36:18+00:00,ayus_mahroji,salah tu hotel menarik di penang pool dia nice teruk nak mandi pantai pun boleh sebab pantai depan tu jer lepas mandi p
2022-10-30 09:36:17+00:00,fakhrifadzli,bestseller pesta buku pantai timur top 5 buku 1 fainni qarib 2 buya hamka berbicara tentang perempuan
2022-10-30 09:36:08+00:00,BodohBangang3,8 bangi 9 puchong 10 petaling jaya 11 lembah pantai 12
2022-10-30 09:35:32+00:00,IDNTimesJogja,wisatawan juga bisa membeli ikan segar tangkapan nelayan
2022-10-30 09:35:20+00:00,baerevelvine,ingatlah hari ini metal vs dugem kek adu mekanik genre musik kalo lagi di pantai santai santai nyetel goyang duyu
2022-10-30 09:34:08+00:00,Sukabumizone,belasan mck dibangun pantai batu bintang palabuhanratu mulai ditata
2022-10-30 09:33:56+00:00,TAJ97JJH,tapi itu bagus banget gila sumpah tercengang yang di pantai kaya beneran nge date
2022-10-30 09:33:49+00:00,Polresbatubara2,personil polsek labuhan ruku polres batu bara melaksanakan kegiatan pengamanan monitoring objek wisata bertempat di pantai bunga dan pantai bali lestari desa bandar rahmat kec tanjung tiram kab batu bara
2022-10-30 09:33:00+00:00,Selpirasmello,cakep bgt nih dipake buat ootd ke pantai juga cocok banget beli disini kulot nya disini
2022-10-30 09:32:54+00:00,kiong_m,masih ingat dengan 942 project itu lho upaya pengendalian dampak musim hujan pengamanan pantai dan pengelolaan air dgn
2022-10-30 09:32:47+00:00,skiespixie,venue di luar gedung nya is not as big as i thought yg luas tu pantai nya kalo gedung nya iya gede bgt
2022-10-30 09:32:32+00:00,cutibajetco,salah tu hotel menarik di penang pool dia nice teruk nak mandi pantai pun boleh sebab pantai depan tu jer lepas mandi p
2022-10-30 09:32:12+00:00,ayyluvxr,enak banget ke pantai
2022-10-30 09:32:12+00:00,davidcy_dave,wisata laskar pelangi belitong pantai tanjung tinggi belitung laskar pelangi beach
2022-10-30 09:31:19+00:00,bluedaises,begitu pula dengan suasana venue hari ini lekat dengan tema musim panas yang diusung mulai dari pohon pohon yang men
2022-10-30 09:30:14+00:00,skiespixie,nah ini gedung nya ada 3 lantai stage nya di lantai 3 bisa ke lantai 2 3 lewat dalem mall nya juga tapi liat nanti posisi tiketing nya gmn yg aku tandain heart lantai 2 yg omg lantai 3 ya ini pov pantai nya pas keluar dari mall nya
2022-10-30 09:30:01+00:00,WulayuF,okay da sampai hutan konkrit tiba tiba rasa nak marah beforehand nak terima kasih sangat dekat ummu sebab plan nak lukis dalam hutan di selangor jadi tepi pantai di kuantan pahang kak bah dan kak dah yang supportive 6 jam lepas decide terus gerak 4am sabtu ilyall
2022-10-30 09:29:38+00:00,meyganurlia,melamun di pinggir pantai so nikmaaat
2022-10-30 09:28:46+00:00,xxjoojii,sesok aku neng gunungkidul wes sekalian dolan neng pantai pet
2022-10-30 09:28:04+00:00,Tanseriat,altiero tersenyum karena kelakuan kedua temannya itu seperti anak kecil tanpa menjawab
2022-10-30 09:28:02+00:00,tekong,jangan retweet nanti pantai ni viral terus tak cantik like takpe
2022-10-30 09:28:01+00:00,Tanseriat,wey ayo cepetan mumpung pantai sepi seru ciki kepada kedua temannya dan dengan matan
2022-10-30 09:26:36+00:00,kurakurampas,kamu di pantai
2022-10-30 09:25:51+00:00,Astha_afrak47,sendirian gitu di pinggir pantai sore sore cahaya matahari mulai menguning yg kedengeran hanya suara debur ombak sama angin
2022-10-30 09:25:10+00:00,DOPEGRANGER,altiero tersenyum karena kelakuan kedua temannya itu seperti anak kecil tanpa menjawab pertanyaan si puan ia mengikuti langkah kaki yang membawanya ke bibir pantai saat hendak bermain air hpnya berdering eh si jingga mau ikutan
2022-10-30 09:25:05+00:00,todayislucas,pergi ke pantai sambil nunggu sunset
2022-10-30 09:24:44+00:00,stsyuhaida,nak kurangkan sama ada makan ubat cetirizine atau sapu ubat hydrocortisone mandi pantai pon membantu tapi hari tu kena covid pula lol
2022-10-30 09:23:38+00:00,FransiskaIndry_,list dulu pantai wajib masuk list wkwk
2022-10-30 09:23:29+00:00,umi_uumairah,wuuu alhamdulillah buleh pi pantai selalu ahahahah
2022-10-30 09:23:12+00:00,SokaJati,minggu sorekuh bis dr pantai selatan lnjut ke sanggar senam rutinitas pokoke pola hidup sehat biar jiwa ikut sehat otak fresh body fit balance brain amp body yuukkk
2022-10-30 09:23:00+00:00,itsybitchybabe,blio ngajak ke pantai napa mendadak banget beraaaa gue gak mau malah ikut gak mau
2022-10-30 09:21:47+00:00,Hisyam24715510,pantai dalam tu pun tk de laut
2022-10-30 09:21:36+00:00,if2629,kangen pantai kangen perjalanan ke suatu pulau udah lama ga bolang ke pantai mupeng banget liat ada yg di gili sama perjalanan ke banda neira
2022-10-30 09:21:15+00:00,mingyulaily,dahlah weekend kali ini batal lagi ke pantai karna yaa i have no chingu
2022-10-30 09:20:28+00:00,_menangis_,apa cuma aku yang ke pantai marina
2022-10-30 09:20:21+00:00,IGURLOFC,begitu pula dengan suasana venue hari ini lekat dengan tema musim panas yang diusung mulai dari pohon pohon yang men
2022-10-30 09:20:15+00:00,IpongHembing,ketum piti dr ipong hembing putra pantai bebas parapar sekarang keren lewat
2022-10-30 09:20:07+00:00,medan_abg,enak si kalo sore2 ke pantai
2022-10-30 09:19:58+00:00,onlyhugtenya,pulang kkn ke pantai plis plis plis panbos pantai bosowa
2022-10-30 09:19:36+00:00,eIIeazar,halo cantik fc el ada maknae dreamies lalu juga ada ren jun di side fc el walaupun main love languange el bukan aos tapi el bisa ngajakin kamu ngobrol ngalor sampe gunung merapi ngidul sampe pantai parangtritis terus kemana lagi el ajakin kamu ngobrolin apa aja yang bisa
2022-10-30 09:18:26+00:00,user101104,woalah sekeluarga ke pantai semua dan gua ditinggal sendirian
2022-10-30 09:18:20+00:00,endanghidayat,masih ingat dengan 942 project itu lho upaya pengendalian dampak musim hujan pengamanan pantai dan pengelolaan air dgn
2022-10-30 09:18:06+00:00,Annieth96,kenapa ya kalau lepak dekat pantai bila balik rumah mesti penat lain macam harini lagi extra sebab kena jalan jauhhhh masuk hutan sikit baru jumpak pantai
2022-10-30 09:17:44+00:00,RT_Kalcit,masih ingat dengan 942 project itu lho upaya pengendalian dampak musim hujan pengamanan pantai dan pengelolaan air dgn
2022-10-30 09:17:43+00:00,aquardian__,enaknya main pantai
2022-10-30 09:17:30+00:00,edyredza,calon2 amanah boleh dikatakan ade background yg strong dan up to date moga berjaya dikawasan masing2 amanah perlu ade wakil rakyat di pantai timur dan malaysia barat supaya boleh capai majoriti kukuh ph
2022-10-30 09:17:06+00:00,berdoadulu,woalah asemm sekeluarga semua ke pantai tapi gua ga di ajak sendiri hah
2022-10-30 09:16:11+00:00,RawrDzulaika,thank you my 3 6 0 man yg boleh bawak g camping picnic lari shopping pantai sungai hotel 5 travelling semua dia onz jer
2022-10-30 09:15:08+00:00,marvelaous,edward yang panik mendengar pengumuman itu lalu memandang para siswa kalian dengar itu murid murid ma
2022-10-30 09:14:39+00:00,todayislucas,bisaa pergi ke pantai terus liat sunset
2022-10-30 09:14:11+00:00,littlelilistar_,seandainya aku malam mingguan dengan bias nct aku bakal ajak doyoung ke pantai watudodol min di bwi doi pasti seneng bgt wkwkwk nct127 nct 127injkt nct127 neo city the link neocity the link jkt dyandraglobal concert
2022-10-30 09:12:57+00:00,Sahar65656722,pantai cakep sebelahnya pantai bluluk yg ada goa
2022-10-30 09:12:54+00:00,Herman289526796,pantai pandawa bali
2022-10-30 09:12:31+00:00,Karmelo_Ken,salah tu hotel menarik di penang pool dia nice teruk nak mandi pantai pun boleh sebab pantai depan tu jer lepas mandi p
2022-10-30 09:12:20+00:00,frasafiksi,begitu pula dengan suasana venue hari ini lekat dengan tema musim panas yang diusung mulai dari pohon pohon yang menghias tiap sudut venue beberapa buah dari daerah tropis disusun sedemikian rupa hingga hiasan seperti payung yang biasa terlihat di pantai
2022-10-30 09:12:19+00:00,caralemel,ntuh di pantai mana
