created_at,author,cleaned_tweet
2022-10-30 13:30:28+00:00,melejid,keesokan harinya ternyata cuaca mendung gw sempetin buat jogging keliling taman blambangan lanjut taman sritanjung dan berakhir di pantai boom ini jaraknya dekat banget
2022-10-30 13:29:17+00:00,tidurberjalaaan,riquelme bukan pemain tercepat bukan pula paling berprestasi tapi sepak bola yg dia hadirkan begitu indah untuk dinikm
2022-10-30 13:28:52+00:00,edoongo,riquelme bukan pemain tercepat bukan pula paling berprestasi tapi sepak bola yg dia hadirkan begitu indah untuk dinikm
2022-10-30 13:28:26+00:00,nuzuliarifin,pantai laskar pelangi
2022-10-30 13:27:33+00:00,LP_PermisanNK,kakanwil kemenkumham jateng a yuspahruddin hari kedua kemah bakti pramuka tahun 2022 lapas batang kanwil kemenkumham jateng ikuti kegiatan kebersihan area pantai
2022-10-30 13:27:30+00:00,may_mandu,aku bawa sepatu sendal dan sepatu krn mau main di pantai dlu dan utk sehbs konser
2022-10-30 13:27:03+00:00,danusaurrus,salah satu pantai yang aku suka
2022-10-30 13:26:08+00:00,andriyadiagus08,riquelme bukan pemain tercepat bukan pula paling berprestasi tapi sepak bola yg dia hadirkan begitu indah untuk dinikm
2022-10-30 13:26:04+00:00,kopibukudanpena,riquelme bukan pemain tercepat bukan pula paling berprestasi tapi sepak bola yg dia hadirkan begitu indah untuk dinikm
2022-10-30 13:25:06+00:00,fahmydc,riquelme bukan pemain tercepat bukan pula paling berprestasi tapi sepak bola yg dia hadirkan begitu indah untuk dinikm
2022-10-30 13:23:42+00:00,Afiefmaruf97,riquelme bukan pemain tercepat bukan pula paling berprestasi tapi sepak bola yg dia hadirkan begitu indah untuk dinikm
2022-10-30 13:23:18+00:00,XanderSanada,salah tu hotel menarik di penang pool dia nice teruk nak mandi pantai pun boleh sebab pantai depan tu jer lepas mandi p
2022-10-30 13:23:17+00:00,vidd_12,riquelme bukan pemain tercepat bukan pula paling berprestasi tapi sepak bola yg dia hadirkan begitu indah untuk dinikm
2022-10-30 13:22:52+00:00,ramenfreeze,rasanya mau ke pantai atau ke manapun jenuh banget
2022-10-30 13:22:27+00:00,bukanares,nongkrongnya di asela menikmati pantai camplong malem malem meski cuma pesen es teh sama kopi panas
2022-10-30 13:21:30+00:00,NoegrohoEddie,di ntb ada motogp dan ada mxgp dan sekarang ada kegiatan rakyat geloraboatrace yang murah meriah di pesisir yang indah
2022-10-30 13:20:53+00:00,sukibim,riquelme bukan pemain tercepat bukan pula paling berprestasi tapi sepak bola yg dia hadirkan begitu indah untuk dinikm
2022-10-30 13:20:50+00:00,firdauspeace911,baju merah di pantai
2022-10-30 13:20:46+00:00,lapasklaten,kakanwil kemenkumham jateng a yuspahruddin hari kedua kemah bakti pramuka tahun 2022 lapas batang kanwil kemenkumham jateng ikuti kegiatan kebersihan area pantai
2022-10-30 13:20:27+00:00,bokuwaweebjanai,pengen cari tempat yg sepi tapi ga bikin kesepian ga suka keramaian tapi ga punya banyak waktu buat liburan lama nih bisa
2022-10-30 13:20:00+00:00,dindahero11,makasih ya udah nganterin kita jalan jalan ke pantai seneng banget ya allah
2022-10-30 13:19:43+00:00,purworejo_rutan,206 kakanwil kemenkumham jateng a yuspahruddin hari kedua kemah bakti pramuka tahun 2022 lapas batang kanwil kemenkumham jateng ikuti kegiatan kebersihan area pantai
2022-10-30 13:19:38+00:00,TuaiRumahKitai,apa khabar pantai puteri oooo ada benda baru
2022-10-30 13:19:23+00:00,Afiramadhani31,aku pas di jogja nek galau ke pantai paling deket area parangtritis dan sekitarnya saiki paling deket ke kenjeran meh meromantisasi galauku kok ya ra wangun orang surabaya kalo lagi galau selain nangis di kamar sama mabok di bar pada ngapain si
2022-10-30 13:19:23+00:00,purworejo_rutan,203 kakanwil kemenkumham jateng a yuspahruddin hari kedua kemah bakti pramuka tahun 2022 lapas batang kanwil kemenkumham jateng ikuti kegiatan kebersihan area pantai
2022-10-30 13:19:02+00:00,LuhAyuManikMas1,wah keren banget ini kedatangan wisatawan ke bali tidak hanya untuk menikmati keindahan pantainya namun turut serta dalam menjaga kebersihan pantai dari sampah yang berserakan di pantai petitenget seminyak
2022-10-30 13:18:48+00:00,DrAmeenKLPj,pada 30 10 2022 pejabat kesihatan lembah pantai telah mengadakan operasi peraturan2 kawalan hasil tembakau 2004 di sekitar kawasan mid valley megamall amp the gardens mall sejumlah 21 notis 32b telah dikeluarkan dgn nilai rm5 250 geg
2022-10-30 13:18:46+00:00,NadhiraFarhanim,salah tu hotel menarik di penang pool dia nice teruk nak mandi pantai pun boleh sebab pantai depan tu jer lepas mandi p
2022-10-30 13:18:45+00:00,aziahsuid,airbnb yang ada private beach amp swimming pool di semenyih jomkita rare gila ada pantai wehhh tak boleh brain lokasi
2022-10-30 13:17:53+00:00,_rezarazali_,memulih dan mencergaskan pertumbuhan ekonomi domestik fokus 2 infrastruktur dan utiliti 1 pembangunan dan pengurusan si
2022-10-30 13:17:23+00:00,ayu_hussein,hurmmm kuciwa la itula orang kata kalau takut di lambong ombak jgn berumah d tepi pantai tak getew
2022-10-30 13:16:46+00:00,ekosetyow,riquelme bukan pemain tercepat bukan pula paling berprestasi tapi sepak bola yg dia hadirkan begitu indah untuk dinikm
2022-10-30 13:16:36+00:00,adhyaviya,sisanya kalau misalkan kamu kepo boleh intip nah kalau abis buka carrd udah makin yakin sama vika langsung hubungi ratu uler pantai utara alias bunda tercintah
2022-10-30 13:16:25+00:00,rezauzi,riquelme bukan pemain tercepat bukan pula paling berprestasi tapi sepak bola yg dia hadirkan begitu indah untuk dinikm
2022-10-30 13:16:00+00:00,mahirahmahdan,mommy beli baju swimsuit dgn antislip beach shoes tu pun tkthu ah bila gi pantai lagi okay kena pergi pool kot
2022-10-30 13:15:39+00:00,AndreaJuna2,riquelme bukan pemain tercepat bukan pula paling berprestasi tapi sepak bola yg dia hadirkan begitu indah untuk dinikm
2022-10-30 13:14:53+00:00,asetkecamatan,ini pasir pantai ya
2022-10-30 13:14:38+00:00,TLBNXDE,padahal main di pantai yang indah di indonesia yang lebih baik
2022-10-30 13:14:31+00:00,UpdaKedah,memulih dan mencergaskan pertumbuhan ekonomi domestik fokus 2 infrastruktur dan utiliti 1 pembangunan dan pengurusan sistem saliran tali air sungai dan pantai 2 kemudahan jaringan jalan dan jambatan 3 projek bekalan air bajetkedah2023
2022-10-30 13:14:10+00:00,relindapuspita,tanpa pantai pura sawah air terjun dan cafe gaul bali tetap menyenangkan dan bikin rindu
2022-10-30 13:13:52+00:00,iship2manyships,awwwwww meleleh bacanya jadi air di pantai
2022-10-30 13:13:00+00:00,jimiznpark,ootd saya enih santai seperti di pantai
2022-10-30 13:12:57+00:00,Kyboba05,pengen cobain tidur di pantai sampe pagi
2022-10-30 13:12:45+00:00,nickyananda,riquelme bukan pemain tercepat bukan pula paling berprestasi tapi sepak bola yg dia hadirkan begitu indah untuk dinikm
2022-10-30 13:12:01+00:00,fiktido,sangat la terpaling healing tepi pantai pukul 5 pagi makan indomie la anat
2022-10-30 13:11:52+00:00,RZulri,ratusan scooterist memeriahkan kegiatan aceh vespa festival 2022 yang digelar dari mulai museum tsunami hingga pantai t
2022-10-30 13:11:42+00:00,bossku_team,pkr bakal tumbang pd kali ini bandar tun razak permatang pauh lembah pantai amp beberapa kawasan lain akan hanyut kat sarawak semua calon dap amp pkr bakal bungkus
2022-10-30 13:11:40+00:00,nrlizanisani,uia gombak dah ada pantai lah geng siap ada tempat duduk khas untuk menikmati pemandangan
2022-10-30 13:11:20+00:00,ssiittaaaaaadwy,pengen foto malem2 di pinggir pantai keknya bagus ya ke ancol or pik kali
2022-10-30 13:11:16+00:00,rizkyfahalni,riquelme bukan pemain tercepat bukan pula paling berprestasi tapi sepak bola yg dia hadirkan begitu indah untuk dinikm
2022-10-30 13:11:04+00:00,mlzbobye,riquelme bukan pemain tercepat bukan pula paling berprestasi tapi sepak bola yg dia hadirkan begitu indah untuk dinikm
2022-10-30 13:10:57+00:00,Horasio70,banyak berdoa ya bu biar si karma gak datang begitu cepat
2022-10-30 13:10:43+00:00,Sampeong2,masih ingat dengan 942 project itu lho upaya pengendalian dampak musim hujan pengamanan pantai dan pengelolaan air dgn
2022-10-30 13:10:20+00:00,anhnini_twt,salah tu hotel menarik di penang pool dia nice teruk nak mandi pantai pun boleh sebab pantai depan tu jer lepas mandi p
2022-10-30 13:10:19+00:00,bapaspati,kakanwil kemenkumham jateng a yuspahruddin hari kedua kemah bakti pramuka tahun 2022 lapas batang kanwil kemenkumham jateng ikuti kegiatan kebersihan area pantai
2022-10-30 13:10:05+00:00,dwisaputro13,riquelme bukan pemain tercepat bukan pula paling berprestasi tapi sepak bola yg dia hadirkan begitu indah untuk dinikm
2022-10-30 13:09:52+00:00,aizumiie,wii asik merayakan ultah ayang 3 aku baik banget seru bisa main ke pantai hehe
2022-10-30 13:09:34+00:00,bonekmagang,riquelme bukan pemain tercepat bukan pula paling berprestasi tapi sepak bola yg dia hadirkan begitu indah untuk dinikm
2022-10-30 13:08:43+00:00,arippoce,riquelme bukan pemain tercepat bukan pula paling berprestasi tapi sepak bola yg dia hadirkan begitu indah untuk dinikm
2022-10-30 13:08:41+00:00,partly_rainy,pen ke pantai trs teriak kontol
2022-10-30 13:08:22+00:00,realpariel,pantai itu menyenangkan gunung itu menenangkan mba diah
2022-10-30 13:08:08+00:00,herrsax,gass ke pantai emg bagus bangett
2022-10-30 13:07:51+00:00,dolanterooos,mengsedih melihat masih banyak orang2 ngebunuh paus manta dkk yang notabene dilindungi kemaren nemu bangkainya di pesisir pantai asli dah kejam kali
2022-10-30 13:07:32+00:00,XC_nurulnad,dik klau nak buat jahat buat betul2 dik terkuis kuis dah macam main tepi pantai tu awak dah rasa habis gangster ke nk buat jahat jangan ayu2 ganas sikit
2022-10-30 13:07:27+00:00,R_Soentana,kawan ke pantai naik sepeda masuk berempat membayar karcis urusan partai boleh berbeda jangan lupa 2024 pilih bang anies
2022-10-30 13:07:14+00:00,lady_bugg11,cukai apa dap apa kat pantai timur baik undi dap la pada pas x reti wat kje
2022-10-30 13:06:45+00:00,lhay____,atau aku harus lari ke hutan belok ke pantai
2022-10-30 13:06:22+00:00,gamerpg7,lah lu bilang w nge hina berrti lu merasa dong kalo ga maerasa mah santai aja bro kek di pantai bener kan klwkwkwkwkwkk
2022-10-30 13:05:58+00:00,wisratd,how sbali 2 petitenget beach lokasinya deket banget sama kafe di atas masuk gratis kalau pejalan kaki hehehe bukan pantai pasir putih tapi still good ga yang banyak sampah paling suka sore duduk atau jalan di sini nunggu sunset terus lanjut dinner di seminyak
2022-10-30 13:05:52+00:00,IsmanSusandi,riquelme bukan pemain tercepat bukan pula paling berprestasi tapi sepak bola yg dia hadirkan begitu indah untuk dinikm
2022-10-30 13:05:51+00:00,hsdby,aku baca ronggeng dukuh paruk dan nyaman juga baca gadis pantai arok dedes pram anak perawan di sarang penyamun sutan takdir dan harimau harimau mochtar lubis
2022-10-30 13:05:21+00:00,rzldyprasetya,riquelme bukan pemain tercepat bukan pula paling berprestasi tapi sepak bola yg dia hadirkan begitu indah untuk dinikm
2022-10-30 13:05:02+00:00,dongkywols,ya berarti ente merasa dong kalo begitu kalo tidak merasa mah ngapain tersinggung santai bae kayak di pantai udah pernah ke pantai belom
2022-10-30 13:04:50+00:00,beyshawnnce,tp jauh bgtt huhuhu mana itu deket bgt sama pantai gakebayang kalo lagi nunggu di luar panas bgt pasti
2022-10-30 13:04:41+00:00,RbthN,hahaha dikiro pantai
2022-10-30 13:04:29+00:00,sivirgoflower,salah tu hotel menarik di penang pool dia nice teruk nak mandi pantai pun boleh sebab pantai depan tu jer lepas mandi p
2022-10-30 13:04:13+00:00,BundaJamariah,riquelme bukan pemain tercepat bukan pula paling berprestasi tapi sepak bola yg dia hadirkan begitu indah untuk dinikm
2022-10-30 13:03:46+00:00,syamsulfirdaus,masih ingat dengan 942 project itu lho upaya pengendalian dampak musim hujan pengamanan pantai dan pengelolaan air dgn
2022-10-30 13:02:43+00:00,blank_identity9,pantai gunung kidul mang kereeen
2022-10-30 13:02:09+00:00,MLieur2,masih ingat dengan 942 project itu lho upaya pengendalian dampak musim hujan pengamanan pantai dan pengelolaan air dgn
2022-10-30 13:02:05+00:00,wakkeyg10,riquelme bukan pemain tercepat bukan pula paling berprestasi tapi sepak bola yg dia hadirkan begitu indah untuk dinikm
2022-10-30 13:02:05+00:00,bucineskopiaren,pantai padang
2022-10-30 13:01:48+00:00,akistone,lantak kau lah kami ke pd nak mandi pantai je siapa pun adunnya sama je masin air lautnya
2022-10-30 13:01:36+00:00,pykaarazak,salah tu hotel menarik di penang pool dia nice teruk nak mandi pantai pun boleh sebab pantai depan tu jer lepas mandi p
2022-10-30 13:01:17+00:00,YOHOYOLOYOLO,ombak bioluminence terjadi ketika air laut yg mengandung konsentrasi lingulodinium polyedra pekat terusik atau terganggu
2022-10-30 13:01:02+00:00,junkcok,riquelme bukan pemain tercepat bukan pula paling berprestasi tapi sepak bola yg dia hadirkan begitu indah untuk dinikm
2022-10-30 13:01:00+00:00,rutanjepara,kakanwil kemenkumham jateng a yuspahruddin hari kedua kemah bakti pramuka tahun 2022 lapas batang kanwil kemenkumham jateng ikuti kegiatan kebersihan area pantai
2022-10-30 13:00:45+00:00,rutanjepara,kakanwil kemenkumham jateng a yuspahruddin hari kedua kemah bakti pramuka tahun 2022 lapas batang kanwil kemenkumham jateng ikuti kegiatan kebersihan area pantai
2022-10-30 13:00:44+00:00,foodie_id,masih ingat dengan 942 project itu lho upaya pengendalian dampak musim hujan pengamanan pantai dan pengelolaan air dgn
2022-10-30 13:00:04+00:00,ecpalmier,aaaa mau ke pantai juga
2022-10-30 13:00:00+00:00,tvstvmy,malaysiadecides p 167 kudat kudat terkenal keindahan pantai dan merupakan antara lokasi sukan luncur ombak terbaik di sabah selain menawarkan produk pelancongan lain dapatkan info terkini pru 15 di microsite kami tvs122 tvsnews malaysiadecides
2022-10-30 12:58:41+00:00,evaaav2,hari ini gw sakit padahal seharusnya ikut parktikum lapangan ke pantai
2022-10-30 12:58:30+00:00,dalancepmek,selamat dari terjangan ombak pantai selatan
2022-10-30 12:58:14+00:00,cerfandhiver,bxg nemenin birthday girl jalan jalan ke pantai
2022-10-30 12:57:31+00:00,yearaay,awalnya si ben yang ke laut cuma dia inget rania jadi gak jadi pokonya di sini si ben udah mengakui kalo dia udah cinta nahh pas rania bangun si ben udah gak ada terus tau tau liat jaket si ben di sisi pantai dia kira si ben dah ke laut kayaknya jadi ngikutin mungkin
2022-10-30 12:57:15+00:00,AbdHali59646742,kawan ke pantai naik sepeda masuk berempat membayar karcis urusan partai boleh berbeda jangan lupa 2024 pilih bang anies
2022-10-30 12:56:57+00:00,Alfin_FR1,riquelme bukan pemain tercepat bukan pula paling berprestasi tapi sepak bola yg dia hadirkan begitu indah untuk dinikm
2022-10-30 12:56:51+00:00,food_womanblog,pesisir pantai juga jadi adem deh
2022-10-30 12:56:49+00:00,JannesHutajulu,tahan dulu boss kebutuhan gas ue telah menjadi objek permainan para spekulan kapal lng menunggu harga ue naik lebih t
2022-10-30 12:56:28+00:00,AhmdSyrfdn,riquelme bukan pemain tercepat bukan pula paling berprestasi tapi sepak bola yg dia hadirkan begitu indah untuk dinikm
2022-10-30 12:56:10+00:00,jomtravel_,salah tu hotel menarik di penang pool dia nice teruk nak mandi pantai pun boleh sebab pantai depan tu jer lepas mandi p
2022-10-30 12:55:02+00:00,bxgfess,bxg nemenin birthday girl jalan jalan ke pantai
2022-10-30 12:53:13+00:00,borasukie_,wts want to sell lfb ina only take all 600k bisa satuan jika take all bonus album only enhypen dillema yg oren
2022-10-30 12:53:12+00:00,kisahrenjana,dibeliin kacamata rubi buat apa anjir gue maen maen ke pantai juga kaga
2022-10-30 12:53:08+00:00,jeboiiiiiy,riquelme bukan pemain tercepat bukan pula paling berprestasi tapi sepak bola yg dia hadirkan begitu indah untuk dinikm
2022-10-30 12:53:08+00:00,bemfkh_ugm,kegiatan akan dilaksanakan pada tanggal 13 november 2022 tempat garduaction garbage care and education pantai parangtritis bantul yogyakarta untuk teman teman yang ingin berdonasi periode donasi dibuka dari 31 oktober 6 november 2022
2022-10-30 12:52:48+00:00,dzoukkar,jadi kapan kita kabur entah ke pantai luar kota puncak villa curug gunung juga gapapa deh meskipun gua kontra semua hal diatas jadi kalo gua gatau kek tiba tiba sampe aja
2022-10-30 12:52:35+00:00,DhiorAnt,rambu ga pernah bosen main ke pantai kedungu
2022-10-30 12:52:32+00:00,MAYOIMASUU,gw make ginian naik gunung trus turun ke pantai tuh yg di pacitan anj nyangkut
2022-10-30 12:52:07+00:00,bluexhoon,daripada nongkrong di cafe gitu aku lebih suka diajak jalan random ngeliat jalanan malam duduk dipinggir pantai sambil nunggu sunset sunrise camping atau ndaki gunung dan sekarang aku excited banget karna diajak dia camp weekend ini gt lt
2022-10-30 12:51:40+00:00,_hazqq,tenangnya dengar lagu ni bila duduk dekat pantai
2022-10-30 12:51:09+00:00,babiishawty,kalo kemaren di pantai itu lamaran pas halloween nikah
2022-10-30 12:50:36+00:00,baetokiss,salah tu hotel menarik di penang pool dia nice teruk nak mandi pantai pun boleh sebab pantai depan tu jer lepas mandi p
2022-10-30 12:50:36+00:00,nhusnahusni,atau aku harus lari ke hutan belok ke pantai
2022-10-30 12:50:31+00:00,sujaji_,riquelme bukan pemain tercepat bukan pula paling berprestasi tapi sepak bola yg dia hadirkan begitu indah untuk dinikm
2022-10-30 12:50:12+00:00,lvymelt,mau ke pantai
2022-10-30 12:49:13+00:00,ruri_nazzaruri,riquelme bukan pemain tercepat bukan pula paling berprestasi tapi sepak bola yg dia hadirkan begitu indah untuk dinikm
2022-10-30 12:48:48+00:00,afifaheomuk,i nak fefeeling pantai astu jenjalan lah takda fixed plan lagi pikir maldives of thailand je nii
2022-10-30 12:48:12+00:00,tadaimaak,bersih bersih pantai hari inii
2022-10-30 12:47:40+00:00,anakmatkid,meditasi gelap gelapan di pantai terus ditanyain bule excuse me wht r u just doing
2022-10-30 12:46:18+00:00,donutcampuq,salah tu hotel menarik di penang pool dia nice teruk nak mandi pantai pun boleh sebab pantai depan tu jer lepas mandi p
2022-10-30 12:45:58+00:00,Ajege1998,kyak tanah yg terus susut garis pantai trus geser sungai2 meluas jumlah penduduk pesat berkembang klo smua dijadikan rumah atau efektifnya rusun atau apart trus lu mau nanam sayur okelah ada teknologi terbarukan hidroponik pertanyaannya bisakah ngecover smua
2022-10-30 12:45:51+00:00,seunqgmin,mau di pantai kamu suka gak sayang huft gimana aku harus memberi bukti bukti kwitansi dp gedung kah ada sini bilang maunya apa
2022-10-30 12:45:23+00:00,ayahshifa,riquelme bukan pemain tercepat bukan pula paling berprestasi tapi sepak bola yg dia hadirkan begitu indah untuk dinikm
2022-10-30 12:45:20+00:00,iendeahaaa,buaya pantai
2022-10-30 12:45:19+00:00,kenyoooo,riquelme bukan pemain tercepat bukan pula paling berprestasi tapi sepak bola yg dia hadirkan begitu indah untuk dinikm
2022-10-30 12:45:15+00:00,catperku,liburan ke pantai serang blitar
2022-10-30 12:45:13+00:00,idbcpr,liburan ke pantai serang blitar
2022-10-30 12:45:09+00:00,almouve,dareendra lapor ke ayara kalo lagi di pantai
2022-10-30 12:45:09+00:00,wilandaa,pagi tadi bawa anak ke pantai ceria banget dia lari kesana kemari tapi ak takut banget dia jatuh trus trauma ga mau main lagi krna butuh perjuangan panjang utk dia mau main di pantai kyk anak2 lain
2022-10-30 12:43:42+00:00,soedrajyat,kamar satunya deket pantai ytta
2022-10-30 12:43:11+00:00,MRahizad,salah tu hotel menarik di penang pool dia nice teruk nak mandi pantai pun boleh sebab pantai depan tu jer lepas mandi p
2022-10-30 12:42:52+00:00,inidisdis,wishlist for my someone naik krl ke solo trs terkulineran pergi ke dieng piknik di pantai movie netflix date karimun jawa liat sunset or sunrise i hope one day aamiin
2022-10-30 12:42:12+00:00,_bangunsiang_,riquelme bukan pemain tercepat bukan pula paling berprestasi tapi sepak bola yg dia hadirkan begitu indah untuk dinikm
2022-10-30 12:42:12+00:00,InfoMadura3,bergantung pada kerajaan kerajaan islam di pantai utara jawa seperti demak gresik dan surabaya
2022-10-30 12:42:02+00:00,fariha_ramli,selalu homestay ada kolam je ni siap ada pantai boleh memuatkan 26 orang dengan 5 bilik tidur tts beach village seme
2022-10-30 12:41:51+00:00,shyilence,how s4 ep 3 di jeju lg kalau yg pas hyojin kan di deket pantai kalau sekarang view hamparan kebun teh pokoknya bukan daerah pantai deh terus ada gua gitu bagus bgt mereka jg ke kebun jeruk tp jeruknya jeruk keprok ijo yg sering ditemuin jg di indo
2022-10-30 12:41:50+00:00,in_confide,pantai dan laut bercerita
2022-10-30 12:41:50+00:00,DianaSinona,selalu homestay ada kolam je ni siap ada pantai boleh memuatkan 26 orang dengan 5 bilik tidur tts beach village seme
2022-10-30 12:40:22+00:00,saya_reza_,riquelme bukan pemain tercepat bukan pula paling berprestasi tapi sepak bola yg dia hadirkan begitu indah untuk dinikm
2022-10-30 12:40:16+00:00,SotoBuaya,riquelme bukan pemain tercepat bukan pula paling berprestasi tapi sepak bola yg dia hadirkan begitu indah untuk dinikm
2022-10-30 12:40:15+00:00,melejid,setelah itu lanjut ke arah pantai plengsengan yg banyak bgt resto penjual seafood murah2 krn gw masih kenyang yah akhirnya poto2 aja di sekitar pantai but next visit bakal coba makan di situ
2022-10-30 12:39:49+00:00,jamilnih,riquelme bukan pemain tercepat bukan pula paling berprestasi tapi sepak bola yg dia hadirkan begitu indah untuk dinikm
2022-10-30 12:39:35+00:00,aktivis45,alumni perikanan setelah sekian lama di dunia perikiri alhamdulillah ketemu air laut senja di pantai kuta bali
2022-10-30 12:38:50+00:00,najwaaastrong,ya allah ae padahal berencana ke pantai tu jauh jauh hari sudah sebelum ulangan
2022-10-30 12:38:19+00:00,bcszap,raaa ingin mengunjungi semua pantai yang ada di bumi
2022-10-30 12:38:16+00:00,mojojo_siomay,riquelme bukan pemain tercepat bukan pula paling berprestasi tapi sepak bola yg dia hadirkan begitu indah untuk dinikm
2022-10-30 12:38:14+00:00,BocahhKarbitann,riquelme bukan pemain tercepat bukan pula paling berprestasi tapi sepak bola yg dia hadirkan begitu indah untuk dinikm
2022-10-30 12:38:10+00:00,rdhaja,nemu hotel di lombok harganya cuma 200ribuan dongg cuma 2 menit ke pantai sengigi dan bisa jalan kakii hotelnya nye
2022-10-30 12:38:05+00:00,fansyudis,sumpah mau ke pantai
2022-10-30 12:37:20+00:00,hendypurbo,riquelme bukan pemain tercepat bukan pula paling berprestasi tapi sepak bola yg dia hadirkan begitu indah untuk dinikm
2022-10-30 12:37:13+00:00,ahnurdiin,riquelme bukan pemain tercepat bukan pula paling berprestasi tapi sepak bola yg dia hadirkan begitu indah untuk dinikm
2022-10-30 12:37:00+00:00,aki_fsya,salah tu hotel menarik di penang pool dia nice teruk nak mandi pantai pun boleh sebab pantai depan tu jer lepas mandi p
2022-10-30 12:36:45+00:00,Lazzxer,spoiler sebenernya ngga sih dia suka makima itu gara dimanipulasi atau otaknya di cuci sm makima karna bagi makima aki itu adalah alat buat rencana jahatnya aja jadi pas scene di pantai sm angel itu aki jg bingung kan knp dia bisa suka sm makima nah itu jawabannya
2022-10-30 12:36:45+00:00,Arya0086,siapa yang mau ikut ke pantai
2022-10-30 12:36:25+00:00,Agung_P92,riquelme bukan pemain tercepat bukan pula paling berprestasi tapi sepak bola yg dia hadirkan begitu indah untuk dinikm
2022-10-30 12:36:24+00:00,nrfzh27,selalu homestay ada kolam je ni siap ada pantai boleh memuatkan 26 orang dengan 5 bilik tidur tts beach village seme
2022-10-30 12:36:04+00:00,i_sunshain,nasi goreng bujang di tepi pantai
2022-10-30 12:35:41+00:00,xxsunflower_hc,oh ini dulu disebutnya pantai keong thn 2012 2013 tiap sore sepedaan disini sambil liati mas crush yg lagi sepedaan juga wkwk dulu tempatnya lebih bagus daripada sekarang sekarang jelek wkwk
2022-10-30 12:34:51+00:00,Braiiitmetaa,iyaa lmyan sklian liat orng mndi di pantai
2022-10-30 12:34:43+00:00,UndifinedPerson,riquelme bukan pemain tercepat bukan pula paling berprestasi tapi sepak bola yg dia hadirkan begitu indah untuk dinikm
2022-10-30 12:34:02+00:00,karennthoughts,btw gw pernah nemu waktu main di pantai cangkangnya putiiih betul bersih tp ak tinggalin dy sendirian
2022-10-30 12:33:59+00:00,thestorykids,tsk guys kalian konser nanti pada pake sepatu atau sepatu sendal rencana mau sekalian di pantai sih tapi bingung
2022-10-30 12:33:41+00:00,lapas_tegal,kakanwil kemenkumham jateng a yuspahruddin hari kedua kemah bakti pramuka tahun 2022 lapas batang kanwil kemenkumham jateng ikuti kegiatan kebersihan area pantai
2022-10-30 12:33:22+00:00,medikuhibiniuu,kalo bawa tamu dr jkt dibawa ke pantai boom bwi aja senengnya udh kek 7 hari 7 malem fotonya bisa 40 palagi kalo bawa group dr pt yg banya emak emaknya siap siap dahhhh
2022-10-30 12:32:59+00:00,detik_jatim,6 destinasi wisata alam di trenggalek ada tebing lingga pantai pelang
2022-10-30 12:32:00+00:00,Braiiitmetaa,pantai teluk pnyu cilacap
2022-10-30 12:31:16+00:00,catwiltraven,riquelme bukan pemain tercepat bukan pula paling berprestasi tapi sepak bola yg dia hadirkan begitu indah untuk dinikm
2022-10-30 12:30:45+00:00,bimodpdk_,riquelme bukan pemain tercepat bukan pula paling berprestasi tapi sepak bola yg dia hadirkan begitu indah untuk dinikm
2022-10-30 12:30:40+00:00,baiwiin2721_,pantai mana itu met
2022-10-30 12:29:53+00:00,BaasithIbnu,masih ingat dengan 942 project itu lho upaya pengendalian dampak musim hujan pengamanan pantai dan pengelolaan air dgn
2022-10-30 12:29:16+00:00,Diagoarmando31,riquelme bukan pemain tercepat bukan pula paling berprestasi tapi sepak bola yg dia hadirkan begitu indah untuk dinikm
2022-10-30 12:28:38+00:00,bbh_oldy,tahan dulu boss kebutuhan gas ue telah menjadi objek permainan para spekulan kapal lng menunggu harga ue naik lebih t
2022-10-30 12:28:23+00:00,LPKA_Kutoarjo,kakanwil kemenkumham jateng a yuspahruddin hari kedua kemah bakti pramuka tahun 2022 lapas batang kanwil kemenkumham jateng ikuti kegiatan kebersihan area pantai
2022-10-30 12:27:49+00:00,mohammadindunis,riquelme bukan pemain tercepat bukan pula paling berprestasi tapi sepak bola yg dia hadirkan begitu indah untuk dinikm
2022-10-30 12:27:31+00:00,bhp_semarang,breaking news berita ruang lingkup kerja kanwil kemenkumham jateng bhpsemarang ayuspahruddin kumhampasti kamipasti kumhamsemakinpasti kumham kemenkumhamri kemenkumham 2022semakinpasti kanwilkemenkumhamjateng
